title,link,metadata
T-5210 Pneumatic Temperature Transmitter Catalog Page,/viewer/document/xtOr7_OhwlxQEtwaIiLV7w,"Product code: T-5210-1116, T-5210-1009, T-5210-1113, T-5210-2005, T-5210-2006, T-5210-1007, T-5210-1008, T-5210-1004, T-5210-1005, T-5210-1006, T-5210-1151, T-5210-1001, T-5210-2008, T-5210-1114, T-5210-1002, T-5210-2003, T-5210-1144, T-5210-138, T-5210-2007, T-5210-1150, T-5210-2002, T-5210-1125, T-5210-1118, T-5210-602, T-5210-2001, T-5210-1124, T-5210-1135, T-5210-1123, T-5210-2004,Business: Building Automation and Controls,Brand: Johnson Controls,Category: Pneumatic Temperature Transmitter,Product: T-5210 Pneumatic Temperature Transmitter,Document Type: Catalog Page,Document Number: LIT-1921595"
T-8000 Remote Element Controller Catalog Page,/viewer/document/0le0Vgtz5aclXXpcXAOPZQ,"Product code: T-8000-6, T-8000-1, T-8000-3, T-800-1604, T-8000-618, T-8000-619, T-8000-4, T-800-1610, T-8000-16, T-8000-70, T-800-1603,Business: Building Automation and Controls,Brand: Johnson Controls,Category: Element Controller,Product: T-8000 Remote Element Controller,Document Type: Catalog Page,Document Number: LIT-1921580"
Valve Repacking Kit Installation Guide,/viewer/document/QOgNiLw3Y0nx1Q51DnK_cQ,"Product code: V-4322-620, V-9999-611, V9999-609,Business: Building Automation and Controls,Brand: Johnson Controls,Category: Other Valves and Actuators,Product: V-4322-620, V9999-609, V-9999-611,Document Revision: C,Document Type: Installation Guide,Part Number: 14-669-9"
"OM Titan Multistage Industrial Chillers, Up to 5,000 tons",/viewer/document/rW_egggvU5MHUri_hPAccQ,"Business: Chillers,Brand: YORK,Category: Centrifugal,Product: OM,Document Revision: 213,Document Type: Engineering Guide,Document Number: 160.72-EG1"
OM Titan Open Multistage Electric Drive Chiller Standard PLC Control Center,/viewer/document/j7nu_tQTkvNdef8X9svraA,"Business: Chillers,Brand: YORK,Category: Centrifugal,Product: OM,Document Revision: 213,Document Type: Engineering Guide,Document Number: 160.72-EG2"
exacqVision-Entrapass Installation Guide,/viewer/document/EBuxrN4uBhBPwxBXnEDRGg,"Brand: Exacq,Category: VMS Software,Document Type: Installation Guide"
At a Glance What’s New at Release,/viewer/document/3VRFRpadDtrPDIT6jZNnDQ,"Business: Building Automation and Controls,Brand: Metasys,Category: General System Information,Product: Metasys System,Version: 6.0,Document Type: Release Note,Document Number: LIT-12011825"
IOM Standard Control Panel Subassembly Mounted in a 16 in. x 20 in. Enclosure,/viewer/document/S6gW53tfMszKTe4qHvxiSQ,"Product code: SAJC00001F00, SAJA00001F00, SAJN00001F00, SAJF00001F00, SAJL00001F00, SAJB00001F00, SAJH00001F00, SAJD00001F00, SAJJ00001F00, SAJM00001F00, SAJG00001F00,Business: Building Automation and Controls,Brand: Metasys,Category: Control Panel,Product: IOM Control Panel,Document Type: Catalog Page,Document Number: LIT-1900468"
LN Series Communicating Sensors Product Bulletin,/viewer/document/tBGpjOUo1IcKxdgdN9q7gg,"Product code: LN-SVSEN-0G, LN-SVSENH-0, LN-SVSENH-0G, LN-SVSEN-0,Business: Building Automation and Controls,Brand: Johnson Controls,Category: Field Device,Product: LN Controller,Version: 6.0,Document Type: Product Bulletin,Document Number: LIT-12011779"
LN Series Controllers Overview Product Bulletin,/viewer/document/_cDx99GMs8zZBkiE4RWwuQ,"Product code: LN-WMOD868-0, LN-WMOD315-0,Business: Building Automation and Controls,Brand: Metasys,Category: Field Device,Product: LN Controller,Document Type: Product Bulletin,Document Number: LIT-1201979"
LN Series Free Programmable LN-PRG201-12 Controller Catalog Page,/viewer/document/_US8T83XSC_29Bdijx4Hmw,"Product code: LN-PRG203-12,Business: Building Automation and Controls,Brand: Johnson Controls,Category: Field Device,Product: LN Controller,Document Type: Catalog Page,Document Number: LIT-1900785"
LN Series Free Programmable LN-PRG201-12 Controller Product Bulletin,/viewer/document/QOGSk8qFolWbEeTMeW5SEQ,"Product code: LN-PRG203-12,Business: Building Automation and Controls,Brand: Johnson Controls,Category: Field Device,Product: LN Controller,Version: 6.0,Document Type: Product Bulletin,Document Number: LIT-12011776"
LN Series Free Programmable LN-PRG300-12 Controller Catalog Page,/viewer/document/fN95OcrIsTP4wF_yEDSvVg,"Product code: LN-PRG300-12, LN-PRG300-12G,Business: Building Automation and Controls,Brand: Johnson Controls,Category: Field Device,Product: LN Controller,Document Type: Catalog Page,Document Number: LIT-1900786"
LN Series Free Programmable LN-PRG300-12 Controller Product Bulletin,/viewer/document/43NOtRKjszf3UtYBeNg50Q,"Product code: LN-PRG300-12, LN-PRG300-12G,Business: Building Automation and Controls,Brand: Johnson Controls,Category: Field Device,Product: LN Controller,Version: 6.0,Document Type: Product Bulletin,Document Number: LIT-12011777"
LN Series Free Programmable LN-PRG4x0-12 Controller Catalog Page,/viewer/document/26TUeFBVCoIFhHAqJPWi5Q,"Product code: LN-PRG400-12, LN-PRG410-12, LN-PRG410-12G, LN-PRG400-12G,Business: Building Automation and Controls,Brand: Johnson Controls,Category: Field Device,Product: LN Controller,Document Type: Catalog Page,Document Number: LIT-1900787"
LN Series Free Programmable LN-PRG4x0-12 Controllers Product Bulletin,/viewer/document/JocR9Mq8KbBJCNV~pb6GLQ,"Product code: LN-PRG410-12G, LN-PRG410-12, LN-PRG400-12, LN-PRG400-12G,Business: Building Automation and Controls,Brand: Johnson Controls,Category: Field Device,Product: LN Controller,Version: 6.0,Document Type: Product Bulletin,Document Number: LIT-12011778"
LN Series Input/Output (I/O) Extension Modules and LN Communicating Sensors Subnetwork for LN-VAVCF-12 and LN-PRGxxx-12 Application Note,/viewer/document/MNHWajd5LJ7~BsensbCqJw,"Product code: LN-PRG300-12, LN-PRG410-12, LN-IOE420-0, LN-IOE410-0, LN-SVSENH-0, LN-SVSENx-0, LN-PRG600-12, LN-PRG203-12, LN-VAVCF-12, LN-IOE400-0, LN-PRG610-12, LN-PRG400-12,Business: Building Automation and Controls,Brand: Johnson Controls,Category: Field Device,Product: LN Controller,Version: 6.0,Document Type: Application Note,Document Number: LIT-12011815"
LN Series Variable Air Volume (VAV) LN-VAVCF-12 Controller Catalog Page,/viewer/document/ydZUB1OSjecvlB2lfP4fXQ,"Product code: LN-VAVCF-12,Business: Building Automation and Controls,Brand: Johnson Controls,Category: Field Device,Product: LN Controller,Document Type: Catalog Page,Document Number: LIT-1900784"
LN Series Variable Air Volume (VAV) LN-VAVCF-12 Controller Product Bulletin,/viewer/document/Y0K3F_f64vpX3_gae0xmEw,"Product code: LN-VAVCF-12, LN-VAVCF-12G,Business: Building Automation and Controls,Brand: Johnson Controls,Category: Field Device,Product: LN Controller,Version: 6.0,Document Type: Product Bulletin,Document Number: LIT-12011807"
LonWorks LN-Series Network Communication and Interface Guide Technical Bulletin,/viewer/document/ck39L2X9GANmQJmzyzX6hQ,"Product code: LN-BLDSW-0, TL-BLDSW-0,Business: Building Automation and Controls,Brand: Johnson Controls,Category: Field Device,Product: LN Controller,Version: 6.0,Document Type: Technical Bulletin,Document Number: LIT-12011253"
Metasys System Extended Architecture Remote Access Technical Bulletin,/viewer/document/VJ5u5AUWq6tr4q5TozgMHw,"Business: Building Automation and Controls,Brand: Metasys,Category: General System Information,Product: Metasys System,Version: 6.0,Document Type: Technical Bulletin,Document Number: LIT-1201691"
NCE Standard Control Panel Subassembly for a 16 in. x 20 in. Enclosure,/viewer/document/Gz9GeDLm3skhncYPwDv0jA,"Product code: SARB00001F04, SARF00001F00, SARD00001F00, SARF00001F04, SARC00001F04, SARE00001F04, SARA00001F04, SARE00001F00, SARC00001F00, SARB00001F00, SARA00001F00, SARD00001F04,Business: Building Automation and Controls,Brand: Metasys,Category: Control Panel,Product: Network Engine Control Panel,Document Type: Catalog Page,Document Number: LIT-1900449"
NCM45x0-2 Network Control Module Commissioning Guide,/viewer/document/JOdlVZNxoXXjjjygSt8GXw,"Product code: MS-NCM4510-2, MS-NCM4520-2,Business: Building Automation and Controls,Brand: Metasys,Category: Supervisory Device,Product: Network Control Module,Version: 6,Document Type: Commissioning Guide,Document Number: LIT-12011176"
Wireless Coordinator Control Panel Assembly Mounted in a 10 in. x 13 in. Enclosure Catalog Page,/viewer/document/pJn_NxtxH0e1WaC0vLtC4A,"Product code: PAWA00000HC0, PAWA00004HC0, PAWC00005HC0, PAWD00005HC0,Business: Building Automation and Controls,Brand: Johnson Controls,Category: Control Panel,Product: Wireless Coordinator Control Panel,Document Type: Catalog Page,Document Number: LIT-1900512"
Wireless Field Bus Coordinator Control Panel Assembly Mounted in a 24 in. x 36 in. Enclosure,/viewer/document/WbkuHYdgl0fAanAY2vIMlQ,"Product code: PAWARE001BH0, PAWARE001BH4, PAWARL001BH0,Business: Building Automation and Controls,Brand: Metasys,Category: Control Panel,Product: Wireless Device Control Panel,Document Type: Catalog Page,Document Number: LIT-1900514"
North American Emissions Compliance,/reader/rdXtucwSTRYFbhQejgGD1g/33WCZRRjHxAP9iS9vkBqTg,"Business: Building Automation and Controls,Brand: Metasys,Category: Field Device,Product: DIS: Local Controller Display,Version: 6,Document Type: Product Bulletin,Document Number: LIT-12011273"
Technical Specifications,/reader/rdXtucwSTRYFbhQejgGD1g/_ODqQR6zA6YFAOf44xMWEw,"Business: Building Automation and Controls,Brand: Metasys,Category: Field Device,Product: DIS: Local Controller Display,Version: 6,Document Type: Product Bulletin,Document Number: LIT-12011273"
Accessories,/reader/rdXtucwSTRYFbhQejgGD1g/nSq~~wQizloAEnnuHgVpgA,"Business: Building Automation and Controls,Brand: Metasys,Category: Field Device,Product: DIS: Local Controller Display,Version: 6,Document Type: Product Bulletin,Document Number: LIT-12011273"
DIS1710 Ordering Information,/reader/rdXtucwSTRYFbhQejgGD1g/rZae1_HS5jpl52epY9w0Ow,"Business: Building Automation and Controls,Brand: Metasys,Category: Field Device,Product: DIS: Local Controller Display,Version: 6,Document Type: Product Bulletin,Document Number: LIT-12011273"
Ordering Information,/reader/rdXtucwSTRYFbhQejgGD1g/i5WNaEvjY~ws7fJ42LzS6Q,"Business: Building Automation and Controls,Brand: Metasys,Category: Field Device,Product: DIS: Local Controller Display,Version: 6,Document Type: Product Bulletin,Document Number: LIT-12011273"
Repair Information,/reader/rdXtucwSTRYFbhQejgGD1g/YgspVr4xky2S~EoHo6dGxQ,"Business: Building Automation and Controls,Brand: Metasys,Category: Field Device,Product: DIS: Local Controller Display,Version: 6,Document Type: Product Bulletin,Document Number: LIT-12011273"
Conclusion,/reader/rdXtucwSTRYFbhQejgGD1g/TkJLGx2DwLQQh~SBxsiX~w,"Business: Building Automation and Controls,Brand: Metasys,Category: Field Device,Product: DIS: Local Controller Display,Version: 6,Document Type: Product Bulletin,Document Number: LIT-12011273"
Customized User Experience,/reader/rdXtucwSTRYFbhQejgGD1g/E5ViHM33UgfG8XPbwJ6pMg,"Business: Building Automation and Controls,Brand: Metasys,Category: Field Device,Product: DIS: Local Controller Display,Version: 6,Document Type: Product Bulletin,Document Number: LIT-12011273"
Customized Screen Content,/reader/rdXtucwSTRYFbhQejgGD1g/itIIYYKAxvuu1wIHDjQyqQ,"Business: Building Automation and Controls,Brand: Metasys,Category: Field Device,Product: DIS: Local Controller Display,Version: 6,Document Type: Product Bulletin,Document Number: LIT-12011273"
Controller Configuration Tool,/reader/rdXtucwSTRYFbhQejgGD1g/qgc~saaIyJnmtOUXS~al9Q,"Business: Building Automation and Controls,Brand: Metasys,Category: Field Device,Product: DIS: Local Controller Display,Version: 6,Document Type: Product Bulletin,Document Number: LIT-12011273"
Applications,/reader/rdXtucwSTRYFbhQejgGD1g/x0_sSiIwjghhCtLdl5AEbg,"Business: Building Automation and Controls,Brand: Metasys,Category: Field Device,Product: DIS: Local Controller Display,Version: 6,Document Type: Product Bulletin,Document Number: LIT-12011273"
Network Diagram,/reader/rdXtucwSTRYFbhQejgGD1g/wzEvxbTdpADsZGty2c9yOw,"Business: Building Automation and Controls,Brand: Metasys,Category: Field Device,Product: DIS: Local Controller Display,Version: 6,Document Type: Product Bulletin,Document Number: LIT-12011273"
Features and Benefits,/reader/rdXtucwSTRYFbhQejgGD1g/tUjzwjmgmm_Cto4MBRmE6Q,"Business: Building Automation and Controls,Brand: Metasys,Category: Field Device,Product: DIS: Local Controller Display,Version: 6,Document Type: Product Bulletin,Document Number: LIT-12011273"
DIS1710 Local Controller Display,/reader/rdXtucwSTRYFbhQejgGD1g/ZO0CRgaFS8H_sXF~HVSXOw,"Business: Building Automation and Controls,Brand: Metasys,Category: Field Device,Product: DIS: Local Controller Display,Version: 6,Document Type: Product Bulletin,Document Number: LIT-12011273"
NCM45x0-2 Series Network Control Module Installation Guide,/viewer/document/6~_m~uHdHvG7DzW97a5Hrw,"Product code: MS-NCM4510-2, MS-NCM4520-2,Business: Building Automation and Controls,Brand: Metasys,Category: Supervisory Device,Product: Network Control Module,Version: 6,Document Type: Installation Guide,Part Number: 24-10249-18"
IOM Standard Control Panel Assembly Mounted in a 16 in. x 20 in. Enclosure Catalog Page,/viewer/document/T4vJoqxocrbhswevF~apkw,"Product code: PAJC00001FH0, PAJG00001FH0, PAJH00001FH0, PAJF00001FH0, PAJL00001FH0, PAJD00001FH0, PAJJ00001FH0, PAJM00001FH0, PAJB00001FH0, PAJN00001FH0, PAJA00001FH0,Business: Building Automation and Controls,Brand: Metasys,Category: Control Panel,Product: IOM Control Panel,Document Type: Catalog Page,Document Number: LIT-1900467"
NCM45x0-2 Series Hardware and Software Options Technical Bulletin,/viewer/document/Zb~nAHGJTY017AgDG1656g,"Product code: MS-NCM4510-2, MS-NCM4520-2,Business: Building Automation and Controls,Brand: Metasys,Category: Supervisory Device,Product: Network Control Module,Document Type: Technical Bulletin,Document Number: LIT-12011180"
NCE Standard Control Panel Assembly Mounted in a 16 in. x 20 in. Enclosure,/viewer/document/8dZJ46RWGlRO6pm~bJS_AA,"Product code: PARB00001FC4, PARM00001FC0, PARF00001FC0, PARG00001FC0, PARC00001FC0, PARD00001FC0, PARK00001FC0, PARA00001FC0, PARA00001FC4, PARD00001FC4, PARF00001FC4, PARH00001FC0, PARE00001FC4, PARJ00001FC0, PARB00001FC0, PARC00001FC4, PARE00001FC0, PARL00001FC0,Business: Building Automation and Controls,Brand: Metasys,Category: Control Panel,Product: Network Engine Control Panel,Document Type: Catalog Page,Document Number: LIT-1900450"
NCM45x0-2 Network Control Module Catalog Page,/viewer/document/jCghIeO9LWDE7HGZEJtb3A,"Product code: MS-NCM4510-2, MS-NCM4520-2,Business: Building Automation and Controls,Brand: Metasys,Category: Supervisory Device,Product: Network Control Module,Version: 6,Document Type: Catalog Page,Document Number: LIT-1900362"
NCM45x0-2 Network Control Module Product Bulletin,/viewer/document/uZhOVKG2pX8BRvAsksQWrQ,"Product code: MS-NCM4510-2, MS-NCM4520-2,Business: Building Automation and Controls,Brand: Metasys,Category: Supervisory Device,Product: Network Control Module,Version: 6,Document Type: Product Bulletin,Document Number: LIT-12011173"
System 450 Series Reset Control Modules with Real-Time Clock and Relay Output,/viewer/document/46WROFuS1tJOYd0wA6M7Ww,"Product code: C450RCN, C450RCN-1C, C450RBN, C450RBN-1C,Business: Building Automation and Controls,Brand: PENN Controls,Category: System 450 Multi-Purpose Modular Control System,Product: C450RBN Reset Control Module One Relay Output, C450RCN Reset Control Module Two Relay Outputs,Series: System 450 Series,Document Revision: C,Document Type: Installation Guide,Part Number: 24-7664-2772"
Windows Server and Client and Active Directory,/viewer/document/iyJGeOabwTVeT0ZO0uIywg,"Brand: Exacq,Category: VMS Software,Document Type: User Guide"
YIA Style D Unit Single Stage Steam-Hot Water with OptiView Control Center,/viewer/document/h4maYP5u6PoFNa1_55EYbQ,"Business: Chillers,Brand: YORK,Category: Absorption,Product: YIA,Document Revision: 113,Document Type: Part List,Document Number: 155.21-RP2"
Microsoft SQL Server 2005 Standard Edition Runtime-Restricted Use Software End User License Agreement,/viewer/document/Ncjh4ct5hhsMfQVjY9I~9Q,"Business: Building Automation and Controls,Brand: Metasys,Category: Server,Product: SQL Server,Document Type: User Guide,Document Number: LIT-12011464"
YPC ParaFlow Two-Stage Direct-Fired YPC-FA-12SC thru YPC-FZ-19S and Steam-Fired YPC-ST-14SC thru YPC-ST-19S,/viewer/document/oIoK1h~JggJPglPVx2w1ig,"Business: Chillers,Brand: YORK,Category: Absorption,Product: YPC,Document Revision: 113,Document Type: Part List,Document Number: 155.17-RP3"
YIA IsoFlow Installation Checklist and Request for Authorized Startup Engineer,/viewer/document/1OEKu88jHb2MhA9Om5O7YQ,"Business: Chillers,Brand: YORK,Category: Absorption,Product: YIA,Document Revision: 113,Document Type: Checklist,Document Number: 155.16-CL1"
"YK Compressors YDHA, YDHB and YDHG High Speed Forward Thrust (029-20896-002, 029-20900-002) and Journal Bearing (064-48207-000, 064-48208-000) Design Change, Compressor",/viewer/document/8dw41rmI16O11A58VspPdw,"Business: Chillers,Brand: YORK,Category: Centrifugal,Product: YK,Document Revision: 113,Document Type: Service Information Letter,Document Number: SI0243"
Non-Addressable Visible Only (V/O) Amber Lens Strobes for Emergency Communications,/viewer/document/noCTJ0IfJ~XqObQDGf04TQ,"Brand: Simplex,Category: Notification Appliances and Speakers,Product: Visible Only Notification Appliance,Document Revision: 4,Document Type: Datasheet,Document Number: S4906-0008"
"Non-Coded Manual Stations for Hazardous Locations, Model 2099-9136 (Killark XAL-53)",/viewer/document/VpyYE3wHE6MDcfZAmFGNHw,"Brand: Simplex,Category: Notification Appliances and Speakers,Product: 2099-9136 Manual Station for Hazardous Locations (Killark XAL-53),Document Revision: 1,Document Type: Datasheet,Document Number: S2099-0008"
P721UTa SMART TEMP Universal 7-Day Programmable Touchscreen Thermostat Installation and Operating Guide,/viewer/document/coqNDecASOtC3d~sUAi~uw,"Business: Building Automation and Controls NA,Brand: LUX,Category: Programmable Thermostat,Product: P721UTa Programmable Thermostat,Document Type: Installation Guide, User Guide,Document Number: LIT-12013403"
IOM Series Technical Specifications,/reader/vElxx_OYN76hX1EPqZlEmA/kWOayYs1QB9QzDDSP_9QvA,"Business: Building Automation and Controls,Brand: Metasys,Category: Field Device,Product: IOM: Input/Output Module,Document Type: Catalog Page,Document Number: LIT-1900349"
Repair Information,/reader/vElxx_OYN76hX1EPqZlEmA/JS68~L6nw9ikttzDOA8I~Q,"Business: Building Automation and Controls,Brand: Metasys,Category: Field Device,Product: IOM: Input/Output Module,Document Type: Catalog Page,Document Number: LIT-1900349"
Accessories,/reader/vElxx_OYN76hX1EPqZlEmA/RrBpHScRvoCO0unXUOrxgQ,"Business: Building Automation and Controls,Brand: Metasys,Category: Field Device,Product: IOM: Input/Output Module,Document Type: Catalog Page,Document Number: LIT-1900349"
IOM Series for Smoke Control Ordering Information,/reader/vElxx_OYN76hX1EPqZlEmA/3sdrFMCUarGxNAbx7kSLzg,"Business: Building Automation and Controls,Brand: Metasys,Category: Field Device,Product: IOM: Input/Output Module,Document Type: Catalog Page,Document Number: LIT-1900349"
IOM Series Ordering Information,/reader/vElxx_OYN76hX1EPqZlEmA/hfgeuuwODxxtNh0AuD1RQQ,"Business: Building Automation and Controls,Brand: Metasys,Category: Field Device,Product: IOM: Input/Output Module,Document Type: Catalog Page,Document Number: LIT-1900349"
IOM Series Model Information (Including Point Type Counts),/reader/vElxx_OYN76hX1EPqZlEmA/YdZb6XL6I~dNAA17n~2DBg,"Business: Building Automation and Controls,Brand: Metasys,Category: Field Device,Product: IOM: Input/Output Module,Document Type: Catalog Page,Document Number: LIT-1900349"
Features,/reader/vElxx_OYN76hX1EPqZlEmA/yx4NDlVyRGk3B2esURbfIA,"Business: Building Automation and Controls,Brand: Metasys,Category: Field Device,Product: IOM: Input/Output Module,Document Type: Catalog Page,Document Number: LIT-1900349"
Application Documentation,/reader/vElxx_OYN76hX1EPqZlEmA/nSW2kfpNxn2_7j_ijMsrGA,"Business: Building Automation and Controls,Brand: Metasys,Category: Field Device,Product: IOM: Input/Output Module,Document Type: Catalog Page,Document Number: LIT-1900349"
Input/Output Module (IOM),/reader/vElxx_OYN76hX1EPqZlEmA/m773im84ol~E_xIhv6Jfmw,"Business: Building Automation and Controls,Brand: Metasys,Category: Field Device,Product: IOM: Input/Output Module,Document Type: Catalog Page,Document Number: LIT-1900349"
Single Point of Contact,/reader/J9vaCkh7aGjoZ1TMxEOVGA/virsaWBEOKX4~hCthfDSrQ,"Business: Building Automation and Controls,Brand: Johnson Controls,Category: Field Device,Document Type: Installation Guide,Document Number: LIT-12011795"
Technical Specifications,/reader/J9vaCkh7aGjoZ1TMxEOVGA/x6sFLjIzkaIuEInfQ9vtQA,"Business: Building Automation and Controls,Brand: Johnson Controls,Category: Field Device,Document Type: Installation Guide,Document Number: LIT-12011795"
Error Code Interpretation,/reader/J9vaCkh7aGjoZ1TMxEOVGA/YQ885XM5mfckN~3hRDeFAg,"Business: Building Automation and Controls,Brand: Johnson Controls,Category: Field Device,Document Type: Installation Guide,Document Number: LIT-12011795"
Troubleshooting,/reader/J9vaCkh7aGjoZ1TMxEOVGA/GAqlCiQNVD6_x3vNQ17Cew,"Business: Building Automation and Controls,Brand: Johnson Controls,Category: Field Device,Document Type: Installation Guide,Document Number: LIT-12011795"
LonWorks Network Access from the Sensor,/reader/J9vaCkh7aGjoZ1TMxEOVGA/GxNoEhIw32Xu_xHJGb9nXw,"Business: Building Automation and Controls,Brand: Johnson Controls,Category: Field Device,Document Type: Installation Guide,Document Number: LIT-12011795"
Setting the LAN Type,/reader/J9vaCkh7aGjoZ1TMxEOVGA/L0tLj7jVwOaFLkQXXj7yQw,"Business: Building Automation and Controls,Brand: Johnson Controls,Category: Field Device,Document Type: Installation Guide,Document Number: LIT-12011795"
Setting the LN Communicating Sensor Subnet ID,/reader/J9vaCkh7aGjoZ1TMxEOVGA/ehRmo6OKP14F5Jbgfxub5A,"Business: Building Automation and Controls,Brand: Johnson Controls,Category: Field Device,Document Type: Installation Guide,Document Number: LIT-12011795"
Subnetwork with LN-IOE4x-0-0 and LN-PRG6x0-12,/reader/J9vaCkh7aGjoZ1TMxEOVGA/9epbMcPbzp2gUCZsCqLH0g,"Business: Building Automation and Controls,Brand: Johnson Controls,Category: Field Device,Document Type: Installation Guide,Document Number: LIT-12011795"
Subnetwork with LN-VAVCF-12,/reader/J9vaCkh7aGjoZ1TMxEOVGA/gNsCY8yCKI8CkcQaoT_SeA,"Business: Building Automation and Controls,Brand: Johnson Controls,Category: Field Device,Document Type: Installation Guide,Document Number: LIT-12011795"
Subnetwork Bus Topology and EOL Terminations,/reader/J9vaCkh7aGjoZ1TMxEOVGA/ROfiuTMDFlWt_Ftn2_3hdw,"Business: Building Automation and Controls,Brand: Johnson Controls,Category: Field Device,Document Type: Installation Guide,Document Number: LIT-12011795"
Connection Cable,/reader/J9vaCkh7aGjoZ1TMxEOVGA/~xodUIEe0WsMyh2bK0s92g,"Business: Building Automation and Controls,Brand: Johnson Controls,Category: Field Device,Document Type: Installation Guide,Document Number: LIT-12011795"
Subnetwork Bus Total Length,/reader/J9vaCkh7aGjoZ1TMxEOVGA/g9hhesr6gPYSk0s~Ayvjmg,"Business: Building Automation and Controls,Brand: Johnson Controls,Category: Field Device,Document Type: Installation Guide,Document Number: LIT-12011795"
About the Subnetwork Bus,/reader/J9vaCkh7aGjoZ1TMxEOVGA/VP2kUJb3AkYgGJKrGN7O7w,"Business: Building Automation and Controls,Brand: Johnson Controls,Category: Field Device,Document Type: Installation Guide,Document Number: LIT-12011795"
Supported Quantity of Sensors Per Controller,/reader/J9vaCkh7aGjoZ1TMxEOVGA/k0TkqqCH5c~cEjurkgZk2A,"Business: Building Automation and Controls,Brand: Johnson Controls,Category: Field Device,Document Type: Installation Guide,Document Number: LIT-12011795"
Mounting Instructions,/reader/J9vaCkh7aGjoZ1TMxEOVGA/MtkxRJQ6tDr49sB_jAIplA,"Business: Building Automation and Controls,Brand: Johnson Controls,Category: Field Device,Document Type: Installation Guide,Document Number: LIT-12011795"
Location Considerations,/reader/J9vaCkh7aGjoZ1TMxEOVGA/VbZ~FNl_Q4vsbXq0CSl_7g,"Business: Building Automation and Controls,Brand: Johnson Controls,Category: Field Device,Document Type: Installation Guide,Document Number: LIT-12011795"
Dimensions,/reader/J9vaCkh7aGjoZ1TMxEOVGA/MboOZpG~snWMtRfV7EjStA,"Business: Building Automation and Controls,Brand: Johnson Controls,Category: Field Device,Document Type: Installation Guide,Document Number: LIT-12011795"
Installation,/reader/J9vaCkh7aGjoZ1TMxEOVGA/no6BjJyfVls5U9EY59sCTQ,"Business: Building Automation and Controls,Brand: Johnson Controls,Category: Field Device,Document Type: Installation Guide,Document Number: LIT-12011795"
North American Emissions Compliance,/reader/J9vaCkh7aGjoZ1TMxEOVGA/I4CX09yKNBBs9SYkj8DRug,"Business: Building Automation and Controls,Brand: Johnson Controls,Category: Field Device,Document Type: Installation Guide,Document Number: LIT-12011795"
Application,/reader/J9vaCkh7aGjoZ1TMxEOVGA/_oim5knYc_vFKFxyz9mAbw,"Business: Building Automation and Controls,Brand: Johnson Controls,Category: Field Device,Document Type: Installation Guide,Document Number: LIT-12011795"
Viewing and Modifying Network Variable or Configuration Properties in the Johnson Controls Browser,/reader/BfT2EhTaJrqFjWQJrS41gA/oU_XyKnBs6fPsgrD7u6RwQ,"Business: Building Automation and Controls,Brand: Johnson Controls,Category: Software Application,Document Type: Technical Bulletin,Document Number: LIT-12011250"
Changing Network Variable Type in the Johnson Controls Browser,/reader/BfT2EhTaJrqFjWQJrS41gA/Adn9A01nXy4gtctYYlQP4g,"Business: Building Automation and Controls,Brand: Johnson Controls,Category: Software Application,Document Type: Technical Bulletin,Document Number: LIT-12011250"
