title,link,metadata
VSD Series II Application Manual,/viewer/document/a_MFNL2qPXw9QEMkukAHPw,"Product code: VS011431B_0P9L4, VS011121B-0L400, VS011132B_SL300, VS016231B-SP300, VS014411B-0M100, VS011432B_0P300, VS014432B_0P3L3, VS011111B-SL400, VS011411B-0P600, VS012420B-L0000, VS016231B-SM1P3, VS011431B_SL400, VS011412B-SP300, VS014432B-0L300, VS011132B-S0000, VS016211B-S0000, VS014432B_0P4L3, VS016211B-SP600, VS011131B-SP900, VS014431B_0M1P3, VS016212B-SP3L3, VS011432B-SP400, VS011432B-0P7L3, VS014432B-SP300, VS016231B_0P6L4, VS011422B-00000, VS011421B-0P6L4, VS011431B-0L400, VS014422B-0P4L3, VS011131B_SP600, VS014431B_00000, VS014432B_0L300, VS011431B-SP3L4, VS011132B_0P3L3, VS016211B-0P3L4, VS011431B-0P3L4, VS011131B_SP3L4, VS016231B-S0000, VS016211B-0P600, VS011131B_SP9L4, VS011122B-SP3L3, VS011132B-00000, VS011131B_0P900, VS016231B-SP600, VS016212B-00000, VS011210B-L0000, VS014432B_SP4L3, VS011431B-0P900, VS016211B-SL400, VS011132B-SP3L3, VS011112B-SP3L3, VS011132B_0P7L3, VS011111B-S0000, VS014412B-SP7L3, VS016212B-0P4L3, VS016231B_SP3L4, VS011431B_SM1P3, VS011131B-0P900, VS011431B-SP600, VS011432B_SP3L3, VS011131B-SP3L4, VS014412B-00000, VS014432B-0P300, VS016231B-SP3L4, VS011431B_0P6L4, VS016222B-0P7L3, VS016231B_0P900, VS011122B-SP400, VS011421B-0P300, VS011122B-SP4L3, VS011431B-0M100, VS014431B_0P6L4, VS011432B_0P400, VS016231B_0P600, VS014411B-SL400, VS011431B-SM1P3, VS011432B-0P700, VS011131B-0P6L4, VS011432B_0P700, VS014431B_SP300, VS016231B_SM100, VS011421B-0M100, VS011220B-S0000, VS011121B-S0000, VS011112B-SL300, VS011411B-SP3L4, VS016212B-0P3L3, VS011421B-0L400, VS011132B_SP4L3, VS016231B-0M1P3, VS016221B-SM100, VS011431B_SP6L4, VS011122B-S0000, VS011431B-SP6L4, VS011432B-SP7L3, VS014431B-SL400, VS016231B_SP600, VS014431B_SP9L4, VS011431B_0P3L4, VS011421B-SP600, VS014422B-S0000, VS011112B-S0000, VS014412B-SP3L3, VS014422B-0P700, VS016221B-0P300, VS014431B_0P900, VS014412B-SP300, VS014421B-SM100, VS014431B-0P600, VS014432B-0P3L3, VS011122B-0P3L3, VS014431B-0P9L4, VS011131B-SP6L4, VS011412B-0P300, VS011411B-SP300, VS011422B-0P700, VS011412B-SL300, VS011412B-0P3L3, VS014422B-SL300, VS014432B_SP7L3, VS014432B_0P700, VS016231B_0L400, VS016231B-0P6L4, VS011131B_0P600, VS011431B_SP300, VS011432B_0L300, VS016231B-SP9, VS016211B-SP6L4, VS011432B_SP300, VS011412B-0L300, VS011422B-SL300, VS014431B_SM1P3, VS016231B-0P900, VS014421B-SP6L4, VS014431B_SM100, VS011431B_SP600, VS011131B-0M100, VS011411B-00000, VS016212B-0P7L3, VS011432B-0P3L3, VS014411B-0P300, VS011422B-S0000, VS014421B-S0000, VS011431B-0P600, VS011131B_0M1P3, VS014431B-0P3L4, VS011431B_0L400, VS014422B-0P3L3, VS011432B-S0000, VS011432B-SL300, VS014431B-SM1P3, VS011122B-SL300, VS011131B-0P3L4, VS011111B-0P300, VS011121B-0M100, VS016231B_0M100, VS011432B-0L300, VS016222B-SP400, VS011210B-00000, VS011431B-0P9L4, VS014432B_0P400, VS016222B-0L300, VS011411B-0P300, VS016222B-00000, VS011131B_0M100, VS011432B_SP700, VS011131B-0P9L4, VS011431B-00000, VS011132B_0P700, VS016231B_0P3L4, VS011121B-SP3L4, VS016211B-0L400, VS014432B_0P7L3, VS011131B-0P600, VS014412B-S0000, VS011432B-0P4L3, VS014422B-SP7L3, VS014431B_SP600, VS011122B-0P700, VS011431B-0P6L4, VS014411B-SP300, VS016231B_SP6L4, VS011131B-SP9L4, VS011422B-SP4L3, VS012420B-S0000, VS016211B-SP3L4, VS011132B-0P400, VS011220B-00000, VS011210B-S0000, VS014422B-0P300, VS014432B-SP3L3, VS011421B-SP3L4, VS014432B-0P400, VS011432B-0P300, VS011112B-00000, VS011132B_SP3L3, VS016222B-SL300, VS014432B-SP4L3, VS016231B-SP6L4, VS011131B_SM1P3, VS011422B-0P300, VS016231B_S0000, VS011132B-0P7L3, VS011121B-SP6L4, VS014411B-S0000, VS014431B-0M1P3, VS014432B_SL300, VS011432B_S0000, VS011411B-0P6L4, VS014431B-SP900, VS011112B-0P4L3, VS011132B-SL300, VS016211B-00000, VS016231B-0P3L4, VS011121B-0P300, VS014431B_0M100, VS011131B_0P6L4, VS016221B-00000, VS011122B-0P4L3, VS011111B-SP600, VS014412B-0P7L3, VS011131B_SP900, VS016212B-0P400, VS011432B-SP300, VS014421B-SP300, VS011111B-0P600, VS011411B-S0000, VS014432B-SL300, VS011122B-0P300, VS011131B-SM100, VS016221B-0P3L4, VS011431B-SL400, VS014431B_0P600, VS012210B-S0000, VS011411B-SP600, VS011431B-SP300, VS011431B_0P600, VS014431B-SP6L4, VS011111B-0M100, VS011431B_0P900, VS011132B-0P3L3, VS016231B-0P9L4, VS011132B-0P700, VS014422B-SP3L3, VS011432B_SP4L3, VS014411B-SP6L4, VS016211B-0M100, VS016231B-0P600, VS011220B-L0000, VS011131B_0P300, VS014421B-0M100, VS011132B-0L300, VS016222B-SP300, VS011131B_SM100, VS016231B_SM1P3, VS016211B-SM100, VS011131B_00000, VS014431B-0P6L4, VS014432B-S0000, VS011131B_SP300, VS011431B-SP9L4, VS014412B-0L300, VS014431B-SP600, VS014432B-SP400, VS014431B-0M100, VS011131B-0M1P3, VS011112B-0P7L3, VS016222B-S0000, VS016231B-SL400, VS014431B-00000, VS011131B-00000, VS014422B-00000, VS011132B-0P300, VS011422B-0P400, VS014412B-0P4L3, VS014412B-SP700, VS014432B-SP700, VS014432B_SP3L3, VS016231B-0L400, VS011431B_SM100, VS011131B-S0000, VS011411B-SL400, VS011131B_0L400, VS014411B-0P6L4, VS011432B_SP7L3, VS014432B-0P4L3, VS011412B-00000, VS016222B-SP700, VS014422B-0L300, VS011422B-SP700, VS011411B-0L400, VS016212B-S0000, VS012410B-S0000, VS011132B_0P4L3, VS011112B-0L300, VS016212B-0P700, VS016212B-SL300, VS016221B-0P6L4, VS011132B_0L300, VS011412B-SP4L3, VS011412B-SP7L3, VS011431B_SP3L4, VS014431B_SL400, VS014411B-0L400, VS014421B-SL400, VS011131B_0P9L4, VS016221B-SP3L4, VS014432B-00000, VS016221B-SP600, VS011121B-00000, VS014411B-0P3L4, VS011131B-SP300, VS011131B-0P300, VS011421B-SM100, VS011111B-0L400, VS016222B-SP7L3, VS011412B-S0000, VS016222B-SP4L3, VS011422B-0P4L3, VS016212B-0P300, VS011432B-SP4L3, VS011431B_0M100, VS014422B-SP300, VS011431B-0M1P3, VS011131B-SM1P3, VS011131B_SL400, VS011112B-0P3L3, VS012410B-L0000, VS014412B-SL300, VS014431B-SM100, VS014432B_SP700, VS014432B-SP7L3, VS011131B_SP6L4, VS011112B-SP4L3, VS014422B-SP400, VS014422B-SP4L3, VS011421B-0P600, VS011412B-SP400, VS011111B-0P6L4, VS012210B-00000, VS011111B-0P3L4, VS011132B_SP700, VS016231B-0P300, VS011121B-SL400, VS011431B_0P300, VS016221B-SL400, VS012210B-L0000, VS011122B-0P400, VS012220B-L0000, VS011132B_SP400, VS011432B_0P3L3, VS011132B_00000, VS012220B-00000, VS011421B-SP6L4, VS011131B_0P3L4, VS011431B_SP900, VS011431B-S0000, VS011421B-0P3L4, VS016231B_SP300, VS014412B-0P3L3, VS011412B-SP700, VS011412B-0P400, VS011432B_00000, VS011411B-SP6L4, VS011431B_S0000, VS011111B-SP300, VS016231B_0M1P3, VS014412B-SP400, VS014421B-0P600, VS014431B-S0000, VS011111B-00000, VS014431B-0P900, VS011112B-0P400, VS014421B-0P300, VS011121B-0P600, VS011122B-SP700, VS014432B_0P300, VS016231B_SL400, VS011431B-0P300, VS016211B-0P6L4, VS014412B-0P300, VS016222B-SP3L3, VS011422B-0P7L3, VS011432B_0P4L3, VS011421B-S0000, VS016231B-0M100, VS016231B_SP9L4, VS011131B-0L400, VS016231B-SP900, VS014431B_SP6L4, VS011121B-SM100, VS016222B-0P700, VS014432B_SP300, VS012410B-00000, VS016221B-0L400, VS012220B-S0000, VS011132B-0P4L3, VS016211B-0P300, VS011422B-0P3L3, VS014431B_0P3L4, VS016222B-0P4L3, VS014431B_0P300, VS014421B-0L400, VS014421B-SP600, VS016221B-SP300, VS011122B-SP300, VS011121B-0P6L4, VS011422B-SP3L3, VS014412B-0P700, VS014431B_SP900, VS014411B-00000, VS011122B-0L300, VS011412B-0P4L3, VS016231B-SM100, VS011121B-SP600, VS014432B_S0000, VS011121B-0P3L4, VS011412B-0P700, VS016231B_0P300, VS014431B-SP300, VS016212B-SP4L3, VS016212B-SP300, VS016212B-SP400, VS014431B_SP3L4, VS011132B_0P300, VS011112B-SP700, VS011412B-0P7L3, VS011421B-SL400, VS016231B-00000, VS011431B-SP900, VS011432B_0P7L3, VS014432B_SP400, VS011132B-SP4L3, VS014431B-SP9L4, VS014421B-00000, VS011132B-SP300, VS011111B-SM100, VS011431B_0M1P3, VS014412B-SP4L3, VS011132B-SP700, VS012420B-00000, VS011432B-SP700, VS011122B-00000, VS014422B-0P400, VS016212B-0L300, VS016212B-SP700, VS011432B-SP3L3, VS011112B-0P300, VS011411B-0M100, VS011411B-0P3L4, VS014421B-0P6L4, VS011131B-SL400, VS011121B-SP300, VS011111B-SP3L4, VS011122B-SP7L3, VS011112B-0P700, VS016212B-SP7L3, VS011132B-SP400, VS016222B-0P3L3, VS016211B-SP300, VS016222B-0P400, VS014432B-0P700, VS011112B-SP300, VS014431B-0L400, VS011112B-SP7L3, VS011112B-SP400, VS011422B-SP300, VS014421B-SP3L4, VS011431B-SM100, VS011432B-00000, VS011132B_S0000, VS014411B-SP3L4, VS014431B_0P9L4, VS014412B-0P400, VS011132B_0P400, VS011111B-SP6L4, VS011122B-0P7L3, VS014432B-0P7L3, VS011432B_SL300, VS016221B-SP6L4, VS016231B_SP900, VS014411B-0P600, VS016221B-0P600, VS011412B-SP3L3, VS011432B_SP400, VS014422B-0P7L3, VS011431B_SP9L4, VS014422B-SP700, VS014431B-0P300, VS014432B_00000, VS011422B-SP400, VS011422B-SP7L3, VS011132B-SP7L3, VS011131B_S0000, VS014411B-SP600, VS016221B-S0000, VS014431B-SP3L4, VS011132B_SP7L3, VS011431B_00000, VS011422B-0L300, VS014431B_0L400, VS011421B-00000, VS011432B-0P400, VS011131B-SP600, VS014421B-0P3L4, VS016231B_0P9L4, VS014411B-SM100, VS016221B-0M100, VS014431B_S0000, VS016231B_00000, VS016222B-0P300, VS011411B-SM100, VS011132B_SP300, VS011421B-SP300,Business: Building Automation and Controls,Brand: Johnson Controls,Category: Motor Control,Product: VSD Series II Drive,Document Type: Technical Bulletin,Document Number: LIT-12011771"
VSD Series II Quick Start Guide,/viewer/document/oYM9iNjtzV8lPvvXIomtAg,"Product code: VS011431B_0P9L4, VS011121B-0L400, VS011132B_SL300, VS016231B-SP300, VS014411B-0M100, VS011432B_0P300, VS014432B_0P3L3, VS011111B-SL400, VS011411B-0P600, VS012420B-L0000, VS016231B-SM1P3, VS011431B_SL400, VS011412B-SP300, VS014432B-0L300, VS011132B-S0000, VS016211B-S0000, VS014432B_0P4L3, VS016211B-SP600, VS011131B-SP900, VS014431B_0M1P3, VS016212B-SP3L3, VS011432B-SP400, VS011432B-0P7L3, VS014432B-SP300, VS016231B_0P6L4, VS011422B-00000, VS011421B-0P6L4, VS011431B-0L400, VS014422B-0P4L3, VS011131B_SP600, VS014431B_00000, VS014432B_0L300, VS011431B-SP3L4, VS011132B_0P3L3, VS016211B-0P3L4, VS011431B-0P3L4, VS011131B_SP3L4, VS016231B-S0000, VS016211B-0P600, VS011131B_SP9L4, VS011122B-SP3L3, VS011132B-00000, VS011131B_0P900, VS016231B-SP600, VS016212B-00000, VS011210B-L0000, VS014432B_SP4L3, VS011431B-0P900, VS016211B-SL400, VS011132B-SP3L3, VS011112B-SP3L3, VS011132B_0P7L3, VS011111B-S0000, VS014412B-SP7L3, VS016212B-0P4L3, VS016231B_SP3L4, VS011431B_SM1P3, VS011131B-0P900, VS011431B-SP600, VS011432B_SP3L3, VS011131B-SP3L4, VS014412B-00000, VS014432B-0P300, VS016231B-SP3L4, VS011431B_0P6L4, VS016222B-0P7L3, VS016231B_0P900, VS011122B-SP400, VS011421B-0P300, VS011122B-SP4L3, VS011431B-0M100, VS014431B_0P6L4, VS011432B_0P400, VS016231B_0P600, VS014411B-SL400, VS011431B-SM1P3, VS011432B-0P700, VS011131B-0P6L4, VS011432B_0P700, VS014431B_SP300, VS016231B_SM100, VS011421B-0M100, VS011220B-S0000, VS011121B-S0000, VS011112B-SL300, VS011411B-SP3L4, VS016212B-0P3L3, VS011421B-0L400, VS011132B_SP4L3, VS016231B-0M1P3, VS016221B-SM100, VS011431B_SP6L4, VS011122B-S0000, VS011431B-SP6L4, VS011432B-SP7L3, VS014431B-SL400, VS016231B_SP600, VS014431B_SP9L4, VS011431B_0P3L4, VS011421B-SP600, VS014422B-S0000, VS011112B-S0000, VS014412B-SP3L3, VS014422B-0P700, VS016221B-0P300, VS014431B_0P900, VS014412B-SP300, VS014421B-SM100, VS014431B-0P600, VS014432B-0P3L3, VS011122B-0P3L3, VS014431B-0P9L4, VS011131B-SP6L4, VS011412B-0P300, VS011411B-SP300, VS011422B-0P700, VS011412B-SL300, VS011412B-0P3L3, VS014422B-SL300, VS014432B_SP7L3, VS014432B_0P700, VS016231B_0L400, VS016231B-0P6L4, VS011131B_0P600, VS011431B_SP300, VS011432B_0L300, VS016231B-SP9, VS016211B-SP6L4, VS011432B_SP300, VS011412B-0L300, VS011422B-SL300, VS014431B_SM1P3, VS016231B-0P900, VS014421B-SP6L4, VS014431B_SM100, VS011431B_SP600, VS011131B-0M100, VS011411B-00000, VS016212B-0P7L3, VS011432B-0P3L3, VS014411B-0P300, VS011422B-S0000, VS014421B-S0000, VS011431B-0P600, VS011131B_0M1P3, VS014431B-0P3L4, VS011431B_0L400, VS014422B-0P3L3, VS011432B-S0000, VS011432B-SL300, VS014431B-SM1P3, VS011122B-SL300, VS011131B-0P3L4, VS011111B-0P300, VS011121B-0M100, VS016231B_0M100, VS011432B-0L300, VS016222B-SP400, VS011210B-00000, VS011431B-0P9L4, VS014432B_0P400, VS016222B-0L300, VS011411B-0P300, VS016222B-00000, VS011131B_0M100, VS011432B_SP700, VS011131B-0P9L4, VS011431B-00000, VS011132B_0P700, VS016231B_0P3L4, VS011121B-SP3L4, VS016211B-0L400, VS014432B_0P7L3, VS011131B-0P600, VS014412B-S0000, VS011432B-0P4L3, VS014422B-SP7L3, VS014431B_SP600, VS011122B-0P700, VS011431B-0P6L4, VS014411B-SP300, VS016231B_SP6L4, VS011131B-SP9L4, VS011422B-SP4L3, VS012420B-S0000, VS016211B-SP3L4, VS011132B-0P400, VS011220B-00000, VS011210B-S0000, VS014422B-0P300, VS014432B-SP3L3, VS011421B-SP3L4, VS014432B-0P400, VS011432B-0P300, VS011112B-00000, VS011132B_SP3L3, VS016222B-SL300, VS014432B-SP4L3, VS016231B-SP6L4, VS011131B_SM1P3, VS011422B-0P300, VS016231B_S0000, VS011132B-0P7L3, VS011121B-SP6L4, VS014411B-S0000, VS014431B-0M1P3, VS014432B_SL300, VS011432B_S0000, VS011411B-0P6L4, VS014431B-SP900, VS011112B-0P4L3, VS011132B-SL300, VS016211B-00000, VS016231B-0P3L4, VS011121B-0P300, VS014431B_0M100, VS011131B_0P6L4, VS016221B-00000, VS011122B-0P4L3, VS011111B-SP600, VS014412B-0P7L3, VS011131B_SP900, VS016212B-0P400, VS011432B-SP300, VS014421B-SP300, VS011111B-0P600, VS011411B-S0000, VS014432B-SL300, VS011122B-0P300, VS011131B-SM100, VS016221B-0P3L4, VS011431B-SL400, VS014431B_0P600, VS012210B-S0000, VS011411B-SP600, VS011431B-SP300, VS011431B_0P600, VS014431B-SP6L4, VS011111B-0M100, VS011431B_0P900, VS011132B-0P3L3, VS016231B-0P9L4, VS011132B-0P700, VS014422B-SP3L3, VS011432B_SP4L3, VS014411B-SP6L4, VS016211B-0M100, VS016231B-0P600, VS011220B-L0000, VS011131B_0P300, VS014421B-0M100, VS011132B-0L300, VS016222B-SP300, VS011131B_SM100, VS016231B_SM1P3, VS016211B-SM100, VS011131B_00000, VS014431B-0P6L4, VS014432B-S0000, VS011131B_SP300, VS011431B-SP9L4, VS014412B-0L300, VS014431B-SP600, VS014432B-SP400, VS014431B-0M100, VS011131B-0M1P3, VS011112B-0P7L3, VS016222B-S0000, VS016231B-SL400, VS014431B-00000, VS011131B-00000, VS014422B-00000, VS011132B-0P300, VS011422B-0P400, VS014412B-0P4L3, VS014412B-SP700, VS014432B-SP700, VS014432B_SP3L3, VS016231B-0L400, VS011431B_SM100, VS011131B-S0000, VS011411B-SL400, VS011131B_0L400, VS014411B-0P6L4, VS011432B_SP7L3, VS014432B-0P4L3, VS011412B-00000, VS016222B-SP700, VS014422B-0L300, VS011422B-SP700, VS011411B-0L400, VS016212B-S0000, VS012410B-S0000, VS011132B_0P4L3, VS011112B-0L300, VS016212B-0P700, VS016212B-SL300, VS016221B-0P6L4, VS011132B_0L300, VS011412B-SP4L3, VS011412B-SP7L3, VS011431B_SP3L4, VS014431B_SL400, VS014411B-0L400, VS014421B-SL400, VS011131B_0P9L4, VS016221B-SP3L4, VS014432B-00000, VS016221B-SP600, VS011121B-00000, VS014411B-0P3L4, VS011131B-SP300, VS011131B-0P300, VS011421B-SM100, VS011111B-0L400, VS016222B-SP7L3, VS011412B-S0000, VS016222B-SP4L3, VS011422B-0P4L3, VS016212B-0P300, VS011432B-SP4L3, VS011431B_0M100, VS014422B-SP300, VS011431B-0M1P3, VS011131B-SM1P3, VS011131B_SL400, VS011112B-0P3L3, VS012410B-L0000, VS014412B-SL300, VS014431B-SM100, VS014432B_SP700, VS014432B-SP7L3, VS011131B_SP6L4, VS011112B-SP4L3, VS014422B-SP400, VS014422B-SP4L3, VS011421B-0P600, VS011412B-SP400, VS011111B-0P6L4, VS012210B-00000, VS011111B-0P3L4, VS011132B_SP700, VS016231B-0P300, VS011121B-SL400, VS011431B_0P300, VS016221B-SL400, VS012210B-L0000, VS011122B-0P400, VS012220B-L0000, VS011132B_SP400, VS011432B_0P3L3, VS011132B_00000, VS012220B-00000, VS011421B-SP6L4, VS011131B_0P3L4, VS011431B_SP900, VS011431B-S0000, VS011421B-0P3L4, VS016231B_SP300, VS014412B-0P3L3, VS011412B-SP700, VS011412B-0P400, VS011432B_00000, VS011411B-SP6L4, VS011431B_S0000, VS011111B-SP300, VS016231B_0M1P3, VS014412B-SP400, VS014421B-0P600, VS014431B-S0000, VS011111B-00000, VS014431B-0P900, VS011112B-0P400, VS014421B-0P300, VS011121B-0P600, VS011122B-SP700, VS014432B_0P300, VS016231B_SL400, VS011431B-0P300, VS016211B-0P6L4, VS014412B-0P300, VS016222B-SP3L3, VS011422B-0P7L3, VS011432B_0P4L3, VS011421B-S0000, VS016231B-0M100, VS016231B_SP9L4, VS011131B-0L400, VS016231B-SP900, VS014431B_SP6L4, VS011121B-SM100, VS016222B-0P700, VS014432B_SP300, VS012410B-00000, VS016221B-0L400, VS012220B-S0000, VS011132B-0P4L3, VS016211B-0P300, VS011422B-0P3L3, VS014431B_0P3L4, VS016222B-0P4L3, VS014431B_0P300, VS014421B-0L400, VS014421B-SP600, VS016221B-SP300, VS011122B-SP300, VS011121B-0P6L4, VS011422B-SP3L3, VS014412B-0P700, VS014431B_SP900, VS014411B-00000, VS011122B-0L300, VS011412B-0P4L3, VS016231B-SM100, VS011121B-SP600, VS014432B_S0000, VS011121B-0P3L4, VS011412B-0P700, VS016231B_0P300, VS014431B-SP300, VS016212B-SP4L3, VS016212B-SP300, VS016212B-SP400, VS014431B_SP3L4, VS011132B_0P300, VS011112B-SP700, VS011412B-0P7L3, VS011421B-SL400, VS016231B-00000, VS011431B-SP900, VS011432B_0P7L3, VS014432B_SP400, VS011132B-SP4L3, VS014431B-SP9L4, VS014421B-00000, VS011132B-SP300, VS011111B-SM100, VS011431B_0M1P3, VS014412B-SP4L3, VS011132B-SP700, VS012420B-00000, VS011432B-SP700, VS011122B-00000, VS014422B-0P400, VS016212B-0L300, VS016212B-SP700, VS011432B-SP3L3, VS011112B-0P300, VS011411B-0M100, VS011411B-0P3L4, VS014421B-0P6L4, VS011131B-SL400, VS011121B-SP300, VS011111B-SP3L4, VS011122B-SP7L3, VS011112B-0P700, VS016212B-SP7L3, VS011132B-SP400, VS016222B-0P3L3, VS016211B-SP300, VS016222B-0P400, VS014432B-0P700, VS011112B-SP300, VS014431B-0L400, VS011112B-SP7L3, VS011112B-SP400, VS011422B-SP300, VS014421B-SP3L4, VS011431B-SM100, VS011432B-00000, VS011132B_S0000, VS014411B-SP3L4, VS014431B_0P9L4, VS014412B-0P400, VS011132B_0P400, VS011111B-SP6L4, VS011122B-0P7L3, VS014432B-0P7L3, VS011432B_SL300, VS016221B-SP6L4, VS016231B_SP900, VS014411B-0P600, VS016221B-0P600, VS011412B-SP3L3, VS011432B_SP400, VS014422B-0P7L3, VS011431B_SP9L4, VS014422B-SP700, VS014431B-0P300, VS014432B_00000, VS011422B-SP400, VS011422B-SP7L3, VS011132B-SP7L3, VS011131B_S0000, VS014411B-SP600, VS016221B-S0000, VS014431B-SP3L4, VS011132B_SP7L3, VS011431B_00000, VS011422B-0L300, VS014431B_0L400, VS011421B-00000, VS011432B-0P400, VS011131B-SP600, VS014421B-0P3L4, VS016231B_0P9L4, VS014411B-SM100, VS016221B-0M100, VS014431B_S0000, VS016231B_00000, VS016222B-0P300, VS011411B-SM100, VS011132B_SP300, VS011421B-SP300,Business: Building Automation and Controls,Brand: Johnson Controls,Category: Motor Control,Product: VSD Series II Drive,Document Type: Quick Start Guide,Document Number: LIT-12011773"
VSD Series II Variable Speed Micro Drive (VSM II) User Manual,/viewer/document/SVqPHfOg~pcxAlrk4og1Bg,"Product code: VS1D7204B-M0000, VS4D3403D-MEM00, VS031203D-MEM00, VS1D7203B-M0000, VS4D8004D-M0000, VS4D3403D-M0000, VS9D0403D-MEM00, VS4D8204B-M0000, VS2D8204D-MEM00, VS038403D-M0000, VS031203D-M0000, VS2D8203B-M0000, VS038203D-MEM00, VS025203B-MEM00, VS3D9503D-M0000, VS2D4004B-M0000, VS3D7204B-M0000, VS031403D-M0000, VS2D4203B-M0000, VS017203B-M0000, VS016403B-M0000, VS2D8004D-M0000, VS1D3403D-MEM00, VS025203D-M0000, VS2D8004B-M0000, VS7D0203B-M0000, VS031403D-MEM00, VS7D0204B-MEM00, VS1D7004D-M0000, VS3D7204B-MEM00, VS6D1503D-M0000, VS9D6204D-M0000, VS038203B-M0000, VS1D3403B-MEM00, VS011203D-M0000, VS2D4204D-M0000, VS7D6403B-MEM00, VS9D0503B-M0000, VS2D4204D-MEM00, VS038403D-MEM00, VS014403B-MEM00, VS023403D-MEM00, VS1D7204D-MEM00, VS3D7004D-M0000, VS2D4203D-M0000, VS038203D-M0000, VS4D3403B-MEM00, VS7D0204D-M0000, VS1D9403B-M0000, VS012403D-MEM00, VS014403D-MEM00, VS3D3403B-M0000, VS038203B-MEM00, VS1D3403D-M0000, VS012403D-M0000, VS7D6403B-M0000, VS1D9403D-M0000, VS2D4004D-M0000, VS2D4204B-M0000, VS7D6403D-M0000, VS9D6204B-MEM00, VS2D4403D-M0000, VS3D3403D-MEM00, VS016403D-MEM00, VS023403B-MEM00, VS2D4403B-MEM00, VS4D8203B-M0000, VS011203B-M0000, VS2D7503D-M0000, VS2D8203D-M0000, VS3D3403B-MEM00, VS017203B-MEM00, VS9D0403B-MEM00, VS012403B-M0000, VS016403B-MEM00, VS9D6204B-M0000, VS7D0204D-MEM00, VS014403B-M0000, VS012403B-MEM00, VS4D8204D-MEM00, VS1D7204B-MEM00, VS1D7204D-M0000, VS2D4403D-MEM00, VS3D3403D-M0000, VS4D8204B-MEM00, VS1D3403B-M0000, VS7D0203D-M0000, VS025203D-MEM00, VS031203B-M0000, VS031403B-MEM00, VS3D7204D-MEM00, VS9D6204D-MEM00, VS9D0403B-M0000, VS3D7204D-M0000, VS016403D-M0000, VS1D7503B-M0000, VS017203D-M0000, VS1D7203D-M0000, VS2D4403B-M0000, VS1D9403B-MEM00, VS4D8203D-M0000, VS3D7004B-M0000, VS9D0403D-M0000, VS1D9403D-MEM00, VS4D3403B-M0000, VS2D7503B-M0000, VS014403D-M0000, VS7D0204B-M0000, VS031403B-M0000, VS025203B-M0000, VS2D8204B-M0000, VS9D0503D-M0000, VS3D9503B-M0000, VS023403D-M0000, VS031203B-MEM00, VS023403B-M0000, VS1D7503D-M0000, VS5D6403B-MEM00, VS6D1503B-M0000, VS4D8204D-M0000, VS4D8004B-M0000, VS5D6403D-MEM00, VS017203D-MEM00, VS3D7203D-M0000, VS5D6403D-M0000, VS038403B-M0000, VS3D7203B-M0000, VS2D8204D-M0000, VS7D6403D-MEM00, VS1D7004B-M0000, VS5D6403B-M0000, VS038403B-MEM00, VS2D4204B-MEM00, VS2D8204B-MEM00,Business: Building Automation and Controls,Brand: Johnson Controls,Category: Motor Control,Product: VSD Series II Micro Drive,Document Type: User Guide,Document Number: LIT-12011835"
LN-PRG Standard Control Panel Subassembly Catalog Page,/viewer/document/JH1X01QSwUKDUzxJ26FwTA,"Product code: SAL800002A00, SAL400001A00, SAL700002B00, SAL600002A00, SAL500001A00,Business: Building Automation and Controls,Brand: Johnson Controls,Category: Control Panel,Product: LN Standard Control Panel,Document Type: Catalog Page,Document Number: LIT-1900827"
Panoptix® Data Loader Technical Bulletin,/viewer/document/lXDDEIyorjbOLdiMEhNkaw,"Product code: PX-BASET3-0, PX-BASE-0, PX-BASET5-0, PX-BASET4-0, PX-BASET6-0, PX-BASET1-0, PX-BASET2-0,Business: Building Automation and Controls,Brand: Johnson Controls,Category: Software Application,Product: Panoptix Platform,Document Type: Technical Bulletin,Document Number: LIT-12011738"
V-9502 Pneumatic Valve Actuator Positioners Product Bulletin,/viewer/document/_Nbo9XibrSMbgJH6vMhVeA,"Product code: V-510-104, V-510-102, V-9502-8106, V-9502-23, V-9502-8033, V-9502-101, V-510-101, V-9502-91, V-9502-20, V-9502-95, V-9502-76, V-9502-15, V-9502-6, V-510-107, V-510-106, V-9502-1, V-510-100, V-9502-19, V-510-105, V-9502-16, V-510-103, V-9502-90, V-9502-75, V-9502-5, V-9502-600, V-9502-100, V-9999-630, V-9502-6801, V-9502-8102, V-9502-4, V-9502-6803, V-9502-3, V-9502-2, V-9502-6802, V-9502-8100,Business: Building Automation and Controls,Brand: Johnson Controls,Category: Pneumatic Actuator,Product: V-9502,Document Type: Product Bulletin,Document Number: LIT-977265"
YIA Style D Single Stage Steam-Hot Water with OptiView Control Center,/viewer/document/W6obOl3grLTtgearQivtTg,"Business: Chillers,Brand: YORK,Category: Absorption, Control Panel,Product: YIA,Document Revision: 513,Document Type: Installation Guide,Document Number: 155.21-N1"
exacqVision Soleratec Integration Guide,/viewer/document/g6X4InXYl6IkTIRs2CkitA,"Brand: Exacq,Category: VMS Software,Document Type: Integration Guide"
M9000-618-C Valve Linkage Kit (for VF6000 Butterfly Valve DN50/65) Installation Instructions,/viewer/document/0J0MpCfAbtDGC2~5QluKdg,"Business: Building Automation and Controls APAC,Brand: Johnson Controls,Category: Butterfly Valve and Actuator,Product: M9000-618-C,Document Type: Installation Guide,Document Number: 602M-BO1A-NA"
Circuit Protection; Model 2081-9028 Isolated Loop Circuit Protector (ILCP),/viewer/document/3qtsT58xvpf0NlIYmeVj3w,"Brand: Simplex,Category: Accessories,Product: Isolated Circuit Protector,Document Revision: 8,Document Type: Datasheet,Document Number: S2081-0008"
INTEVO Compact Integrated Security Platform Datasheet,/viewer/document/hgAGB2LXkJSBO_upbO3_vg,"Brand: Kantech,Category: Integrated Security Platform,Product: Intevo,Document Revision: R01,Document Type: Datasheet,Document Number: KT0306-DS-201305-R01-A4-EN"
Introducing the 4100ES Series of Fire Detection and Control Products,/viewer/document/YgWT~duJpdeDJEMDEeXG2A,"Brand: Simplex,Category: Fire Alarm Control Unit,Product: 4100ES series Fire Alarm Control Units,Document Revision: 2,Document Type: Datasheet,Document Number: S4100-0060"
Large Tonnage and Small Tonnage Chillers: Oil Shelf Life,/viewer/document/tSKaCtCL31kMoy_TWxyDdQ,"Business: Chillers,Brand: YORK,Category: All Chillers,Product: All Chillers,Document Revision: 513,Document Type: Service Information Letter,Document Number: SI0002"
VFD66 Drive User Guide,/viewer/document/a0wGB8aMQzHC2a4Q74Oa8Q,"Product code: VFD66FAA-2, VFD66EBA-2, VFD66CAA-2, VFD66DAA-2, VFD66AAA-2, VFD66BAA-2,Business: Building Automation and Controls,Brand: Johnson Controls,Category: Motor Control,Product: VFD66 Drive,Document Type: User Guide,Part Number: 24-10511-90"
"Chillers Shaft Alignment, Compressor",/viewer/document/fmiJv8jb83zWtQYBJkmyMA,"Business: Chillers,Brand: YORK,Category: All Chillers,Product: All Chillers,Document Revision: 203,Document Type: Service Information Letter,Document Number: SI0056"
"YCWL0056-0156 Scroll Chillers User Input Wiring Error, Control Panel",/viewer/document/amp20Q4Wo6Y0z0EowLG6yw,"Business: Chillers,Brand: YORK,Category: Scroll Water Cooled,Product: YCWL,Document Revision: 907,Document Type: Service Information Letter,Document Number: SI0172"
Custom Analyzer Technical Bulletin,/viewer/document/WmNJISh_XCJFMFhfgPxRlA,"Product code: PX-CUSTOMT3-0, PX-CUSTOM-0, PX-CUSTOMT1-0, PX-CUSTOMT5-0, PX-CUSTOMT6-0, PX-CUSTOMT4-0, PX-CUSTOMT2-0,Business: Building Automation and Controls,Brand: Johnson Controls,Category: Software Application,Product: Panoptix Platform,Document Type: Technical Bulletin,Document Number: LIT-12011732"
exacqVision ELERTS Integration Guide,/viewer/document/G0aQZJKbRSN9Z200zqfcjQ,"Brand: Exacq,Category: VMS Software,Document Type: Integration Guide"
exacqVision to XBR Retail Analytics Integration Guide,/viewer/document/_mLTMw8dyTlRseFQ~ZFCuQ,"Brand: Exacq,Category: VMS Software,Document Type: Integration Guide"
LN Series Wireless Receiver Module Catalog Page,/viewer/document/JfluGxIIeg9SOq2g~gPg3A,"Product code: LN-WMOD315-0, LN-WMOD868-0,Business: Building Automation and Controls,Brand: Johnson Controls,Category: Field Device,Product: LN Controller,Document Type: Catalog Page,Document Number: LIT-1900667"
exacqVision Crestron Serial Integration Guide,/viewer/document/qVAU8vNQVI503g1rXyXgtQ,"Brand: Exacq,Category: VMS Software,Document Type: Integration Guide"
