title,link,metadata
Oversized Staged Systems,/reader/vFJWRBz6PiZQlIJFMyW3IQ/eDNPKk1H3XEUBMR~g8JqBA,"Business: Building Automation and Controls,Brand: Metasys,Category: General System Information,Product: Metasys System,Version: 10.2,Document Type: User Guide,Document Number: LIT-12011810"
Delay Time Dominant Systems,/reader/vFJWRBz6PiZQlIJFMyW3IQ/uwuZ2AuVAQRlkOOSccYwPg,"Business: Building Automation and Controls,Brand: Metasys,Category: General System Information,Product: Metasys System,Version: 10.2,Document Type: User Guide,Document Number: LIT-12011810"
Redundant Systems,/reader/vFJWRBz6PiZQlIJFMyW3IQ/qOsFAJ3CPlWHO57YChjnMg,"Business: Building Automation and Controls,Brand: Metasys,Category: General System Information,Product: Metasys System,Version: 10.2,Document Type: User Guide,Document Number: LIT-12011810"
Systems Not Suited for PRAC+,/reader/vFJWRBz6PiZQlIJFMyW3IQ/_f6pGA6OkJLx_97tKBTy4w,"Business: Building Automation and Controls,Brand: Metasys,Category: General System Information,Product: Metasys System,Version: 10.2,Document Type: User Guide,Document Number: LIT-12011810"
Critical Data Points,/reader/vFJWRBz6PiZQlIJFMyW3IQ/HrHAE92tLOLLzHnpOaLbDw,"Business: Building Automation and Controls,Brand: Metasys,Category: General System Information,Product: Metasys System,Version: 10.2,Document Type: User Guide,Document Number: LIT-12011810"
Trend Studies,/reader/vFJWRBz6PiZQlIJFMyW3IQ/10uvTpUabDcAEpFhFrpKdQ,"Business: Building Automation and Controls,Brand: Metasys,Category: General System Information,Product: Metasys System,Version: 10.2,Document Type: User Guide,Document Number: LIT-12011810"
Lead Compensator,/reader/vFJWRBz6PiZQlIJFMyW3IQ/nOCF4~o_tQ3H2wG76doafg,"Business: Building Automation and Controls,Brand: Metasys,Category: General System Information,Product: Metasys System,Version: 10.2,Document Type: User Guide,Document Number: LIT-12011810"
Adaptive Tuning Attribute,/reader/vFJWRBz6PiZQlIJFMyW3IQ/ndRPLweR5zUfdTlRH6XIgw,"Business: Building Automation and Controls,Brand: Metasys,Category: General System Information,Product: Metasys System,Version: 10.2,Document Type: User Guide,Document Number: LIT-12011810"
Standard Tuning Attribute,/reader/vFJWRBz6PiZQlIJFMyW3IQ/pXsc2Oz8_KxFkoovAku6Nw,"Business: Building Automation and Controls,Brand: Metasys,Category: General System Information,Product: Metasys System,Version: 10.2,Document Type: User Guide,Document Number: LIT-12011810"
PRAC Status Output,/reader/vFJWRBz6PiZQlIJFMyW3IQ/0QSbVzlSWXvwCEso8qt0BQ,"Business: Building Automation and Controls,Brand: Metasys,Category: General System Information,Product: Metasys System,Version: 10.2,Document Type: User Guide,Document Number: LIT-12011810"
Process IDs,/reader/vFJWRBz6PiZQlIJFMyW3IQ/yhfDF3wyVV_Mv3PQ5sJsag,"Business: Building Automation and Controls,Brand: Metasys,Category: General System Information,Product: Metasys System,Version: 10.2,Document Type: User Guide,Document Number: LIT-12011810"
"PID Inputs, Outputs, and Properties",/reader/vFJWRBz6PiZQlIJFMyW3IQ/u_2fy5i6Rxmf0jRsdHHK9g,"Business: Building Automation and Controls,Brand: Metasys,Category: General System Information,Product: Metasys System,Version: 10.2,Document Type: User Guide,Document Number: LIT-12011810"
PID Control and PRAC+ Adaptive Tuning,/reader/vFJWRBz6PiZQlIJFMyW3IQ/_tV3sJvtycNCJGtpzoU6_A,"Business: Building Automation and Controls,Brand: Metasys,Category: General System Information,Product: Metasys System,Version: 10.2,Document Type: User Guide,Document Number: LIT-12011810"
How PRAC+ Determines Tuning Parameters,/reader/vFJWRBz6PiZQlIJFMyW3IQ/RoDtppjjRo1Pb_nAPWXZdg,"Business: Building Automation and Controls,Brand: Metasys,Category: General System Information,Product: Metasys System,Version: 10.2,Document Type: User Guide,Document Number: LIT-12011810"
How PRAC+ Determines When to Tune,/reader/vFJWRBz6PiZQlIJFMyW3IQ/vlogaBHzfay5q0WxPLzZPA,"Business: Building Automation and Controls,Brand: Metasys,Category: General System Information,Product: Metasys System,Version: 10.2,Document Type: User Guide,Document Number: LIT-12011810"
Benefits of PRAC+ Adaptive Tuning,/reader/vFJWRBz6PiZQlIJFMyW3IQ/ZfoKVSBnLkI267FQHlLYSw,"Business: Building Automation and Controls,Brand: Metasys,Category: General System Information,Product: Metasys System,Version: 10.2,Document Type: User Guide,Document Number: LIT-12011810"
Pattern Recognition Adaptive Control (PRAC+) Overview,/reader/vFJWRBz6PiZQlIJFMyW3IQ/mWoJcf8aBeGThJgRYLNPpw,"Business: Building Automation and Controls,Brand: Metasys,Category: General System Information,Product: Metasys System,Version: 10.2,Document Type: User Guide,Document Number: LIT-12011810"
Control States,/reader/vFJWRBz6PiZQlIJFMyW3IQ/6PTyq4Vcggh9G1dym30Pog,"Business: Building Automation and Controls,Brand: Metasys,Category: General System Information,Product: Metasys System,Version: 10.2,Document Type: User Guide,Document Number: LIT-12011810"
Setpoint Weighting,/reader/vFJWRBz6PiZQlIJFMyW3IQ/DFhP3RCy02M0Qm16syjgNw,"Business: Building Automation and Controls,Brand: Metasys,Category: General System Information,Product: Metasys System,Version: 10.2,Document Type: User Guide,Document Number: LIT-12011810"
Bumpless Transfer,/reader/vFJWRBz6PiZQlIJFMyW3IQ/mdC~R5qYQHiZj5zJyPfppQ,"Business: Building Automation and Controls,Brand: Metasys,Category: General System Information,Product: Metasys System,Version: 10.2,Document Type: User Guide,Document Number: LIT-12011810"
Anti-Windup,/reader/vFJWRBz6PiZQlIJFMyW3IQ/51k5LOAoac72u~MpNrLlZQ,"Business: Building Automation and Controls,Brand: Metasys,Category: General System Information,Product: Metasys System,Version: 10.2,Document Type: User Guide,Document Number: LIT-12011810"
Direct Acting Versus Reverse Acting,/reader/vFJWRBz6PiZQlIJFMyW3IQ/JPh0QcfdVGPvMRhEZiEltA,"Business: Building Automation and Controls,Brand: Metasys,Category: General System Information,Product: Metasys System,Version: 10.2,Document Type: User Guide,Document Number: LIT-12011810"
Proportional Band,/reader/vFJWRBz6PiZQlIJFMyW3IQ/R_HJ3t091I8zNgAgo~EJqQ,"Business: Building Automation and Controls,Brand: Metasys,Category: General System Information,Product: Metasys System,Version: 10.2,Document Type: User Guide,Document Number: LIT-12011810"
PID Pre-Processor,/reader/vFJWRBz6PiZQlIJFMyW3IQ/yVD8Kq0DtIHvZwJaeaUeOA,"Business: Building Automation and Controls,Brand: Metasys,Category: General System Information,Product: Metasys System,Version: 10.2,Document Type: User Guide,Document Number: LIT-12011810"
Adaptive Tuning,/reader/vFJWRBz6PiZQlIJFMyW3IQ/8ZY0iMeTrRRVccddXWtnBA,"Business: Building Automation and Controls,Brand: Metasys,Category: General System Information,Product: Metasys System,Version: 10.2,Document Type: User Guide,Document Number: LIT-12011810"
Metasys System PID Controller Basics,/reader/vFJWRBz6PiZQlIJFMyW3IQ/g3L7x_B1LbMDxZijfAMkAA,"Business: Building Automation and Controls,Brand: Metasys,Category: General System Information,Product: Metasys System,Version: 10.2,Document Type: User Guide,Document Number: LIT-12011810"
Automatic Tuning,/reader/vFJWRBz6PiZQlIJFMyW3IQ/BA1gi2kJ~ncdeNIP3V_f7A,"Business: Building Automation and Controls,Brand: Metasys,Category: General System Information,Product: Metasys System,Version: 10.2,Document Type: User Guide,Document Number: LIT-12011810"
PID Controller Overview,/reader/vFJWRBz6PiZQlIJFMyW3IQ/WIZGQoVnrPoymwPjRGmR8w,"Business: Building Automation and Controls,Brand: Metasys,Category: General System Information,Product: Metasys System,Version: 10.2,Document Type: User Guide,Document Number: LIT-12011810"
Related Documentation,/reader/vFJWRBz6PiZQlIJFMyW3IQ/NKkk4frSpGKKq8DVcu7SRQ,"Business: Building Automation and Controls,Brand: Metasys,Category: General System Information,Product: Metasys System,Version: 10.2,Document Type: User Guide,Document Number: LIT-12011810"
PID PRAC Commissioning Overview,/reader/vFJWRBz6PiZQlIJFMyW3IQ/3YKwn49tCVdQEPGipApA7w,"Business: Building Automation and Controls,Brand: Metasys,Category: General System Information,Product: Metasys System,Version: 10.2,Document Type: User Guide,Document Number: LIT-12011810"
Technical Specifications,/reader/TI13pySpv5j1SuGsul0v5A/LyF5OfsnKrGtrFtueVhIrw,"Business: Building Automation and Controls,Brand: Metasys,Category: Supervisory Device,Product: Network Engine,Document Type: Catalog Page,Document Number: LIT-1900882"
Ordering Information,/reader/TI13pySpv5j1SuGsul0v5A/M7HF3WgHT8SdpCEs2ih6yg,"Business: Building Automation and Controls,Brand: Metasys,Category: Supervisory Device,Product: Network Engine,Document Type: Catalog Page,Document Number: LIT-1900882"
Course Outline,/reader/TI13pySpv5j1SuGsul0v5A/oVExRpnMQF57xRmgCQ43WA,"Business: Building Automation and Controls,Brand: Metasys,Category: Supervisory Device,Product: Network Engine,Document Type: Catalog Page,Document Number: LIT-1900882"
VGE Tool Training Course Description,/reader/TI13pySpv5j1SuGsul0v5A/hCJVNeCzzvPpW6VqlUn9lg,"Business: Building Automation and Controls,Brand: Metasys,Category: Supervisory Device,Product: Network Engine,Document Type: Catalog Page,Document Number: LIT-1900882"
FD-1600 1-1/2 Hour Dynamic Rated Multi-Blade Fire Dampers Product Bulletin,/viewer/document/RwYos62EUhV6x7jGTHDP6Q,"Product code: DMPR-RS308, FOWLN, DMPR-RS310, DMPR-RS311, DMPR-RS312, DMPR-RS315, FOWHN, FOWMN, DMPR-RS314, DMPR-RS316, DMPR-RS306, DMPR-RS307, DMPR-RS305, DMPR-RS313, DMPR-RS318, DMPR-RS309, DMPR-RS317,Business: Building Automation and Controls,Brand: Johnson Controls,Category: Fire and Smoke Safety Damper,Product: FD-1600 1-1/2 Hour Dynamic Rated Fire Damper,Document Type: Product Bulletin,Document Number: LIT-1201630"
YK Style G Installation Checklist and Request for Authorized Startup Engineer,/viewer/document/AKfgh_jihfk76s6RDRlgsw,"Business: Chillers,Brand: YORK,Category: Centrifugal,Product: YK,Document Revision: 1013,Document Type: Checklist,Document Number: 160.75-CL1"
YK Style G Start-Up Checklist,/viewer/document/XTMBLhYQEWNXcosNnvjJTA,"Business: Chillers,Brand: YORK,Category: Centrifugal,Product: YK,Document Revision: 1013,Document Type: Checklist,Document Number: 160.75-CL2"
ioPass Stand-Alone Door Controller UK Datasheet,/viewer/document/VWTChYfqMtYbhxSWI2KTAw,"Brand: Kantech,Category: Hardware,Product: ioPass,Document Revision: R003,Document Type: Datasheet,Document Number: KT0316-DS-201310-R03-LT-EN"
A-4000 Series Oil Removal and Pressure-Reducing Stations and Air Compressor Accessories Installation Guide,/viewer/document/Id4sboKon_c6WGyAZJ8Nug,"Product code: A-4000-15, A-4000-14, A-4000-613, A-4000-612, A-4000-635, A-4000-155,Business: Building Automation and Controls,Brand: Johnson Controls,Category: Accessories,Product: A-4000,Document Revision: C,Document Type: Installation Guide,Part Number: 64-257-14"
C-202 2:1 Ratio Cumulator Catalog Page,/viewer/document/lfC1tWwtf98G0~niJ5cIwA,"Product code: C-202-2,Business: Building Automation and Controls,Brand: Johnson Controls,Category: Cumulator,Product: C-202 Ratio Cumulator,Document Type: Catalog Page,Document Number: LIT-1921200"
S-224 Pneumatic Gradual Switch Catalog Page,/viewer/document/1PvusV9bSthWKtGwhY3eFQ,"Product code: S-224-58, S-224-61, S-224-59, S-224-100, S-224-63, S-224-50, S-224-51, S-224-2, S-224-1, S-224-53, S-224-601, S-224-64, S-224, S-224-54, S-224-60,Business: Building Automation and Controls,Brand: Johnson Controls,Category: Accessory,Product: S-224,Document Type: Catalog Page,Document Number: LIT-1921555"
A-4000 Series Oil Removal and Pressure Reducing Stations and Air Compressor Accessories Product Bulletin,/viewer/document/~97P~WcXw2ikipPzZLXRTw,"Product code: A-4000-148, A-4000-610, A-400-603, A-4000-1048, A-4000-6001, A-4110-601, A-4000-147, A-4000-605, A-4000-14, A-4000-155, A-4000-144, A-400-604, A-4000-146, A-4000-154, A-4000-142, A-4000-6010, A-4000-141, A-4000-1037, A-4000-1054, A-4000-635, A-4000-604, A-999-102, A-4000-152, A-4000-118, A-4000-109, A-4000-138, A-4000-139, A-4000-143, A-4000-613, A-4000-149, A-4000-140, A-4000-1049, A-999-101, A-4000-145, A-4000-601, A-4000-15, A-4000-612, A-383-609, A-4000-104,Business: Building Automation and Controls,Brand: Johnson Controls,Category: Accessories,Product: A-4000,Document Type: Product Bulletin,Document Number: LIT-718060"
"A-4000-612, A-4000-613, A-4000-635 Intake Air Filters Catalog Page",/viewer/document/xV3vJNR9zgGn9hrh9i9grw,"Product code: A-4000-635, A-4000-15, A-4000-613, A-4000-612, A-4000-14, A-4000-155, F-1000-232,Business: Building Automation and Controls,Brand: Johnson Controls,Category: Accessory,Product: A-4000-612, A-4000-613, A-4000-635,Document Type: Catalog Page,Document Number: LIT-1921120"
"YCUL0096, YCUL0100, YCUL0106, YCUL0120, YCUL0130, YCUL0140 Style C 60 Hz Hermetic with IPU II and I/O Boards",/viewer/document/cvKkfiyq_0yvOWXUM6ZymQ,"Business: Chillers,Brand: YORK,Category: Scroll Air Cooled,Product: YCAL,Document Revision: 913,Document Type: Part List,Document Number: 150.66-RP1"
CCURE 9000 exacqVision Integration Guide,/viewer/document/7VMQLE_l5WpmMKyaDNsIIg,"Brand: Exacq,Category: VMS Software,Document Type: Integration Guide"
"YCAL0070, 0080, 0090, 0091, 0101, 115, 0120, 0135, 0150, 0155 Style A 60 Hz Hermetic",/viewer/document/XrHpy34znvwyEPxlDPxfng,"Business: Chillers,Brand: YORK,Category: Scroll Air Cooled,Product: YCAL,Document Revision: 913,Document Type: Engineering Guide,Document Number: 150.62-EG5"
"YCAL0090, 0094, 0104, 0114, 0124, 0134 Style C 60 Hz Hermetic",/viewer/document/8LSmkQUiQZmZC4KkA9H6uA,"Business: Chillers,Brand: YORK,Category: Scroll Air Cooled,Product: YCAL,Document Revision: 913,Document Type: Part List,Document Number: 150.64-RP1"
S610s Validation Quick Guide,/viewer/document/HL2ZrDQPJwsvVHhB4Mt~nw,"Business: Access Control,Brand: CEM Systems,Category: Hardware,Product: S610s,Document Revision: 1.3,Document Type: User Guide,Part Number: S610-1.00.060-QG-0005-1.3"
"Heat Detectors, 4255 Series",/viewer/document/geD3mskDe2PRAIaw_02bDg,"Brand: Simplex,Category: Sensors and Initiating Devices,Product: 4255 Series Heat Detectors,Document Revision: 2,Document Type: Datasheet,Document Number: S12098-0014"
Axis-compatible Camera Application Integration,/viewer/document/01axpKVF4TbHPbXDOPXzmg,"Brand: Exacq,Category: VMS Software,Document Type: Integration Guide"
"CYK Style G Compound Chiller, Heat Pump System with Quantum LX Controls",/viewer/document/h6xsUtb6yaTtwhnWaKr_IQ,"Business: Chillers,Brand: YORK,Category: Centrifugal,Product: CYK,Document Revision: 813,Document Type: Operation Guide,Document Number: 160.82-OM1"
Fasteners Catalog Page,/viewer/document/xBjXLzNtfNMnNLdKRq~tgw,"Product code: F-1000-210, F-1000-321, F-1000-133, F-1000-328,Business: Building Automation and Controls,Brand: Johnson Controls,Category: Accessory,Product: Anchor, Fastener,Document Type: Catalog Page,Document Number: LIT-1929045"
G-7185 Step Controller Catalog Page,/viewer/document/i3GIJi~zU3HsAklGmYXGmw,"Product code: G-7185-602, G-7185-604, G-7185-601, G-7185-605, G-7185-107, G-7185-2, G-7185-606, G-7185-603, G-7185-600, G-7185-1, G-7185-5,Business: Building Automation and Controls,Brand: Johnson Controls,Category: Step Controller,Product: G-7185 Step Controller,Document Type: Catalog Page,Document Number: LIT-1921525"
Pipe Fittings Catalog Page,/viewer/document/Nh~rFRwcYD3joQ3P7c5OQg,"Product code: F-1000-218, F-1000-21, F-1000-16, F-1000-15, F-1000-18, F-700-38, F-700-39, F-1000-219, F-1000-98, F-700-40, F-1000-17, F-500-28, F-1000-20, F-500-27, F-1000-19, F-500-30, F-500-29, F-1000-25,Business: Building Automation and Controls,Brand: Johnson Controls,Category: Accessory,Product: Pipe Fittings,Document Type: Catalog Page,Document Number: LIT-1929035"
T5000 LCD Digital Fan Coil Thermostat-More Models,/viewer/document/jvKYxmA8kpSv8NryWJtN_w,"Business: Building Automation and Controls APAC,Brand: Johnson Controls,Category: Fan Coil Thermostat,Product: T5200 Thermostat,Document Type: Product Bulletin,Document Number: PUBL-6785(0813)"
TE-6300W Temperature Sensor Thermowells Catalog Page,/viewer/document/i4fWeO1GnzCrvcHDKCOrVg,"Product code: TE-6300W-101,Business: Building Automation and Controls,Brand: Johnson Controls,Category: Temperature Sensor,Product: TE-6300 Temperature Sensor,Document Type: Catalog Page,Document Number: LIT-1900621"
HVAC Valve Cross-Reference Guide Technical Bulletin,/viewer/document/3H2Ucl~phQnceuGTjnOHRQ,"Business: Building Automation and Controls,Brand: Johnson Controls,Category: Butterfly Valve and Actuator, Electric Actuator, Flanged Globe or Ball Valve and Actuator, Pneumatic Actuator, Threaded Globe Valve and Actuator, Zone and Fan Coil Valve,Product: Valves,Document Type: Technical Bulletin,Document Number: LIT-977370"
exacqVision Tokheim Forecourt Integration Guide,/viewer/document/2DuKAbzEjTy15CbsFs8wuQ,"Brand: Exacq,Category: VMS Software,Document Type: Integration Guide"
YMC2 Mod A Chiller Maintenance Requirements Chiller Log Sheet,/viewer/document/RX78Ap5ZDxTLS~UQQVxiNQ,"Business: Chillers,Brand: YORK,Category: Centrifugal,Product: YMC2,Document Revision: 813,Document Type: Installation Guide,Document Number: 160.78-MR1"
Dampers and Actuators Catalog,/viewer/document/4Uuaq3cGhtFkwjRetkG9Ug,"Business: Building Automation and Controls,Brand: Johnson Controls,Category: Butterfly Valve and Actuator, Electric Actuator, Flanged Globe or Ball Valve and Actuator, Pneumatic Actuator, Threaded Globe Valve and Actuator, Zone and Fan Coil Valve,Product: Actuators, Dampers,Document Type: Catalog Page,Document Number: PUBL-7211"
exacqVision Platesmart Integration Guide,/viewer/document/1ejDoPLPkZ4JqaLZB2i1gg,"Brand: Exacq,Category: VMS Software,Document Type: Integration Guide"
"YK Software Enhancements (V.25), Control Panel",/viewer/document/shQm1gSlzb_SXtdWTwdZbg,"Business: Chillers,Brand: YORK,Category: Centrifugal,Product: YK,Document Revision: 813,Document Type: Service Information Letter,Document Number: SI0271"
"YR Style C Liquid Chillers Optiview Control Center With Solid State Starter, Drives and Starters",/viewer/document/mnXyJV3dTSmyEOzXh72DMw,"Business: Chillers,Brand: YORK,Category: Screw Water Cooled,Product: YR,Document Revision: 813,Document Type: Wiring Diagram,Document Number: 160.81-PW9"
"YCAV0569, YCAV0639, YCAV0679, YCAV0719, YCAV0739, YCAV0819, YCAV0889, YCAV0969, YCAV1039, YCAV1139, YCAV1169, YCAV1309, YCAV1429, YCAV1549, YCAV1649, YCAV1739, YCAV1829, YCAV1909 Style A 50 Hz",/viewer/document/Rhe_VQxbuK4meELrzPqwbg,"Business: Chillers,Brand: YORK,Category: Screw Air Cooled,Product: YCAV,Document Revision: 813,Document Type: Engineering Guide,Document Number: 201.21-EG2"
RB-2000 Round Balancing Damper Catalog Page,/viewer/document/vTlFdR1R42vRaFQkA~kBaQ,"Product code: RBS, RBG,Business: Building Automation and Controls,Brand: Johnson Controls,Category: Balancing Damper,Product: Round Balancing Damper,Document Type: Catalog Page,Document Number: LIT-1900246"
FD-1600 1-1/2 Hour Dynamic Rated Multi-Blade Fire Dampers Catalog Page,/viewer/document/vXOnN1fvtU~QWxc~37TtCA,"Product code: DMPR-RS305, DMPR-RS309, FOWHN, DMPR-RS312, DMPR-RS317, DMPR-RS318, DMPR-RS315, DMPR-RS316, DMPR-RS314, DMPR-RS313, DMPR-RS308, FOWLN, DMPR-RS311, FOWMN, DMPR-RS307, DMPR-RS306, DMPR-RS310,Business: Building Automation and Controls,Brand: Johnson Controls,Category: Fire and Smoke Safety Damper,Product: FD-1600 1-1/2 Hour Dynamic Rated Fire Damper,Document Type: Catalog Page,Document Number: LIT-1900206"
FS-1620 Class II Combination Fire/Smoke Dampers,/viewer/document/v~fmmb168ZMFxe7FmNaQnA,"Product code: TOGLF, TOGMF, TOGHP, TOWHP, TOWHB, TOGHF, TOGHQ, TOWHO, TOGHO,Business: Building Automation and Controls,Brand: Johnson Controls,Category: Fire and Smoke Safety Damper,Product: FS-1620 Class II Combination Fire and Smoke Damper,Document Type: Catalog Page,Document Number: LIT-1900202"
ID-121x 12-Gauge U-Channel Industrial Damper Catalog Page,/viewer/document/nODhQgduIg114HSxkdxHbw,"Product code: IPWSN, IOWHN, IPVHN, IOVEN, IOVHN, IPVEN, IPVPN, IPWEN, IOWPN, IPWPN, IOWSN, IPVSN, IOVPN, IOWEN, IPWHN, IOVSN,Business: Building Automation and Controls,Brand: Johnson Controls,Category: Industrial Damper,Product: ID-121x 12-Gauge U-Channel Industrial Damper,Document Type: Catalog Page,Document Number: LIT-1900501"
ID-123x Airfoil Blade Industrial Damper Catalog Page,/viewer/document/oWGdF2lYYxb1UbkqigCeVQ,"Product code: IPAHN, IOBEN, IPBSN, IOAEN, IOBSN, IPASN, IPBHN, IOASN, IOBHN, IPAEN, IOAHN, IPBEN,Business: Building Automation and Controls,Brand: Johnson Controls,Category: Industrial Damper,Product: ID-123x Airfoil Blade Industrial Damper,Document Type: Catalog Page,Document Number: LIT-1900498"
ID-141x 12-Gauge Hat Channel Industrial Damper Catalog Page,/viewer/document/NtCfQw9tvcRbIz2E3m6Z2g,"Product code: IOJHN, IPHSN, IOJSN, IPJSN, IOJEN, IOHHN, IPJHN, IPHEN, IOHEN, IPJEN, IPHHN, IOHSN,Business: Building Automation and Controls,Brand: Johnson Controls,Category: Industrial Damper,Product: ID-141x 12-Gauge Hat Channel Industrial Damper,Document Type: Catalog Page,Document Number: LIT-1900500"
RF-2000 True Round Fire Damper Catalog Page,/viewer/document/~opl3PIcTsGhEI7XDdEVxQ,"Product code: RFG,Business: Building Automation and Controls,Brand: Johnson Controls,Category: Fire and Smoke Safety Damper,Product: RF-2000 Round Fire Damper,Document Type: Catalog Page,Document Number: LIT-1900203"
RI-1000 10-Gauge Round Industrial Damper Catalog Page,/viewer/document/JUTRac1AG5jGcz5I7lxAGw,"Product code: RIG, RIN, RIS, RIB,Business: Building Automation and Controls,Brand: Johnson Controls,Category: Industrial Damper,Product: RI-1000 10-Gauge Round Industrial Damper,Document Type: Catalog Page,Document Number: LIT-1900497"
RS-2000 True Round Smoke Damper Catalog Page,/viewer/document/wUM2xOP4etlf9lfFM5vshA,"Product code: RSG,Business: Building Automation and Controls,Brand: Johnson Controls,Category: Fire and Smoke Safety Damper,Product: RS-2000 Round Smoke Damper,Document Type: Catalog Page,Document Number: LIT-1900204"
RT-2000 Combination Fire/Smoke Damper Catalog Page,/viewer/document/_QhnXmJHosLaPQzB_qHeEA,"Product code: RTG,Business: Building Automation and Controls,Brand: Johnson Controls,Category: Fire and Smoke Safety Damper,Product: RT-2000 Round Combination Fire and Smoke Damper,Document Type: Catalog Page,Document Number: LIT-1900205"
End-to-End Infrared Optical Beam Smoke Detector; Fire Fighting Enterprises FIRERAY 3000,/viewer/document/1kjsR9LLXHoiE~5Is8GJ9A,"Brand: Simplex,Category: Sensors and Initiating Devices,Product: FIRERAY 3000,Document Revision: 1,Document Type: Datasheet,Document Number: S4098-0050"
INTEVO ADV Firmware Update Installation Sheet,/viewer/document/TCrEcVY36LVXDUM181PV8Q,"Brand: Kantech,Category: Integrated Security Platform,Product: Intevo,Document Revision: R001,Document Type: Installation Guide,Document Number: DN2106-1308"
Reflective Beam Smoke Detectors Fire Fighting Enterprises Auto-Aligning Fireray 5000,/viewer/document/L_mhcpmWKVXAA8OEigf9vg,"Brand: Simplex,Category: Sensors and Initiating Devices,Product: Fireray 5000,Document Revision: 3,Document Type: Datasheet,Document Number: S4098-0042"
VG4000-C Zone Valve Product Bulletin,/viewer/document/DKFXWqqOfYhi9kBb7U8xNw,"Business: Building Automation and Controls APAC,Brand: Johnson Controls,Category: Zone Valve,Product: VLC2000,Document Type: Product Bulletin,Document Number: PUBL-7265(0813)"
Rate of Temperature Capture,/reader/X4HTjMpGLtp22p_ywCXPmw/sFwimKo5qJthGjRYZw6jYQ,"Business: Building Automation and Controls,Brand: Metasys,Category: Supervisory Device,Product: Network Engine,Version: 8.1,Document Type: Application Note,Document Number: LIT-12011894"
Panel Temperature Alarm,/reader/X4HTjMpGLtp22p_ywCXPmw/FW1kZXaZ5FrTybeE2bLxcA,"Business: Building Automation and Controls,Brand: Metasys,Category: Supervisory Device,Product: Network Engine,Version: 8.1,Document Type: Application Note,Document Number: LIT-12011894"
Temperature Monitoring Application,/reader/X4HTjMpGLtp22p_ywCXPmw/LKoSOUcv7ujF1A7oNQx50Q,"Business: Building Automation and Controls,Brand: Metasys,Category: Supervisory Device,Product: Network Engine,Version: 8.1,Document Type: Application Note,Document Number: LIT-12011894"
Introduction,/reader/X4HTjMpGLtp22p_ywCXPmw/Nmz9dswsNuqU117OGnSVVg,"Business: Building Automation and Controls,Brand: Metasys,Category: Supervisory Device,Product: Network Engine,Version: 8.1,Document Type: Application Note,Document Number: LIT-12011894"
"CYK, YK, YKEP, YMC2, YST Evaporator Refrigerant Temperature Sensor",/viewer/document/FDOHPbkTa87Si73QKT9GjQ,"Business: Chillers,Brand: YORK,Category: Centrifugal,Product: CYK, YK, YKEP, YMC2, YST,Document Revision: 813,Document Type: Service Information Letter,Document Number: SI0279"
"YCAL0041EC, 0045EC, 0051EC, 0055EC, 0061EC, 0065EC Style D 50 and 60 Hz Hermetic with IPU II and I/O Boards",/viewer/document/2HFW8huxvqrUMbUYmUko3g,"Business: Chillers,Brand: YORK,Category: Scroll Air Cooled,Product: YCAL,Document Revision: 713,Document Type: Part List,Document Number: 150.66-RP3"
"YCUL0016, YCUL0026, YCUL0030, YCUL0036, YCUL0040, YCUL0046, YCUL0050, YCUL0056, YCUL0060, YCUL0066, YCUL0076, YCUL0080, YCUL0086, YCUL0090 Style B 60 Hz Scroll Hermetic",/viewer/document/kSNlK2SbfsNFgFPdZaJHeA,"Business: Chillers,Brand: YORK,Category: Condensing Unit,Product: YCUL,Document Revision: 713,Document Type: Part List,Document Number: 150.63-RP4"
"YCUL0016, YCUL0026, YCUL0030, YCUL0036, YCUL0040, YCUL0046, YCUL0050, YCUL0056, YCUL0060, YCUL0066, YCUL0076, YCUL0080, YCUL0086, YCUL0090 Style C 60 Hz Scroll Hermetic",/viewer/document/bXfICOiMXi9zNPIZIriAtQ,"Business: Chillers,Brand: YORK,Category: Condensing Unit,Product: YCUL,Document Revision: 713,Document Type: Part List,Document Number: 150.63-RP5"
