title,link,metadata
exacqVision to Redscan Serial Integration Guide,/viewer/document/gexYquDNjUFWw8U_~s70tw,"Brand: Exacq,Category: VMS Software,Document Type: Integration Guide"
A-4400 Series Refrigerated Air Dryers for Pneumatic Control Systems Catalog Page,/viewer/document/ksbXpUlMjqsSOnzceDp0sw,"Product code: A-4000-620, A-4000-154, A-4400-607, A-4110-608, A-4400-608, A-4417-1, A-4423-2, A-4000-158, A-4210-603, A-4300-601, A-4300-602, A-4417-2, A-4110-610, A-4300-600, A-4400, A-4000-156, A-4412-2, A-4412-1, A-4423-1, A-4110-607, A-4400-610,Business: Building Automation and Controls,Brand: Johnson Controls,Category: Accessory,Product: A-4400,Document Type: Catalog Page,Document Number: LIT-1921105"
Security Control Panel Assembly Mounted in a 20 in. x 30 in. Enclosure Catalog Page,/viewer/document/~0euONiwTPXNaNTYEzUKqg,"Product code: SPA0D10011G10, SPA1D100-1G10, SPA0D100-1G10, SPA1D10011G10,Business: Building Automation and Controls,Brand: Johnson Controls,Category: Control Panel,Product: Security Control Panel,Document Type: Catalog Page,Document Number: LIT-1900776"
Security Control Panel Assembly Mounted in a 20 in. x 42 in. Enclosure Catalog Page,/viewer/document/Wtq53MsGOLWFbd4kmnwGzw,"Product code: SPA1D20012F10, SPA1D200-2F20, SPA0D200-2F20, SPA0D200-2F10, SPA0D20012F20, SPA1D20012F20, SPA0D20012F10, SPA1D200-2F10,Business: Building Automation and Controls,Brand: Johnson Controls,Category: Control Panel,Product: Security Control Panel,Document Type: Catalog Page,Document Number: LIT-1900775"
TE-6700 2nd Generation Temperature Elements Catalog Page,/viewer/document/Yl~6TihNxaJPNMZMbnPQzw,"Product code: ACC-INSL-0,Business: Building Automation and Controls,Brand: Johnson Controls,Category: Temperature Sensor,Product: TE-6700 Temperature Element,Document Type: Catalog Page,Document Number: LIT-1900055"
Digital  Pro-Max 5 Constant Alarm Key Card,/viewer/document/rOSDMk7n1Ss2IBmwKSCf9A,"Brand: Sensormatic,Category: Detector,Product: Digital  Pro-Max 5 Constant Alarm Key Card,Series: Pro-Max,Document Revision: A,Document Type: Reference Guide,Document Number: 2402-2101-02"
Digital Pro-Max 5 Counter Reset Key Card,/viewer/document/zXL6vzD09D5mbf3XBRUHFQ,"Brand: Sensormatic,Category: Detector,Product: Digital Pro-Max 5 Counter Reset Key Card,Series: Pro-Max,Document Revision: A,Document Type: Reference Guide,Document Number: 2412-2041-02"
T8200-TB20-9JF0 Series Touch Screen Thermostat (Fan Coil and Floor Heating) - Installation Instructions,/viewer/document/aGGxYD0TJxXyIFMqden28w,"Business: Building Automation and Controls APAC,Brand: Johnson Controls,Category: Fan Coil Thermostat,Product: T8200 Thermostat,Document Type: Installation Guide,Document Number: 602QB02ANB"
"T8200-TB20-9JS0/9JR0, T8200-TF20-9JS0/9JR0, T8200-TB21-9JS0/R0 Series Touch Screen Fan Coil Thermostat - Installation Instructions",/viewer/document/SiCYx4Wal74o6HGkQDCSqA,"Business: Building Automation and Controls APAC,Brand: Johnson Controls,Category: Fan Coil Thermostat,Product: T8200 Thermostat,Document Type: Installation Guide,Document Number: 602QB01ANB"
TEC210x,/reader/3qVxnG~d_ytcvc17Uspbpg/4JvWHyVaMPLgFhP_J1eLwA,"Business: Building Automation and Controls,Brand: Metasys,Category: Supervisory Device,Product: Network Engine,Version: 10,Document Type: Technical Bulletin,Document Number: LIT-1201683"
TEC1100,/reader/3qVxnG~d_ytcvc17Uspbpg/3NNclBxGrv8uT830NiocYA,"Business: Building Automation and Controls,Brand: Metasys,Category: Supervisory Device,Product: Network Engine,Version: 10,Document Type: Technical Bulletin,Document Number: LIT-1201683"
Extension Module (XTM and XT),/reader/3qVxnG~d_ytcvc17Uspbpg/5MmF1vRUJHKEN~XSYDV8QQ,"Business: Building Automation and Controls,Brand: Metasys,Category: Supervisory Device,Product: Network Engine,Version: 10,Document Type: Technical Bulletin,Document Number: LIT-1201683"
DX-9100 Extended Digital Controller,/reader/3qVxnG~d_ytcvc17Uspbpg/q2THlJT8tre_sLZoZc32_A,"Business: Building Automation and Controls,Brand: Metasys,Category: Supervisory Device,Product: Network Engine,Version: 10,Document Type: Technical Bulletin,Document Number: LIT-1201683"
Lab and Central Plant Controller/Digital Controller (LCP/DC9100),/reader/3qVxnG~d_ytcvc17Uspbpg/IRlJ12P1cIYIrSNy~57mlA,"Business: Building Automation and Controls,Brand: Metasys,Category: Supervisory Device,Product: Network Engine,Version: 10,Document Type: Technical Bulletin,Document Number: LIT-1201683"
TC-9100 Terminal Unit Controller,/reader/3qVxnG~d_ytcvc17Uspbpg/~QFgfzUfOp_g_Lhh2pAnTA,"Business: Building Automation and Controls,Brand: Metasys,Category: Supervisory Device,Product: Network Engine,Version: 10,Document Type: Technical Bulletin,Document Number: LIT-1201683"
Intelligent Fire Controller (IFC),/reader/3qVxnG~d_ytcvc17Uspbpg/2SymXnnUNxgLRzrFiBPMSA,"Business: Building Automation and Controls,Brand: Metasys,Category: Supervisory Device,Product: Network Engine,Version: 10,Document Type: Technical Bulletin,Document Number: LIT-1201683"
ILC,/reader/3qVxnG~d_ytcvc17Uspbpg/0DVwHFdg4ampxxgqWhteHA,"Business: Building Automation and Controls,Brand: Metasys,Category: Supervisory Device,Product: Network Engine,Version: 10,Document Type: Technical Bulletin,Document Number: LIT-1201683"
Vendor Device (VND),/reader/3qVxnG~d_ytcvc17Uspbpg/Y7rg3fj9nVj5C4SxLEWoqg,"Business: Building Automation and Controls,Brand: Metasys,Category: Supervisory Device,Product: Network Engine,Version: 10,Document Type: Technical Bulletin,Document Number: LIT-1201683"
Metasys Integrator Unit,/reader/3qVxnG~d_ytcvc17Uspbpg/JLvrKT9NAZ76UnCkqpQIOA,"Business: Building Automation and Controls,Brand: Metasys,Category: Supervisory Device,Product: Network Engine,Version: 10,Document Type: Technical Bulletin,Document Number: LIT-1201683"
Pheonix Fume Hood (PHX),/reader/3qVxnG~d_ytcvc17Uspbpg/ycMqKKcTf2ZLndzKCDV6SQ,"Business: Building Automation and Controls,Brand: Metasys,Category: Supervisory Device,Product: Network Engine,Version: 10,Document Type: Technical Bulletin,Document Number: LIT-1201683"
VMA 1400 Series,/reader/3qVxnG~d_ytcvc17Uspbpg/NkXEvCttcrAXRHHD8VU3mA,"Business: Building Automation and Controls,Brand: Metasys,Category: Supervisory Device,Product: Network Engine,Version: 10,Document Type: Technical Bulletin,Document Number: LIT-1201683"
VAV Controller,/reader/3qVxnG~d_ytcvc17Uspbpg/2SGQu5VZFddUtIQOeHKTIg,"Business: Building Automation and Controls,Brand: Metasys,Category: Supervisory Device,Product: Network Engine,Version: 10,Document Type: Technical Bulletin,Document Number: LIT-1201683"
UNT,/reader/3qVxnG~d_ytcvc17Uspbpg/K98J8iBeOCqqCIhIk1Mt3g,"Business: Building Automation and Controls,Brand: Metasys,Category: Supervisory Device,Product: Network Engine,Version: 10,Document Type: Technical Bulletin,Document Number: LIT-1201683"
AHU,/reader/3qVxnG~d_ytcvc17Uspbpg/DNXf92B_r4tipM4tfnflZw,"Business: Building Automation and Controls,Brand: Metasys,Category: Supervisory Device,Product: Network Engine,Version: 10,Document Type: Technical Bulletin,Document Number: LIT-1201683"
N2 Device Point Mapping Tables,/reader/3qVxnG~d_ytcvc17Uspbpg/0EtZ5FvG8kq0U5Iv4NuA4A,"Business: Building Automation and Controls,Brand: Metasys,Category: Supervisory Device,Product: Network Engine,Version: 10,Document Type: Technical Bulletin,Document Number: LIT-1201683"
"N2 FEC, FAC, and VMA Point Limits",/reader/3qVxnG~d_ytcvc17Uspbpg/OG~7PcsMEvH8dwUdVtnu8Q,"Business: Building Automation and Controls,Brand: Metasys,Category: Supervisory Device,Product: Network Engine,Version: 10,Document Type: Technical Bulletin,Document Number: LIT-1201683"
Adding Field Points Using Manual Mode Definition,/reader/3qVxnG~d_ytcvc17Uspbpg/TyYNpLoa9BPPLN6iP6MHmA,"Business: Building Automation and Controls,Brand: Metasys,Category: Supervisory Device,Product: Network Engine,Version: 10,Document Type: Technical Bulletin,Document Number: LIT-1201683"
Adding Field Points Using Assisted Mode Definition,/reader/3qVxnG~d_ytcvc17Uspbpg/yzDPVxwGx_37JqA7RkOVWA,"Business: Building Automation and Controls,Brand: Metasys,Category: Supervisory Device,Product: Network Engine,Version: 10,Document Type: Technical Bulletin,Document Number: LIT-1201683"
Adding N2 Field Points to an Archive Database,/reader/3qVxnG~d_ytcvc17Uspbpg/EE~0X4yD7jn1s1549~4ORg,"Business: Building Automation and Controls,Brand: Metasys,Category: Supervisory Device,Product: Network Engine,Version: 10,Document Type: Technical Bulletin,Document Number: LIT-1201683"
Copying Extensions to a Field Device or Field Point (Offline Only),/reader/3qVxnG~d_ytcvc17Uspbpg/RT7oLCC7YA~ZUobooCJhvA,"Business: Building Automation and Controls,Brand: Metasys,Category: Supervisory Device,Product: Network Engine,Version: 10,Document Type: Technical Bulletin,Document Number: LIT-1201683"
Deleting Extensions from an Object,/reader/3qVxnG~d_ytcvc17Uspbpg/OLIFRNXg9QKD_fMHAUgutA,"Business: Building Automation and Controls,Brand: Metasys,Category: Supervisory Device,Product: Network Engine,Version: 10,Document Type: Technical Bulletin,Document Number: LIT-1201683"
Adding an Averaging Extension,/reader/3qVxnG~d_ytcvc17Uspbpg/iJJUXdkc5aiFaM3XCb8Vuw,"Business: Building Automation and Controls,Brand: Metasys,Category: Supervisory Device,Product: Network Engine,Version: 10,Document Type: Technical Bulletin,Document Number: LIT-1201683"
Adding an Alarm Extension,/reader/3qVxnG~d_ytcvc17Uspbpg/VIyzgoZyLdgAAtXCOKVRyQ,"Business: Building Automation and Controls,Brand: Metasys,Category: Supervisory Device,Product: Network Engine,Version: 10,Document Type: Technical Bulletin,Document Number: LIT-1201683"
Adding a Totalization Extension,/reader/3qVxnG~d_ytcvc17Uspbpg/5Fze0cSUqRZjQvPRtf_aUg,"Business: Building Automation and Controls,Brand: Metasys,Category: Supervisory Device,Product: Network Engine,Version: 10,Document Type: Technical Bulletin,Document Number: LIT-1201683"
Adding a Trend Extension,/reader/3qVxnG~d_ytcvc17Uspbpg/7hZLOIsFKJwOgwfLxHLNOg,"Business: Building Automation and Controls,Brand: Metasys,Category: Supervisory Device,Product: Network Engine,Version: 10,Document Type: Technical Bulletin,Document Number: LIT-1201683"
Adding a Resource File Extension,/reader/3qVxnG~d_ytcvc17Uspbpg/wW7DfACNnfwhomYCcuPX6A,"Business: Building Automation and Controls,Brand: Metasys,Category: Supervisory Device,Product: Network Engine,Version: 10,Document Type: Technical Bulletin,Document Number: LIT-1201683"
Adding Extensions to an Object,/reader/3qVxnG~d_ytcvc17Uspbpg/0J_yxxZra~ygF7pcRg6nTw,"Business: Building Automation and Controls,Brand: Metasys,Category: Supervisory Device,Product: Network Engine,Version: 10,Document Type: Technical Bulletin,Document Number: LIT-1201683"
Adding N2 Field Devices Online Using Auto Discovery,/reader/3qVxnG~d_ytcvc17Uspbpg/saA4WUATKYOIrenz5aarng,"Business: Building Automation and Controls,Brand: Metasys,Category: Supervisory Device,Product: Network Engine,Version: 10,Document Type: Technical Bulletin,Document Number: LIT-1201683"
Adding N2 Field Devices Manually (Online or Offline),/reader/3qVxnG~d_ytcvc17Uspbpg/o05jUKtgLP7A2UiR6Cxr5w,"Business: Building Automation and Controls,Brand: Metasys,Category: Supervisory Device,Product: Network Engine,Version: 10,Document Type: Technical Bulletin,Document Number: LIT-1201683"
Adding N2 Integrations,/reader/3qVxnG~d_ytcvc17Uspbpg/9k2dE_wF9n05yye7qMiw0w,"Business: Building Automation and Controls,Brand: Metasys,Category: Supervisory Device,Product: Network Engine,Version: 10,Document Type: Technical Bulletin,Document Number: LIT-1201683"
Detailed Procedures,/reader/3qVxnG~d_ytcvc17Uspbpg/wfkWGII0jTQ9xalWuX~Elw,"Business: Building Automation and Controls,Brand: Metasys,Category: Supervisory Device,Product: Network Engine,Version: 10,Document Type: Technical Bulletin,Document Number: LIT-1201683"
Supported Application Specific Controllers (ASCs),/reader/3qVxnG~d_ytcvc17Uspbpg/QX3Zm_PnwRwxfU0PzW3DTA,"Business: Building Automation and Controls,Brand: Metasys,Category: Supervisory Device,Product: Network Engine,Version: 10,Document Type: Technical Bulletin,Document Number: LIT-1201683"
N2 Device Point Mapping Tables Overview,/reader/3qVxnG~d_ytcvc17Uspbpg/57uyQZASzwUDt88A05W4tQ,"Business: Building Automation and Controls,Brand: Metasys,Category: Supervisory Device,Product: Network Engine,Version: 10,Document Type: Technical Bulletin,Document Number: LIT-1201683"
N2 Integration with the NAE Overview,/reader/3qVxnG~d_ytcvc17Uspbpg/r1YKkFN~k2AxC6s~ydlN0w,"Business: Building Automation and Controls,Brand: Metasys,Category: Supervisory Device,Product: Network Engine,Version: 10,Document Type: Technical Bulletin,Document Number: LIT-1201683"
Related Documentation,/reader/3qVxnG~d_ytcvc17Uspbpg/d3I~yYPpHYNY3_WRP5gmaQ,"Business: Building Automation and Controls,Brand: Metasys,Category: Supervisory Device,Product: Network Engine,Version: 10,Document Type: Technical Bulletin,Document Number: LIT-1201683"
Communications Protocol,/reader/3qVxnG~d_ytcvc17Uspbpg/ovU4xsRMImpHYlOU3R3G0A,"Business: Building Automation and Controls,Brand: Metasys,Category: Supervisory Device,Product: Network Engine,Version: 10,Document Type: Technical Bulletin,Document Number: LIT-1201683"
Document Introduction,/reader/3qVxnG~d_ytcvc17Uspbpg/XUP1ctk~lzsUXwuJ~b5sQg,"Business: Building Automation and Controls,Brand: Metasys,Category: Supervisory Device,Product: Network Engine,Version: 10,Document Type: Technical Bulletin,Document Number: LIT-1201683"
EntraPass Special Edition Reference Manual,/viewer/document/M69cKxIgSDV2DH2iexTa6A,"Brand: Kantech,Category: Software,Product: EntraPass,Version: 6.01,Document Type: Administration Guide,Document Number: DN1420-1310"
LX Wizard and LON Integration Technical Bulletin,/viewer/document/n4ZQFxQiLi3XxGPLXxJ54w,"Product code: LX-PFCU-1, LX-IO520-1, LX-VAVCF-1, LX-SCHEDL-0, LX-RTUL-1, LX-PRG300-11, LX-PRG300-1, LX-IOE420-0, LX-PRG203-1, LX-VAVLF-1, LX-PRG610-11, LX-VAVCF-11, LX-HPUL-1, LX-IO301-1, LX-FCUL-1, LX-IOE410-0, LX-PRG510-1, LX-DSWSC2-0, LX-DSWSC1-0, LX-VVTLF-1, LX-PRG203-11, LX-VAVLN-1, LX-PRG600-11, LX-IO401-1, LX-UVL-1, LX-PRG400-1, LX-PFCUA-1, LX-PRG410-1, LX-PRG410-11, LX-PRG400-11, LX-PRG500-1, LX-IOE400-0,Business: Building Automation and Controls,Brand: Facility Explorer,Category: Software Application,Product: LX Software,Document Type: Technical Bulletin,Document Number: LIT-12011900"
VG2000 Series Cast Iron Flanged Globe Valves Product Bulletin,/viewer/document/zJfd3g3irFkrVhlxoxSGFQ,"Product code: VG2831UM2924GGA, VG2831TM+924AGA, VG2831UN, VG2231UN+865D01, VG2231VM2926BGC, VG2231TL+823D01, VG2231TM+946AGA, VG2231VM292NAGC, VG2231UM2924GGA, VG2431YN+867C02, VG2231TM+926GGC, VG2831UM294NAGA, VG2231VM294NBGC, VG2831UM+845E01, VG2831UM+94NGGC, VG2831UM+926GGC, VG2231WN292NGGA, VG2831UM294NBGC, VG2431TM+843D01, VG2831TM+916GGA, VG2831TM+94NBGC, VG2831VM2926GGA, VG2831UN+865C01, VG2231UL+823C02, VG2831TM+926AGA, VG2831VM+924AGA, VG2231VM292NBGA, VG2831VM2924GGC, VG2431VN+865C00, VG2231VN+865D01, VG2231TL+823E02, VG2831VM+92NAGA, VG2231UM+926AGC, VG2231WN+867E00, VG2231UM+946GGA, VG2831TM, VG2231TM+916GGA, VG2231UM+845D01, VG2231TM+924AGC, VG2231VN+865E01, VG2231UM+916GGC, VG2231UM+924GGA, VG2231UL+823E01, VG2231UM+94NGGC, VG2831UM2946BGC, VG2231TM+946BGC, VG2831VM+926BGA, VG2231VM292NGGC, VG2231VN, VG2231UM+94NAGC, VG2431VN+865E00, VG2231UM294NAGA, VG2231TM+300AGA, VG2831UM+301HGC, VG2831VM294NAGC, VG2431WN+867C01, VG2231UM292NBGC, VG2231UM+924GGC, VG2231UM+5UGGA, VG2831UM+92NBGA, VG2231TM+92NGGA, VG2231UL+823C00, VG2431UM+845D01, VG2231TM+926AGA, VG2831UM+94NAGC, VG2831VM2946BGC, VG2431WN+867D00, VG2231WN+867C00, VG2231VM+5UAGA, VG2231WN292NGGC, VG2831UM294NGGC, VG2231VN+865C00, VG2231VM+301AGC, VG2831UM+845E00, VG2231TM+94NAGC, VG2831UM2926BGC, VG2231UM+845E02, VG2231UM+946AGA, VG2231VM+845E00, VG2831UM2924AGC, VG2231VN+865E00, VG2231TM+94NBGC, VG2831TM+92NGGC, VG2831VM+94NAGA, VG2831VM292NGGC, VG2431TM+843C02, VG2831VM+94NBGA, VG2431UN+865D01, VG2831TM+843E00, VG2231WN+867D01, VG2231TM+924GGA, VG2831TM+300HGC, VG2831UM+946BGC, VG2231UM2924AGA, VG2231UN+865E02, VG2831UM+301AGC, VG2231VM294NGGA, VG2831UN+865C00, VG2231VM2924AGA, VG2831VM+845D01, VG2231WN+867E02, VG2431TM+843C00, VG2231VN+865C01, VG2231TM+916GGC, VG2231UM294NBGA, VG2431VN+865C02, VG2231UM+94NBGC, VG2431WN+867E01, VG2831TM+946GGC, VG2431TM+843D02, VG2831TM+92NGGA, VG2231UM+845D00, VG2831TM+926BGC, VG2831UN+865D02, VG2831UN+865D00, VG2231TL, VG2431VM+845D02, VG2231WN294NAGA, VG2231WN2926GGC, VG2831UM+301AGA, VG2231TM+300AGC, VG2831TM+94NGGA, VG2831VM+926AGC, VG2231UM+926GGC, VG2831VM+926AGA, VG2831VM+92NBGC, VG2231UN, VG2431VM+845C02, VG2231UM+924AGC, VG2831VM+92NGGA, VG2431VM+845C00, VG2231WN+602AGC, VG2831VM+845C01, VG2431UN+865D00, VG2831VM+946BGA, VG2831UM+924GGC, VG2431TM+843E01, VG2231UL+823D02, VG2231VM294NBGA, VG2231TM+5UAGA, VG2231TL+823E00, VG2231TM+926GGA, VG2231WN+867D00, VG2231TM+843D00, VG2431YN+867D00, VG2831VM292NBGA, VG2231UM+845E00, VG2231TM+924AGA, VG2831UM+94NGGA, VG2831VM+92NBGA, VG2231WN+302AGC, VG2431YN+867D01, VG2831UM+92NAGC, VG2831VM+845E00, VG2231UM+301AGC, VG2231UM+92NAGA, VG2431VN+865D02, VG2831VM+946GGA, VG2231WN292NBGC, VG2231TM+94NBGA, VG2831TM+916AGC, VG2831VM294NBGA, VG2831UM+94NBGA, VG2431UM+845C01, VG2231TM+843C02, VG2831VM+845D02, VG2831VM+916GGC, VG2231YN+867C02, VG2431UM+845E00, VG2431VN+865D00, VG2831VM2924AGA, VG2231UM294NBGC, VG2231WN292NBGA, VG2831UM+5UGGA, VG2831UM+926GGA, VG2831UN+865E01, VG2831UM294NGGA, VG2431UN, VG2831UM292NAGA, VG2831UM2926GGC, VG2431UM+845E01, VG2831VM292NAGA, VG2231UM+94NGGA, VG2231UM+926BGA, VG2231TM+926AGC, VG2231YN2924GGA, VG2231VM+924GGC, VG2831UM2926BGA, VG2831VM+926BGC, VG2831VM2946GGC, VG2231WN2924AGC, VG2231TM+946GGA, VG2831UM+916AGC, VG2831UM+926AGC, VG2231WN+602HGC, VG2831TM+843E02, VG2831TM+926BGA, VG2431TM+843E02, VG2831UM+946GGC, VG2231TL+823C02, VG2231WN2926BGA, VG2231YN+867E02, VG2231YN+302HGC, VG2831TM+843E01, VG2831UM2926GGA, VG2831VM2926BGA, VG2831TM+92NBGC, VG2231UM292NAGC, VG2831TM+916AGA, VG2231TM+92NAGC, VG2431UN+865C02, VG2831TM+5UAGA, VG2231VM294NGGC, VG2231UM2924GGC, VG2831UM2924AGA, VG2831UM+92NGGA, VG2431UM+845E02, VG2231VM+845E02, VG2231VM2946BGC, VG2231UM+301AGA, VG2231UM2946BGA, VG2231VM2924GGA, VG2231WN+867C01, VG2831TM+924GGA, VG2831VM+92NAGC, VG2831TM+5UGGA, VG2831VM+845E01, VG2231UM+845C00, VG2231UN+865D02, VG2231WN294NGGC, VG2431UM+845D00, VG2231VN+602HGC, VG2831TM+300AGC, VG2231VN+865E02, VG2231VN+865D02, VG2231TM+92NBGC, VG2231UM+94NBGA, VG2831TM+94NBGA, VG2831UM+94NAGA, VG2431VN+865E02, VG2231TM+926BGC, VG2231UL+823C01, VG2231WN2926GGA, VG2231VM+845C00, VG2431VN+865E01, VG2231YN+867E01, VG2831VM+845D00, VG2431WN+867D02, VG2431UN+865C00, VG2831UM+916AGA, VG2231YN+867D01, VG2231TM+916AGC, VG2831VM+5UAGA, VG2831VM2924AGC, VG2431VM+845E00, VG2831UN+865C02, VG2831UM+916GGA, VG2831UM+926AGA, VG2831UM+845D02, VG2831UM2946BGA, VG2231UM+845C01, VG2831UM+92NBGC, VG2831UM+845D01, VG2231YN+302AGA, VG2231UM+926BGC, VG2231TL+823D02, VG2231WN2924AGA, VG2831TM+92NAGA, VG2231WN+302AGA, VG2831TM+94NAGA, VG2431VM, VG2231TM+946GGC, VG2431TM+843C01, VG2831VM294NBGC, VG2231UM292NAGA, VG2231UM+92NGGC, VG2831VM+301AGA, VG2231YN+302AGC, VG2431VM+845E02, VG2231VM+845C02, VG2831UM294NAGC, VG2831VM+94NAGC, VG2231UM292NGGC, VG2231YN+602HGC, VG2231UN+865E01, VG2831UM+845C00, VG2231UM294NAGC, VG2831UM+845C01, VG2831TM+843C02, VG2231TL+823C00, VG2231UM+946GGC, VG2231UM+845D02, VG2231TM+924GGC, VG2231UM+301HGC, VG2431VN+865D01, VG2231UM+845E01, VG2431YN+867C01, VG2831UM2946GGC, VG2231UN+865E00, VG2831VM+301AGC, VG2431UM+845C02, VG2231WN294NGGA, VG2831VM2926GGC, VG2231TM+946BGA, VG2231VM2946GGC, VG2231WN294NBGA, VG2231UM292NBGA, VG2831TM+94NGGC, VG2231UM2926BGC, VG2231VM294NAGC, VG2831VM294NGGA, VG2831VM2926BGC, VG2831VM+845E02, VG2431YN+867C00, VG2831UM+94NBGC, VG2831TM+946BGA, VG2231TM+92NGGC, VG2231VM2924AGC, VG2231UM+916AGA, VG2231UM+92NGGA, VG2831TM+946AGA, VG2231WN, VG2431YN+867D02, VG2231TM+843E00, VG2231UM+926AGA, VG2231WN292NAGA, VG2231VM+924AGA, VG2231UM, VG2831VM+924AGC, VG2231VM2926BGA, VG2231UM294NGGC, VG2831VM+946GGC, VG2831VM+301HGC, VG2231TL+823C01, VG2231UM2926BGA, VG2231UM2926GGC, VG2231UM+845C02, VG2831VM+926GGA, VG2831VM+94NGGA, VG2231WN294NBGC, VG2231TM+843E01, VG2231YN+867C01, VG2831TM+926GGC, VG2231TM+843C01, VG2231UM292NGGA, VG2231YN2924AGA, VG2831UM+926BGC, VG2431WN+867E02, VG2231UM2924AGC, VG2831UM+926BGA, VG2831UM+92NAGA, VG2231YN2924AGC, VG2231UN+865C00, VG2231YN2924GGC, VG2431WN, VG2431VN, VG2831TM+946AGC, VG2231TM+94NGGA, VG2231VM2946BGA, VG2231TM+300HGC, VG2231UM+926GGA, VG2831UM292NBGA, VG2231TM+946AGC, VG2831VM+924GGA, VG2831UM+924AGC, VG2831VM294NAGA, VG2831TM+300AGA, VG2831UM+924AGA, VG2231VM+924GGA, VG2231VM+845D01, VG2831TM+916GGC, VG2831VM, VG2231VM, VG2831TM+843C01, VG2431VM+845E01, VG2231UL+823E02, VG2831VM+916AGA, VG2231WN+867C02, VG2231UM+92NBGC, VG2231WN+867E01, VG2831UM+845C02, VG2831UM292NBGC, VG2231UM+92NBGA, VG2231VM+845E01, VG2231VM+924AGC, VG2831UM292NGGC, VG2231WN294NAGC, VG2831TM+94NAGC, VG2231UN+865C01, VG2231UM2946GGA, VG2431WN+867C02, VG2831VM294NGGC, VG2231TM+94NAGA, VG2231UM+916GGA, VG2231YN+867E00, VG2231VM292NBGC, VG2231WN2924GGA, VG2231VN+602AGC, VG2231UL+823D01, VG2831UM+845E02, VG2231UM+94NAGA, VG2431TM+843E00, VG2431UN+865E01, VG2831TM+946GGA, VG2831UM292NGGA, VG2231YN, VG2231TM+92NAGA, VG2231VM+301HGC, VG2231UL+823E00, VG2831TM+924AGC, VG2231VM2926GGC, VG2231WN2926BGC, VG2431UM+845D02, VG2231TM+843D02, VG2231VM292NAGA, VG2831VM+916GGA, VG2231TM+926BGA, VG2431VN+865C01, VG2831TM+843D00, VG2231WN+867D02, VG2231VM292NGGA, VG2231TM, VG2831VM292NGGA, VG2231TM+843E02, VG2831UM+845D00, VG2231VM+301AGA, VG2431TM+843D00, VG2231VM+5UGGA, VG2231VM+845D02, VG2431YN+867E00, VG2831VM+946BGC, VG2831VM292NAGC, VG2431UN+865E02, VG2831VM+946AGC, VG2831VM+845C00, VG2231UN+865C02, VG2231WN+302HGC, VG2231TM+5UGGA, VG2431WN+867C00, VG2831VM+924GGC, VG2231UM+946BGA, VG2231UM+946BGC, VG2831UN+865D01, VG2831VM+845C02, VG2831UM, VG2831, VG2831UM+946AGA, VG2831UM+92NGGC, VG2231VM+845D00, VG2231UM+916AGC, VG2231YN+867D02, VG2831TM+926AGC, VG2231VM2924GGC, VG2831VM2924GGA, VG2831UM2946GGA, VG2431WN+867E00, VG2831VM+946AGA, VG2231UN+865D00, VG2831UM2924GGC, VG2231UM+924AGA, VG2231UL, VG2231UM+946AGC, VG2431UN+865E00, VG2431YN+867E01, VG2231WN292NAGC, VG2231YN+867D00, VG2831UM+916GGC, VG2231UM+92NAGC, VG2431WN+867D01, VG2831UM+5UAGA, VG2831TM+843D01, VG2231UM294NGGA, VG2231TM+94NGGC, VG2831UM+946AGC, VG2231TM+916AGA, VG2831VM+916AGC, VG2831UM+924GGA, VG2831VM+94NBGC, VG2831VM2946BGA, VG2431UM+845C00, VG2831UM+946BGA, VG2231VM+845C01, VG2231YN+602AGC, VG2831TM+92NAGC, VG2431UN+865C01, VG2431YN+867E02, VG2431VM+845C01, VG2231TM+843C00, VG2231TL+823E01, VG2831UM+946GGA, VG2431YN, VG2231VM294NAGA, VG2431VM+845D00, VG2231VM2926GGA, VG2431VM+845D01, VG2431UN+865D02, VG2831TM+843D02, VG2831VM+94NGGC, VG2831VM2946GGA, VG2231TL+823D00, VG2831TM+926GGA, VG2231VM2946GGA, VG2231TM+843D01, VG2231YN+867C00, VG2831TM+946BGC, VG2831TM+92NBGA, VG2231UL+823D00, VG2831UN+865E02, VG2831TM+924GGC, VG2231UM2946BGC, VG2231VN+865D00, VG2831TM+843C00, VG2831UM294NBGA, VG2831VM292NBGC, VG2831UM292NAGC, VG2231UM2946GGC, VG2831VM+5UGGA, VG2231UM2926GGA, VG2231TM+92NBGA, VG2831UN+865E00, VG2831VM+926GGC, VG2231WN2924GGC, VG2831VM+92NGGC,Business: Building Automation and Controls,Brand: Johnson Controls,Category: Flanged Globe or Ball Valve and Actuator,Product: VG2000,Document Type: Product Bulletin,Document Number: LIT-977133"
YK Style G Unit Components,/viewer/document/hTxiJh~VjzreOW1L0DIH6w,"Business: Chillers,Brand: YORK,Category: Centrifugal,Product: YK,Document Revision: 1113,Document Type: Part List,Document Number: 160.75-RP1"
At a Glance: What’s New at Release 6.1,/viewer/document/_YX6gLNvv1W8z31V2DXYVw,"Business: Building Automation and Controls,Brand: Metasys,Category: General System Information,Product: Metasys System,Version: 6.1,Document Type: Release Note,Document Number: LIT-12011876"
exacqVision VideoIQ Analytics Integration Guide,/viewer/document/Besc7M8pBoO25sEOpNBqjA,"Brand: Exacq,Category: VMS Software,Document Type: Integration Guide"
FAC2612-1/FAC2612-2 Advanced Application Field Equipment Controllers Global Safety Data Sheet,/viewer/document/iFxr5pJWBPUo86NL8567yg,"Product code: MS-FAC2612-1, MS-FAC2612-2,Business: Building Automation and Controls,Brand: Metasys,Category: Field Device,Product: FAC26 Advanced Application Field Equipment Controller,Document Type: Application Note,Part Number: 24-10651-18"
exacqVision intuVision Panoptes Integration Guide,/viewer/document/U6LMmAM0Pv0HEf_~YCgxHw,"Brand: Exacq,Category: VMS Software,Document Type: Integration Guide"
YR Style A-C T0-T3 Rotary Screw Liquid Chillers,/viewer/document/gpPkelC~RCZwaP5XzE4xKw,"Business: Chillers,Brand: YORK,Category: Screw Water Cooled,Product: YR,Document Revision: 1113,Document Type: Part List,Document Number: 160.81-RP5"
"Model 2190-9173, 2-Point I/O Module Provides Supervised Input and Control Relay Output",/viewer/document/sb77wfrOgnrf8LftAAjjnA,"Brand: Simplex,Category: Sensors and Initiating Devices,Product: 2190-9173 2-Point I/O Module,Document Revision: 3,Document Type: Datasheet,Document Number: S2190-0022"
VPA PI Balancing Control Valve (DN25-50) Installation Instructions,/viewer/document/J4HZg_GDYKxo0y1nqYucUw,"Business: Building Automation and Controls APAC,Brand: Johnson Controls,Category: Flanged Globe or Ball Valve and Actuator,Product: VPA,Document Type: Installation Guide,Document Number: 602D-B01A-NC"
VPA VAP Balancing Valve Actuator Installation Instructions,/viewer/document/g~RFxQ341J~~kXIkGKHHPA,"Business: Building Automation and Controls APAC,Brand: Johnson Controls,Category: Flanged Globe or Ball Valve and Actuator,Product: VPD,Document Type: Installation Guide,Document Number: 601U-B01A-NC"
