title,link,metadata
T600MSx-3 Multi-Stage Thermostat Installation Guide,/viewer/document/VZggCNYluHb_IpeLEFrhfg,"Product code: T600MSP-3, T600MSN-3,Business: Building Automation and Controls,Brand: Johnson Controls,Category: Non-Programmable Thermostat, Programmable Thermostat,Product: T600MSx-3 Thermostat,Document Type: Installation Guide,Part Number: 24-9890-617"
TEP/TEA Series Platinum Temperature Sensors and TQ-6000-1 Accessory Transmitter Installation Guide,/viewer/document/_1VCe31c8u12o9OquPQV9Q,"Product code: TEP/TEA Series, TQ-6000-1,Business: Building Automation and Controls,Brand: Johnson Controls,Category: Temperature Sensor, Temperature Transmitter,Product: TEP Probe/TEA Averaging Platinum Temperature Sensor, TQ-6000 Transmitter,Document Revision: F,Document Type: Installation Guide,Part Number: 24-40347-7"
M9200-100 Threaded Conduit Adapter Kit for M9210(20) and M9208 Series Actuators Installation Guide,/viewer/document/p_8cy0s_vVAbgMsg0XS6Pg,"Business: Building Automation and Controls,Brand: Johnson Controls,Category: Electric Actuator,Product: M9200-100, M9208, M9210,Document Type: Installation Guide,Part Number: 34-1723-28"
"YCAS, YCWS, YCRS New Style Motor Protection Model",/viewer/document/G~sdgkUhUo6Uz5P1Bv0G0w,"Business: Chillers,Brand: YORK,Category: Screw Water Cooled,Product: YCAS, YCRS, YCWS,Document Revision: 614,Document Type: Service Information Letter,Document Number: SI0289"
Continuous Diagnostics Advisor Technical Bulletin,/viewer/document/2I~ctzQz0BJjf4sG3ElH1Q,"Product code: PX-CDA-AIR-0, PX-CDA-AIRT1-0, PX-CDA-CHL-B-0, PX-CDA-CHL-P-0, PX-CDA-CSRQRL-0, PX-CDA-AIRT3-0, PX-CDA-AIRT2-0, PX-CDA-AIRT4-0, PX-CDA-AIRT6-0, PX-CDA-AIRT5-0,Business: Building Automation and Controls,Brand: Johnson Controls,Category: Software Application,Product: Panoptix Platform,Document Type: Technical Bulletin,Document Number: LIT-12011730"
Spring Kit Procedure for Use with V-3000-8001 or V-3000-8003 Pneumatic Actuators Installation Guide,/viewer/document/OrJoEcMdTfQ9jFTxNMsiXA,"Product code: V-3000-8001, VG7000-1004, VG7000-1002, VG7000-1003, VG7000-1001, VG7000-1006, VG7000-1008, VG7000-1005, VG7000-1007, V-3000-8003, VG7000-1009,Business: Building Automation and Controls,Brand: Johnson Controls,Category: Pneumatic Actuator,Product: V-3000-8001, V-3000-8003,Document Revision: A,Document Type: Installation Guide,Part Number: 14-1078-14"
V-9502-76 Positioner Kit for V-400/V-500 Pneumatic Actuators,/viewer/document/d5Wfj2qvDkMURXRs8pKQ3A,"Product code: V-9502-76,Business: Building Automation and Controls,Brand: Johnson Controls,Category: Pneumatic Actuator,Product: V-9502-76,Document Type: Installation Guide,Part Number: 14-384-25"
FEC26 Extended Temperature Field Equipment Controller Installation Instructions,/viewer/document/iAg6h4O433k~Ofiuo7TXUg,"Product code: MS-FEC2611-0ET,Business: Building Automation and Controls,Brand: Metasys,Category: Field Device,Product: FEC26 Field Equipment Controller,Document Type: User Guide,Part Number: 24-10143-292"
YST Chiller Maintenance Requirements Chiller Log Sheet,/viewer/document/ZXuG_uuB6HxVNEEspFMbxw,"Business: Chillers,Brand: YORK,Category: Centrifugal,Product: YST,Document Revision: 614,Document Type: Installation Guide,Document Number: 160.67-MR1"
AS-CVTPRO300-1 and AS-CVTPRO400-1 Zone Bus/N2 Bus Interface Converters Installation Guide,/viewer/document/Tr3bQhuPzpGHrkvoPUT_YA,"Product code: AS-CVTPRO300-1, AS-CVTPRO400-1,Business: Building Automation and Controls,Brand: Metasys,Category: Gateway/Router,Product: CVTPRO,Document Revision: A,Document Type: Installation Guide,Part Number: 24-10158-0"
AS-CVTPROx00-1 Zone Bus/N2 Bus Interface Converter Installation Guide,/viewer/document/Xgdob_JFzXK9DErwtZYLEw,"Product code: AS-CVTCBL-700, AS-CVTPRO100-1, AS-CVTPRO200-1,Business: Building Automation and Controls,Brand: Metasys,Category: Gateway/Router,Product: CVTPRO,Document Type: Installation Guide,Part Number: 24-9544-0"
S610ep Ethernet Reader Installation Manual,/viewer/document/yCiR9qooTsAuZOyfhx6XpQ,"Business: Access Control,Brand: CEM Systems,Category: Hardware,Product: S610ep,Document Revision: 1.2,Document Type: Installation Guide,Part Number: S610EP_IM-57-1.2"
S610sp Serial Reader Installation Manual,/viewer/document/RCDgaJYNC6BXURB6T5w1Kw,"Business: Access Control,Brand: CEM Systems,Category: Hardware,Product: S610sp,Document Revision: 1.1,Document Type: Installation Guide,Part Number: s610-IM-0050-1.1"
Upgrading Firmware EPROMs for DX-91x0 Installation Guide,/viewer/document/G5Z9tLVVAJpiThLiqmPedw,"Product code: DX-9100-8913,Business: Building Automation and Controls,Brand: Johnson Controls,Category: Field Device,Product: DX-9100, DX-9120,Document Type: Installation Guide,Part Number: 24-8465-7"
Metasys System UL 864 9th Edition UUKL/ORD-C100-13 UUKLC Smoke Control System Catalog Page,/viewer/document/3wLZiaUq0nYgKwrTIfyg3Q,"Product code: PAGJ00U11EC0, ISOBAR8Ultra, A20N16MPP, SMOKE-MOVKIT-0U, PAN-ENH2436WDP, 00-00051-01, A20N16BLP, PAKGJJU12BC0, PAN-ENC2024WD, MS-FEU2610-0U, PAN-ENC3042WDP, MS-IOM3710-0U, PAN-ENC1620WD, PAJJ00U11AC0, EIS6-100T/FT, MS-IOM3711-0U, PAN-ENC2424WDP, SMK-MOVKIT-MSTP, PAN-ENH2424WD, PAN-96VAXFR-U, PNET1GB, MS-VMA1610-1U, EISK5-100T, PAN-ENC3042WD, EIS8-100T, MS-FEC1611-1U, PAN-ENH1620WD, MS-VMA1620-1U, MS-VMA1620-0U, SMK-UPLABL-0U, PAG100U11EC0, PAN-ENC2436WDF, SMOKE-TRNKIT-1U, PAN-PWRSP-U, PAN-ENC3648WD, MS-FEU1610-0U, PA5100U01FC0, PA5300U11FC0, PAN-ENH2436WD, MS-IOM2711-0U, EIMK-100T/FT, ISOBAR12Ultra, PAN-ENC2436WD, PAN-ENC3648WDP, PAN-ENH1620WDP, PAN-ENC2024WDP, MS-NCE2560-0U, MS-IOM2710-0U, PAN-ENH2024WD, 00-00052-01, MS-IOM1710-0U, MS-NAE3510-2U, MS-NAE5510-1U, MS-VMA1610-0U, PAN-ENC1620WDP, PAN-ENC2424WDF, PAKG00U11AC0, MS-IOM4711-0U, PAGE00U11EC0, MS-IOU4710-0U, NU-RPT101-1U, MS-NAE4510-2U, PA0P00010FC0-U, PA5200U15CC0, 2960-24TC-S, MS-IOM1711-0U, MS-FEC2611-0U, PAN-ENC2436WDP, PAN-ENH2024WDP, PAN-ENH2424WDP, MS-NAE5510-2U, PARE00U11BC0, PAN-ENC2424WD,Business: Building Automation and Controls,Brand: Metasys,Category: Supervisory Device,Product: UL864 UUKL Listed Device,Version: 5.2,Document Type: Catalog Page,Document Number: LIT-1900612"
V6 YD OptiView Chiller Control Panel,/viewer/document/JX9mStxtdhHrwY6hJxoxlQ,"Business: Chillers,Brand: YORK,Category: Centrifugal,Product: YD,Document Revision: 614,Document Type: Service Information Letter,Document Number: SI0287"
Facility Explorer FX05 (Advanced) Field Controller Technical Bulletin,/viewer/document/ME1WIpc6OF7De1Dkz7QsFg,"Product code: LP-FX05P11-012C, LP-FX05P13-012C, LP-FX05P12-012D, LP-FX05L11-022C, LP-KIT001-010C, LP-FX05P12-012C, LP-FX05P13-022C, LP-FX05N11-002C, LP-NET051-000C, LP-NET05A2-000C, LP-FX05L12-022C, LP-FX05P12-002D, LP-FX05P01-000C, LP-FX05L11-002C, LP-FX05P12-022C, LP-FX05N13-012C, LP-FX05P12-002C, LP-FX05P13-002D, LP-FX05P13-012D, LP-FX05L13-012C, LP-FX05N11-012C, LP-KIT006-007C, LP-FX05P13-022D, LP-KIT006-004C, LP-FX05L11-012C, LP-KIT006-006C, LP-FX05L13-002C, LP-FX05N13-002C, LP-FX05N12-002C, LP-KIT005-010C, LP-KIT006-005C, LP-FX05P11-012D, LP-KIT004-010C, LP-RTC05-000C, LP-FX05P13-002C, LP-KIT002-010C, LP-FX05N12-022C, LP-FX05N11-022C, LP-KIT005-001C, LP-FX05L12-002C, LP-FX05P11-022C, LP-FX05N12-012C, LP-FX05L13-022C, LP-FX05P12-022D, LP-FX05L12-012C, LP-FX05P11-022D, LP-FX05N13-022C, LP-FX05P12-502C, LP-FX05P11-002D, LP-FX05P11-002C,Business: Building Automation and Controls,Brand: Facility Explorer,Category: Field Device,Product: FX05 Field Controller,Document Type: Technical Bulletin,Document Number: LIT-12011155"
Facility Explorer FX06 Field Controller Technical Bulletin,/viewer/document/WBUYLDGYbvDyjUUXk~Xb4g,"Product code: LP-NET061-000C, LP-FX06P10-000C, LP-FX06P32-000C, LP-FX06P21-000C, LP-FX06P00-920C, LP-KIT006-020C, LP-FX06P22-000C, LP-FX06P30-000C, LP-FX06P12-000C, LP-FX06P00-020C, LP-FX06P20-000C, LP-FX06P30-900C, LP-FX06P33-000C, LP-FX06P00-000C, LP-KIT006-010C, LP-FX06P02-000C, LP-FX06P03-000C, LP-FX06P20-920C, LP-NET062-000C, LP-FX06P00-900C, LP-FX06P11-000C, LP-FX06P31-000C, LP-NET063-000C, LP-FX06P20-900C, LP-FX06P20-020C, LP-FX06P01-000C, LP-FX06P13-000C, LP-FX06P23-000C, LP-KIT006-015C, LP-KIT006-025C,Business: Building Automation and Controls,Brand: Facility Explorer,Category: Field Device,Product: FX06 Field Controller,Document Type: Technical Bulletin,Document Number: LIT-12011166"
FX Input/Output (I/O) Modules – XM07 and XM14 Technical Bulletin,/viewer/document/Jtte9xXo0HGZLiUDWeKeMg,"Product code: LP-XM07X61-000C, LP-XM14B61-000C, LP-XM07B01-000C, LP-XM14X61-000C, LP-XM07B61-000C, LP-XM14X51-000C, LP-NET071-000C, LP-NET161-000C, LP-XM07B11-000C, LP-XM14B01-000C, LP-XM07X11-000C, LP-XM14B51-000C, LP-XM07X01-000C, LP-KIT014-200C, LP-XM07B51-000C, LP-XM14X01-000C, LP-XM14X11-000C, LP-XM14B11-000C, LP-KIT007-200C, LP-XM07X51-000C,Business: Building Automation and Controls,Brand: Facility Explorer,Category: Field Device,Product: XM FX Input/Output Module,Document Type: Technical Bulletin,Document Number: LIT-12011455"
FX07 Field Controller Technical Bulletin,/viewer/document/b4gii1hFl4OH1RTRdYZDTQ,"Product code: LP-FX07D20-000C, LP-FX07D34-000C, LP-FX07D02-000C, LP-FX07D21-000C, LP-FX07D70-000C, LP-FX07D03-000C, LP-FX07D83-000C, LP-FX07D01-000C, LP-FX07D22-000C, LP-FX07D00-000C, LP-FX07D32-000C, LP-FX07D23-000C, LP-FX07D81-000C, LP-FX07D24-000C, LP-FX07D54-000C, LP-FX07D30-000C, LP-FX07D04-000C, LP-FX07D53-000C, LP-FX07D73-000C, LP-FX07D33-000C, LP-FX07D74-000C, LP-FX07D71-000C, LP-FX07D31-000C, LP-FX07D80-000C, LP-FX07D84-000C, LP-FX07D72-000C, LP-FX07D52-000C, LP-FX07D50-000C, LP-FX07D51-000C, LP-FX07D82-000C,Business: Building Automation and Controls,Brand: Facility Explorer,Category: Control Panel,Product: FX07 Field Controller,Document Type: Technical Bulletin,Document Number: LIT-12011269"
FX14 Field Controller Technical Bulletin,/viewer/document/LUMdAhIf9eMtVwgKAo0IaQ,"Product code: LP-FX14D63-000C, LP-FX14D24-000C, LP-FX14D60-000C, LP-FX14D62-000C, LP-FX14D74-000C, LP-FX14D70-000C, LP-FX14D12-000C, LP-NET142-000C, LP-FX14D72-000C, LP-FX14D21-000C, LP-FX14D23-000C, LP-FX14D61-000C, LP-FX14D64-000C, LP-FX14D73-000C, LP-FX14D71-000C, LP-FX14D10-000C, LP-FX14D20-000C, LP-FX14D13-000C, LP-FX14D14-000C, LP-FX14D11-000C, LP-FX14D22-000C,Business: Building Automation and Controls,Brand: Facility Explorer,Category: Field Device,Product: FX14 Field Controller,Document Type: Technical Bulletin,Document Number: LIT-12011164"
FX15 Controller Technical Bulletin,/viewer/document/kjQakuvSXSScFrB1AiLulQ,"Product code: LP-FX15X11-000C, LP-FX15D60-000C, LP-FX15X21-000C, LP-DIS65P10-0C, LP-DIS60P11-0C, LP-FX15X20-000C, LP-FX15D10-000C, LP-FX15D21-000C, LP-FX15D61-000C, LP-DIS60P10-0C, LP-FX15D22-000C, LP-FX15D20-000C, LP-FX15D71-000C, LP-FX15D12-000C, LP-FX15X10-000C, LP-FX15D11-000C, LP-FX15D62-000C, LP-NET152-010C, LP-DIS60U10-C, LP-FX15X22-000C, LP-FX15D70-000C, LP-NET151-010C, LP-FX15X12-000C, LP-FX15D72-000C,Business: Building Automation and Controls,Brand: Facility Explorer,Category: Field Device,Product: FX15 Field Controller,Document Type: Technical Bulletin,Document Number: LIT-12011107"
FX16 Master Controller Technical Bulletin,/viewer/document/wJqhFD8IMgsXygzfU6Z7eg,"Product code: LP-FX16D03-000C, LP-FX16DEM-001C, LP-FX16X52-000C, LP-FX16X13-000C, LP-FX16X50-000C, LP-FX16X54-000C, LP-FX16X03-000C, LP-FX16X63-000C, LP-FX16DEM-003C, LP-KIT007-001C, LP-FX16X14-000C, LP-FX16D10-000C, LP-FX16X61-000C, LP-FX16D13-000C, LP-FX16DEM-002C, LP-FX16X00-000C, LP-FX16D00-000C, LP-KIT007-013C, LP-FX16X53-000C, LP-FX16X51-000C, LP-FX16D12-000C, LP-FX16X10-000C, LP-FX16X12-000C, LP-FX16X02-000C, LP-FX16D02-102C, LP-FX16X01-000C, LP-FX16X64-000C, LP-FX16X60-000C, LP-FX16X04-000C, LP-FX16D02-000C, LP-FX16D11-000C, LP-FX16X01-511C, LP-KIT007-014C, LP-NET163-000C, LP-FX16D01-000C, LP-FX16X11-000C, LP-FX16X62-000C,Business: Building Automation and Controls,Brand: Facility Explorer,Category: Field Device,Product: FX16 Master Controller,Document Type: Technical Bulletin,Document Number: LIT-12011108"
FXVMA VAV Box Controller Technical Bulletin,/viewer/document/c3f2sfF7FRB8Yeq7R0yJuw,"Product code: LP-FXVMA11-1C, LP-FXVMA14-1C,Business: Building Automation and Controls,Brand: Facility Explorer,Category: Field Device,Product: FXVMA VAV Box Controller,Document Type: Technical Bulletin,Document Number: LIT-12011249"
MD20 Master Display Technical Bulletin,/viewer/document/l3mAPU1KYs0FeGfuZXZUpw,"Product code: LP-MD20D03-000C, LP-MD20D05-000C, LP-KIT020-000C, LP-MD20D02-000C, LP-MD20D01-000C, LP-MD20D04-000C, LP-MD20D00-000C, LP-KIT007-015C,Business: Building Automation and Controls,Brand: Facility Explorer,Category: Supervisory Device,Product: FX MD20 Master Display Controller,Document Type: Technical Bulletin,Document Number: LIT-12011109"
PDF Test with nothing set in the PDF properties,/viewer/document/s_cHbhSKMZjUV5qwiWWilg,"Brand: Facility Explorer,Category: Field Device,Product: FX16 Master Controller,Document Type: Technical Bulletin"
PDF Test with something set in the PDF properties,/viewer/document/CiR7x84u~cqt7SIYW0rifg,"Brand: Facility Explorer,Category: Supervisory Device,Product: FX MD20 Master Display Controller,Document Type: Technical Bulletin"
YIA Absorption - New Style Level Switches (1F and 3F),/viewer/document/puxH9k6I4svhdI08RTd9lQ,"Business: Chillers,Brand: YORK,Category: Absorption,Product: YIA,Document Revision: 614,Document Type: Service Information Letter,Document Number: SI0213"
"SSS 7L-B, 14L-B, 26L-B, 33L-B, 7LK-B, 14LK-B, 26LK-B, 33LK-B Style B Liquid Cooled Solid State Starter, Drives and Starters",/viewer/document/8qBhTP4DHSE9mov3dvM0ww,"Business: Chillers,Brand: YORK,Category: Centrifugal,Product: YK, YK-EP, YR, YS, YT,Document Revision: 614,Document Type: Part List,Document Number: 160.00-RP3"
VF7000 Series Butterfly Valve Installation Instructions,/viewer/document/fuGoV7w1kGkSZMGicVIB_A,"Business: Building Automation and Controls APAC,Brand: Johnson Controls,Category: Butterfly Valve,Product: VF7000,Document Type: Installation Guide,Document Number: 603A-BO1A-NA"
CVR83A-600R Weather Cover Kit for M100 Series Motor Actuators Product Bulletin,/viewer/document/L1Z0wAkFV6vWCWq0hzvAaQ,"Product code: CVR83A-600R,Business: Building Automation and Controls,Brand: Johnson Controls,Category: Accessories,Product: CVR83A-600R,Document Revision: A,Document Type: Product Bulletin,Part Number: 34-523-8,Document Number: LIT-121375"
A350A/B  Electronic Temperature Control,/viewer/document/11FeVOOFPpk7h1iRa2pgFA,"Product code: A350AB-2C, A350BB-1C, A350AA-1C, A350AA-2C, S350, A350AB-1C, A350, A350BA-2C, A350BA-1C, A350AA-3C,Business: Building Automation and Controls,Brand: PENN Controls,Category: System 350 Single-Purpose Modular Control System,Product: A350A/B Temperature Control with Relay Output, S350A/B Temperature Stage Module,Series: System 350 Series,Document Type: Product Bulletin,Document Number: LIT-930010"
A350E Electronic Cooling Control,/viewer/document/vO63GuEp1FNjb9salZY9pA,"Product code: A350EA-4C, A350EB-1C, A350, S350,Business: Building Automation and Controls,Brand: PENN Controls,Category: System 350 Single-Purpose Modular Control System,Product: S350A/B Temperature Stage Module,Series: System 350 Series,Document Type: Product Bulletin,Document Number: LIT-930015"
EPP-1000 Series Electro-Pneumatic Positioners Installation Bulletin,/viewer/document/9jd_9WKMtKiIOOr4trpdXg,"Product code: EPP-1000-13, EPP-1000-22, EPP-1000-601, EPP-1000-8, EPP-1000-12, EPP-1000-23, EPP-1000-11, EPP-1000-21,Business: Building Automation and Controls,Brand: Johnson Controls,Category: Pneumatic Actuator,Product: Damper Actuator, EPP-1000,Document Type: Installation Guide,Document Number: LIT-2681275"
System 350 P352P Electronic Proportional Plus Integral Static Pressure Control,/viewer/document/K6VT5x9AFsM06RR_Fb_G9w,"Product code: P352PQ-2C, P352, P352PQ-1C,Business: Building Automation and Controls,Brand: PENN Controls,Category: System 350 Single-Purpose Modular Control System,Product: P352P Pressure Control with Analog Output,Series: System 350 Series,Document Revision: A,Document Type: Product Bulletin, Technical Bulletin,Part Number: 24-7664-486,Document Number: LIT-930042"
System 350 W351 Electrical On/Off Humidity Control,/viewer/document/mnMWH9QtITbrEnuZZV9rXQ,"Product code: W351AB-2C, HE-67S3-0N00P, W351AA-2C, W351AA-1C, HE-67S3-0N0BT, W351,Business: Building Automation and Controls,Brand: PENN Controls,Category: System 350 Single-Purpose Modular Control System,Product: W351 Humidity Control,Series: System 350 Series,Document Revision: D,Document Type: Product Bulletin, Technical Bulletin,Part Number: 24-7664-36,Document Number: LIT-930060"
W351P Electronic Proportional Plus Integral Humidity Control,/viewer/document/ocaL42jkhC39itYJaIh8HQ,"Product code: W351PN-2C, W351PP-1C, Y350R, D351, W351PN-1C, W351, S351,Business: Building Automation and Controls,Brand: PENN Controls,Category: System 350 Single-Purpose Modular Control System,Product: W351 Humidity Control,Series: System 350 Series,Document Revision: C,Document Type: Product Bulletin, Technical Bulletin,Part Number: 24-7664-478,Document Number: LIT-930062"
INTEVO All-in-One Security Platform Brochure,/viewer/document/6G8WD7vr2dGI6gxuRK8m9g,"Brand: Kantech,Category: Integrated Security Platform,Product: Intevo,Document Revision: R002,Document Type: Brochure,Document Number: KT0262-BR-201406-R02-CS-EN"
"YCWS0100SC, YCWS0120SC, YCWS0140SC, YCWS0180SC, YCWS0200SC, YCWS0220SC, YCWS0240SC Style B 60 Hz Remote Condenser Models YCRS0100, YCRS0120SC, YCRS0140SC, YCRS0180SC, YCRS0200SC, YCRS0220SC,",/viewer/document/LJpIIic3BTQADhcxX3LMIA,"Business: Chillers,Brand: YORK,Category: Screw Water Cooled,Product: YCWS,Document Revision: 514,Document Type: Part List,Document Number: 201.24-RP1"
"Series Y63, Y64, Y65, Y66, and Y69 Transformers Installation Guide",/viewer/document/6dKFJ0_Npc3CpfA6mVqe6w,"Product code: Y63F22-0, Y64T15-0, Y65T31-0, Y63T31-0, Y65F13-0, Y63T22-0, Y66T12-0, Y66F12-0, Y69T15-0, Y65A13-0, Y65G13-0, Y65F42-0, Y66T13-0, Y64T22-0, Y65T42-0, Y66F13-0, Y65S13-0, Y64T21-0, Y65T54-0, Y65A13-0D, Y65A21-0, Y65T42-0D,Business: Building Automation and Controls,Brand: Johnson Controls,Category: Electric Actuator,Product: Y63, Y64, Y65, Y66, Y69,Document Revision: C,Document Type: Installation Guide,Part Number: 24-8895-0"
Addressable Duct Sensor Housing 4098-5214 for the 4098-5202 Photoelectric Sensor,/viewer/document/NP1OXocBz4A7jtsJ~K3zMg,"Brand: Simplex,Category: Sensors and Initiating Devices,Product: Addressable Duct Sensor Housing 4098-5214,Document Revision: 2,Document Type: Datasheet,Document Number: S4098-0046"
Variable Air Volume Modular Assembly (VMA) 1400 Series Application Note,/viewer/document/IZ45C8Mhn5i5wTEr5EBevA,"Product code: AP-VMA1430-0D, AP-VMA1420-0M, AP-VMA1440-0, AP-VMA1430-0G, AP-VMA1420-0D, AP-VMA1420-0G, AP-VMA1430-0,Business: Building Automation and Controls,Brand: Metasys,Category: Field Device,Product: VMA14 VAV Modular Assembly,Document Type: Application Note,Document Number: LIT-6375125"
"Audible Notification Appliances Speakers, 25 or 70.7 VRMS, Wall or Ceiling Mount",/viewer/document/YSt2LhgyozAmL20NP2ad5w,"Brand: Simplex,Category: Notification Appliances and Speakers,Product: Wall and Ceiling Mount Speaker Appliance,Document Revision: 7,Document Type: Datasheet,Document Number: S4902-0003"
Speaker/Visible Appliances; Speaker with Strobe Selectable as Free-Run or Synchronized,/viewer/document/lh4cHeshsDcitVAtN6FjVw,"Brand: Simplex,Category: Notification Appliances and Speakers,Product: Speaker/Visible Appliances; Speaker with Strobe Selectable as Free-Run or Synchronized,Document Revision: 5,Document Type: Datasheet,Document Number: S4903-0016"
"Speaker/Visible Notification Appliance with TrueAlert Non-Addressable Strobe, Selectable as Free-Run or Synchronized",/viewer/document/wsBLPI98CxD6cBZ3UoeESg,"Brand: Simplex,Category: Notification Appliances and Speakers,Product: Speaker/Visible Notification Appliance with TrueAlert,Document Revision: 7,Document Type: Datasheet,Document Number: S4903-0015"
"Speaker/Visible Notification Appliances with TrueAlert Non-Addressable Strobe; Round, Ceiling Mount",/viewer/document/iYEAOe91l~WyKh1v8elMlg,"Brand: Simplex,Category: Notification Appliances and Speakers,Product: Speaker/Visible Notification Appliances with TrueAlert,Document Revision: 5,Document Type: Datasheet,Document Number: S4903-0019"
Visible Notification Appliances with Speaker and Multi-Candela Strobe; Non-Addressable,/viewer/document/iXsXMPnnjI9WwzKrM392gg,"Brand: Simplex,Category: Notification Appliances and Speakers,Product: Speaker/Visible Notification Appliance,Document Revision: 9,Document Type: Datasheet,Document Number: S4906-0003"
Standard Control Panel Assembly Mounted in a 24 in. x 36 in. Enclosure Catalog Page,/viewer/document/qzvGiZK_ijrNbRAaiaR~kA,"Product code: PARD00001BH0, PARB00011BH4, PARA00001BH4, PARJ00001BH0, PARH00001BH0, PARD00011BH4, PARF00011BH0, PARB00001BH4, PARF00001BH4, PARM00001BH0, PARM00011BH0, PARA00011BH0, PARC00011BH0, PARE00001BH4, PARK00001BH0, PARD00011BH0, PARE00001BH0, PARA00011BH4, PARH00011BH0, PARJ00011BH0, PARC00001BH4, PARK00011BH0, PARE00011BH4, PARF00011BH4, PARF00001BH0, PARG00001BH0, PARC00001BH0, PARA00001BH0, PARG00011BH0, PARD00001BH4, PARB00011BH0, PARL00011BH0, PARB00001BH0, PARC00011BH4, PARL00001BH0, PARE00011BH0,Business: Building Automation and Controls,Brand: Metasys,Category: Control Panel,Product: Network Engine Control Panel,Document Type: Catalog Page,Document Number: LIT-1900474"
FEC16 Extended Temperature Field Equipment Controller Installation Instructions,/viewer/document/~dv4HxCH86bys_be8XQ2Qg,"Product code: MS-FEC1611-0ET, MS-FEC1611-1ET,Business: Building Automation and Controls,Brand: Metasys,Category: Field Device,Product: FEC16 Field Equipment Controller,Document Type: User Guide,Part Number: 24-10143-306"
Remote Emergency Telephone Equipment 2084 Series Firefighter Telephones,/viewer/document/p1apxdM6R_5QaoCuapd4gg,"Brand: Simplex,Category: Accessories,Product: 2084 Series Firefighter Telephones,Document Revision: 7,Document Type: Datasheet,Document Number: S12084-0001"
V5 YD OptiView Chiller Control Panel,/viewer/document/lXezrg2ISpcoSHqsl4Q1Ww,"Business: Chillers,Brand: YORK,Category: Centrifugal,Product: YD,Document Revision: 514,Document Type: Service Information Letter,Document Number: SI0286"
Connect ONE exacqVision Integration Guide,/viewer/document/p053nRSp22BYxxQDnZlfrQ,"Brand: Exacq,Category: VMS Software,Document Type: Integration Guide"
VLC2000 Series Electric Zone Valves Product Bulletin,/viewer/document/eptD5zRPupTvhoCzVKEkGg,"Business: Building Automation and Controls APAC,Brand: Johnson Controls,Category: Zone Valve,Product: VGA7000,Document Type: Product Bulletin"
"OptiView Panel Microboard Replacements, Control Panel",/viewer/document/ReIWX7par6ARPpiPZET3_g,"Business: Chillers,Brand: YORK,Category: YORK Enhancement,Product: OptiView,Document Revision: 514,Document Type: Service Information Letter,Document Number: SI0285"
Mac OS X Client and Active Directory/OpenLDAP/Kerberos,/viewer/document/nrxjJBHrQd1uwXn81yejuw,"Brand: Exacq,Category: VMS Software,Document Type: User Guide"
A320ABC Electronic Temperature Control,/viewer/document/B9sb69phWUhDJlKdNbhUBw,"Product code: A320ABC-1C,Business: Building Automation and Controls,Brand: PENN Controls,Category: Electronic Temperature Control,Product: A320 Electronic Temperature Control,Document Type: Product Bulletin, Technical Bulletin,Part Number: 24-7664-1334,Document Number: LIT-125187"
LX Scheduler Installation Instructions,/viewer/document/KrXdk4k1zZ6HFWq93htlAQ,"Product code: LX-SCHEDL-0,Business: Building Automation and Controls,Brand: Facility Explorer,Category: Software Application,Product: LX Software,Document Type: Installation Guide,Document Number: LIT-12011573"
LX Series Line Powered Fan Coil Unit Controller (PFCU) Installation Instructions,/viewer/document/N9AzJdWpd9r7qfZ5VEGq7A,"Product code: LX-PFCU-1, LX-PFCUA-1,Business: Building Automation and Controls,Brand: Facility Explorer,Category: Field Device,Product: LX Controller,Version: 5.4,Document Type: Installation Guide,Document Number: LIT-12011500"
LX Series Variable Air Volume (VAV) and Variable Volume Temperature (VVT) Controllers Installation Instructions,/viewer/document/ULn~0DjHurm8H05CWVgtIw,"Product code: LX-VAVLF-1, LX-VAVCF-1, LX-VAVLN-1, LX-VVTLF-1,Business: Building Automation and Controls,Brand: Facility Explorer,Category: Field Device,Product: LX Controller,Document Type: Installation Guide,Document Number: LIT-12011503"
LX-Display Installation Instructions,/viewer/document/i3iJyLJBMIUJcp3Mpg7_jA,"Product code: LX-DSWSC2-0, LX-DSWSC1-0,Business: Building Automation and Controls,Brand: Facility Explorer,Category: Software Application,Product: LX Software,Document Type: Installation Guide,Document Number: LIT-12011572"
P352AB Electronic Pressure Control Series,/viewer/document/VAqOtALJVhK8RPUfTwb3ww,"Product code: P352AB, P352AB-2C, P352, P352AB-4C, P352AB-3C,Business: Building Automation and Controls,Brand: PENN Controls,Category: System 350 Single-Purpose Modular Control System,Product: P352A/B Pressure Control with Relay Output,Series: System 350 Series,Document Revision: A,Document Type: Product Bulletin, Technical Bulletin,Part Number: 24-7664-1903,Document Number: LIT-930038"
System 350 P352PN Electronic Proportional Plus Integral Pressure Control for PSI Applications,/viewer/document/YVDkM8Yh5tibE3Cv_9nNKw,"Product code: P352PN, P352PN-4C, P352PN-2C, P352PN-3C, P352,Business: Building Automation and Controls,Brand: PENN Controls,Category: System 350 Single-Purpose Modular Control System,Product: P352P Pressure Control with Analog Output,Series: System 350 Series,Document Revision: A,Document Type: Product Bulletin, Technical Bulletin,Part Number: 24-7664-1911,Document Number: LIT-930044"
