title,link,metadata
INTEVO Compact Intuitive All-in-One Security Platform Datasheet,/viewer/document/93s2FKBk9NEYTBRv6K3V0w,"Brand: Kantech,Category: Integrated Security Platform,Product: Intevo,Document Revision: R03,Document Type: Datasheet,Document Number: KT0306-DS-201410-R03-A4-EN"
"Preaction System with DV-5 Deluge Valve Single Interlock, Supervised - Electric Actuation1-1/2 thru 8 Inch (DN40 thru DN200)",/viewer/document/X52CEptSWMrGq2NKcv0tAg,"Business: Tyco Fire,Brand: Tyco,Category: 1-1/2 thru 8 Inch (DN40 thru DN200), DV-5 Deluge Valve Single Interlock, Electric Actuation, Preaction System, Preaction Systems, Supervised,Document Type: Datasheet,Document Number: TFP1420"
S3040 User Manual,/viewer/document/iqiMjNGuBhU_3IwouiPfJA,"Business: Access Control,Brand: CEM Systems,Category: Hardware,Product: S3040,Document Revision: 1.3,Document Type: User Guide,Part Number: S3040-UG-0055-1.3"
Card Printing Solutions,/viewer/document/q6v1DqnStxe2b9pCDw3VNQ,"Brand: Kantech,Category: Hardware, Software,Product: EntraPass, ioProx, KT-400,Document Revision: R002,Document Type: Datasheet,Document Number: KT0250-DS-201409-R02-LT-EN"
EP-8000-101 Electro-Pneumatic Transducer Mounting Kit,/viewer/document/OQ0PgF4wW54eTdNck2JV3g,"Product code: EP-8000-101,Business: Building Automation and Controls,Brand: Johnson Controls,Category: Accessories,Product: Damper Actuator, EP-8000-101,Document Revision: B,Document Type: Installation Guide,Document Number: LIT-216730"
VA-8050-100 Mounting Kit Installation Guide,/viewer/document/AzvSrEnqfY8FYpHUTeefPg,"Product code: VA-8050-100,Business: Building Automation and Controls,Brand: Johnson Controls,Category: Pneumatic Actuator,Product: VA-8050-100,Document Revision: B,Document Type: Installation Guide,Part Number: 14-880-52"
"YST Design Level F Steam Turbine Drive OptiView Control Center - Auto Start, Control Panel",/viewer/document/m3QQ_5oVSpFyPEdvKrs0mg,"Business: Chillers,Brand: YORK,Category: Centrifugal,Product: YST,Document Revision: 914,Document Type: Wiring Diagram,Document Number: 160.67-PW3"
"YST Design Level F Steam Turbine Drive OptiView Control Center, Control Panel",/viewer/document/g3VFdHKfnnawH5WSE_SBYg,"Business: Chillers,Brand: YORK,Category: Centrifugal,Product: YST,Document Revision: 914,Document Type: Wiring Diagram,Document Number: 160.67-PW1"
Appliance Cover Selection Reference,/viewer/document/hHgcWLFbQGniKsMbqsJM_g,"Brand: Simplex,Category: Notification Appliances and Speakers,Product: TrueAlert Notification Appliance Covers,Document Revision: 2,Document Type: Datasheet,Document Number: S49CV-0001"
M100E Economizer Series Motor Actuator with R81EAA-3 Interface Board for Nickel Sensor Applications Product/Technical Bulletin,/viewer/document/yieQ~Xv5TpBqJW_O2LjBAQ,"Product code: M100E Series,Business: Building Automation and Controls,Brand: Johnson Controls,Category: Electric Actuator,Product: M100E,Document Type: Product Bulletin,Part Number: 34-636-216"
M9000-270 and M9000-271 Remote Mounting Kits Installation Guide,/viewer/document/HfuafqzW51PUmmVOU302Fg,"Product code: M9000-271, M9000-270,Business: Building Automation and Controls,Brand: Johnson Controls,Category: Electric Actuator,Product: M9000-270, M9000-271,Document Revision: A,Document Type: Installation Guide,Part Number: 34-636-2219"
M9203-100 Remote Mounting Kit Installation Guide,/viewer/document/SSsljl1Y3Yhlh1X5z5QYcg,"Product code: M9203-100,Business: Building Automation and Controls,Brand: Johnson Controls,Category: Electric Actuator,Product: M9203, M9203-100,Document Revision: A,Document Type: Installation Guide,Part Number: 34-636-2308"
M9203-115 Remote Mounting Kit Installation Guide,/viewer/document/V2oQr_ux6H2K4JqbaumLHA,"Product code: M9203-115,Business: Building Automation and Controls,Brand: Johnson Controls,Category: Electric Actuator,Product: M9203, M9203-115,Document Revision: A,Document Type: Installation Guide,Part Number: 34-636-2316"
M9203-250 Remote Mounting Kit Installation Guide,/viewer/document/ohyAxSY4lseTbHvko_THNw,"Product code: M9203-250,Business: Building Automation and Controls,Brand: Johnson Controls,Category: Electric Actuator,Product: M9203, M9203-250,Document Revision: A,Document Type: Installation Guide,Part Number: 34-636-2324"
M9206-DNx Series Electric Spring Return Economizer Damper Actuators Installation Guide,/viewer/document/lzFfO9G7n4IBiyAEdR8m5w,"Product code: M9206-DNA-3S, M9206-DNB-3S, M9206-DNx,Business: Building Automation and Controls,Brand: Johnson Controls,Category: Electric Actuator,Product: M9206-DNx,Document Type: Installation Guide,Document Number: LIT-1201401"
M9208-100 Remote Mounting Kit Installation Guide,/viewer/document/Bos~tYAllsDoN3FpD6piwQ,"Product code: M9208-100,Business: Building Automation and Controls,Brand: Johnson Controls,Category: Electric Actuator,Product: M9208-100,Document Revision: A,Document Type: Installation Guide,Part Number: 34-636-2197"
M9208-250 Remote Mounting Kit Installation Guide,/viewer/document/AfyIC0YBozSAp0tAqe5N8A,"Product code: M9208-250,Business: Building Automation and Controls,Brand: Johnson Controls,Category: Electric Actuator,Product: M9208-250,Document Revision: A,Document Type: Installation Guide,Part Number: 34-636-2200"
VA-4233-BGx Series Electric Valve Actuators Installation Guide,/viewer/document/TyIJQguvCiW9~yeBWS43Lg,"Product code: VA-4233-BGx,Business: Building Automation and Controls,Brand: Johnson Controls,Category: Electric Actuator,Product: VA-4233-BGx,Document Type: Installation Guide,Part Number: 34-1280-106,Document Number: LIT-1201147"
Y20BKT-1 Replacement Bracket Kit for M100 Series Motor Actuators Installation Guide,/viewer/document/KH8YQ9Es4bbJqhtxiDGz~A,"Product code: Y20BKT-1,Business: Building Automation and Controls,Brand: Johnson Controls,Category: Electric Actuator,Product: M100, Y20BKT-1,Document Type: Installation Guide,Part Number: 34-636-259"
FX Supervisory Controller Wireless TEC Option Card Installation Instructions,/viewer/document/GzMbn4Q~5gLbYsLvyOZ~Yw,"Product code: LP-FXWTC-0,Business: Building Automation and Controls,Brand: Facility Explorer,Category: Supervisory Device,Product: FX20 Supervisory Controller, FX30 Supervisory Controller, FX60 and FX60E Supervisory Controller, FX70 Supervisory Controller,Document Type: Installation Guide,Part Number: 24-9890-889"
V-11 Three-Way Solenoid Air Valve Catalog Page,/viewer/document/VeqaLYlLw~WCgTZsMqHVHQ,"Product code: V11HGA-100, V11PNA-105, V11HCA-100, V-11, V11HFA-100, V11HAA-100, V11HAA-115, Y99AA-4C, V11HBA-100, V11HDA-100,Business: Building Automation and Controls,Brand: Johnson Controls,Category: Other Valves and Actuators,Product: V-11,Document Type: Catalog Page,Document Number: LIT-1921510"
V11 Series Three-Way Solenoid Air Valve Product Bulletin,/viewer/document/SlWJifMZNy3Q1WDnPDmxnQ,"Product code: V11HGA-100, V11PNA-105, V11HCA-100, V11HFA-100, V11HAA-100, V11HAA-115, V11HBA-100, V11HDA-100,Business: Building Automation and Controls,Brand: Johnson Controls,Category: Other Valves and Actuators,Product: V11 Series,Document Type: Product Bulletin,Document Number: LIT-7171550P"
Serial Door Control Module 350 Permanent Sounder Quick Guide,/viewer/document/Xik6wHpv3eDlR0kIbMGDVA,"Business: Access Control,Brand: CEM Systems,Category: Hardware,Product: sDCM350,Document Revision: 1,Document Type: User Guide,Part Number: DCM300-QG-0053-1"
Graphic Generation Tool Help,/viewer/document/bG0GBVLwrFHGmXNmOQcZQQ,"Product code: MS-GGT-6, MS-GGT-0,Business: Building Automation and Controls,Brand: Metasys,Category: Software Application,Product: Graphic Generation Tool,Version: 1.3,Document Type: User Guide,Document Number: LIT-12011697"
Graphics+ Style Guide Online Help,/viewer/document/iTLEBuVRmFYgzAuQY5LEXw,"Product code: MS-GGT-6, MS-GGT-0,Business: Building Automation and Controls,Brand: Metasys,Category: Software Application,Product: Graphics+,Version: 1.3,Document Type: User Guide,Document Number: LIT-12011705"
Graphics+Runtime Help,/viewer/document/JJA31LydnQM6r~k5cKyzRA,"Product code: MS-GGT-0, MS-GGT-6,Business: Building Automation and Controls,Brand: Metasys,Category: Software Application,Product: Graphics+,Version: 1.3,Document Type: User Guide,Document Number: LIT-12011708"
Start-Up and Service Data Setup Guide,/viewer/document/x8LQ~~wkZly5FI6t5fPacA,"Business: Building Automation and Controls,Brand: Metasys,Category: Gateway/Router,Product: MAP Gateway,Document Type: Quick Start Guide,Document Number: LIT-12011916"
Unit Control Board (UCB) Protocol Implementation Conformance Statement,/viewer/document/F9_nGBcq2rXck0oyorBD~g,"Product code: SE-SPU1011-1, SE-SPU1011-0, SE-SPU1012-0,Business: Building Automation and Controls,Brand: Johnson Controls,Category: Smart Equipment,Product: Unit Control Board,Document Type: Technical Bulletin,Document Number: LIT-12011996"
EM-1000/-2000/-3000/-4000 Series Multifunction Power and Energy Meters Catalog Page,/viewer/document/DwApNk9DJNR9IdyqnJ8QRA,"Product code: EM-3850-01-WG00, EM-1460-00-DC00, EM-2750-01-A000, EM-2750-05-A000, EM-4460-05-DI00, EM-3850-01-WE00, EM-2750-01-D000, EM-4450-05-DI00, EM-2750-05-D000, EM-2760-05-A000, EM-3850-01-WF00, EM-1460-00-AC00, EM-4460-05-AI00, EM-3850-05-WF00, EM-2750-11-D000, EM-2760-15-D000, EM-3860-01-WF00, EM-3850-05-WE00, EM-1460-00-DB00, EM-3860-05-WG00, EM-1460-00-AB00, EM-2760-11-A000, EM-3860-01-WE00, EM-3860-05-WE00, EM-2750-11-A000, EM-2750-15-A000, EM-2760-11-D000, EM-3850-05-WG00, EM-3860-01-WG00, EM-2750-15-D000, EM-3860-05-WF00, EM-2760-05-D000, EM-24A2, EM-2760-01-A000, EM-1460-00-AD00, EM-2760-01-D000, EM-1460-00-DD00, EM-2760-15-A000, EM-4450-05-AI00,Business: Building Automation and Controls,Brand: Johnson Controls,Category: Electrical Energy Meter,Product: EM-1000 Series Meter, EM-2000 Series Meter, EM-3000 Series Meter, EM-4000 Series Meter,Document Type: Catalog Page,Document Number: LIT-1900845"
"SafeLINC Fire Panel Internet Interface for Model Series 4100ES, 4010ES, and 4100U",/viewer/document/yxG7CeqnWupO7qYyGSUpQw,"Brand: Simplex,Category: Accessories,Product: SafeLINC Fire Panel Internet Interface,Document Revision: 1,Document Type: Datasheet,Document Number: S4100-0062"
S-Series Enterprise Network Recorder Storage Expansion and Archival,/viewer/document/1ySv_N5GB4Gll~Ma2lZqrw,"Brand: Exacq,Category: Network Video Storage,Product: S-Series,Series: S-Series,Document Type: Guide Specification"
S-Series Professional Network Recorder Storage Expansion and Archival,/viewer/document/GhlffuRuJk_3FkKFScm8BQ,"Brand: Exacq,Category: Network Video Storage,Product: S-Series,Series: S-Series,Document Type: Guide Specification"
YST Design Level F Steam Turbine (Units Manufactured Before Dec 2006),/viewer/document/KizHTTIagLbRbff1S~aCvQ,"Business: Chillers,Brand: YORK,Category: Centrifugal,Product: YST,Document Revision: 814,Document Type: Installation Guide,Document Number: 160.67-N1"
A419 Series Electronic Temperature Controls with Display and NEMA 1 or NEMA 4X Watertight Enclosures Technical Bulletin,/viewer/document/oArbWCJ9f~1x6hgKaAK0EA,"Product code: A99BB, A419,Business: Building Automation and Controls,Brand: PENN Controls,Category: Electromechanical Temperature Control,Product: A419 Temperature Control with NEMA 1 Enclosure and A99 Temperature Sensor,Series: A419 Series, A99 Series,Document Type: Product Bulletin, Technical Bulletin,Document Number: LIT-125188"
A419 Series Electronic Temperature Controls with NEMA 1 or NEMA 4X Watertight Enclosures Product Bulletin,/viewer/document/YQ25~5qYbp6Ca5rzR82z1w,"Product code: A419AEC, A99BB, BKT287, A419GBF, A419ABC, A99BA, A419GEF,Business: Building Automation and Controls,Brand: PENN Controls,Category: Electromechanical Temperature Control,Product: A419 Control and Sensor,Series: A419 Series,Document Type: Product Bulletin,Document Number: LIT-1927385"
MS-BACEOL-0 RS485 End-of-Line Terminator Installation Instructions,/viewer/document/_A0RDdxfGa7TNOsRg4XFCg,"Product code: MS-BACEOL-0,Business: Building Automation and Controls,Brand: Metasys,Category: Accessory,Product: RS485 EOL Terminator,Document Type: Installation Guide,Part Number: 24-10264-4"
exacqVision-EntraPass Integration Guide,/viewer/document/NubfH6zT34UncwizDTDJFw,"Brand: Exacq,Category: VMS Software,Document Type: Integration Guide"
VF7000 Butterfly Valve PN25 Product Bulletin,/viewer/document/JOZCQfgMPR6x4_nbvQThuA,"Business: Building Automation and Controls APAC,Brand: Johnson Controls,Category: Butterfly Valve and Actuator,Product: VF7000,Document Type: Product Bulletin"
EM-1000 Series Meter Quickstart Guide,/viewer/document/l1DKDsOYrV47A7pSIlmLIA,"Product code: EM-1460-00-AC00, EM-1460-00-AD00, EM-1460-00-DD00, EM-1460-00-DC00, EM-1460-00-DB00, EM-1460-00-AB00,Business: Building Automation and Controls,Brand: Johnson Controls,Category: Electrical Energy Meter,Product: EM-1000 Series Meter,Document Type: Quick Start Guide,Document Number: LIT-12011868"
EM-2000 Series Meter Quickstart Guide,/viewer/document/zTKUBCWoLinSD2l5jOT2cA,"Product code: EM-2760-05-A000, EM-2750-15-D000, EM-2760-01-D000, EM-2760-11-A000, EM-2760-01-A000, EM-2750-15-A000, EM-2750-05-A000, EM-2750-01-A000, EM-2760-11-D000, EM-2760-15-D000, EM-2750-11-A000, EM-2760-05-D000, EM-2760-15-A000, EM-24A2, EM-2750-05-D000, EM-2750-01-D000,Business: Building Automation and Controls,Brand: Johnson Controls,Category: Electrical Energy Meter,Product: EM-2000 Series Meter,Document Type: Quick Start Guide,Document Number: LIT-12011869"
EM-3000 Series Meter Installation and Operation Manual,/viewer/document/dTJsHRPaC_C47dUlLkFW5g,"Product code: EM-3850-01-WF00, EM-3860-01-WE00, EM-3860-05-WE00, EM-3860-05-WF00, EM-3850-05-WF00, EM-3860-01-WF00, EM-3850-05-WE00, EM-3850-01-WG00, EM-3850-05-WG00, EM-3850-01-WE00, EM-3860-01-WG00, EM-3860-05-WG00,Business: Building Automation and Controls,Brand: Johnson Controls,Category: Electrical Energy Meter,Product: EM-3000 Series Meter,Document Type: Installation Guide,Document Number: LIT-12011874"
EM-3000 Series Meter Quickstart Guide,/viewer/document/ze4898MbO9Z3NYiHVa0bFQ,"Product code: EM-3850-01-WF00, EM-3860-01-WE00, EM-3860-05-WE00, EM-3860-05-WF00, EM-3850-05-WF00, EM-2750-11-D000, EM-3860-01-WF00, EM-3850-05-WE00, EM-3850-01-WG00, EM-3850-05-WG00, EM-3850-01-WE00, EM-3860-01-WG00, EM-3860-05-WG00,Business: Building Automation and Controls,Brand: Johnson Controls,Category: Electrical Energy Meter,Product: EM-3000 Series Meter,Document Type: Quick Start Guide,Document Number: LIT-12011870"
M9109 Series Electric Non-Spring Return Actuators Product Bulletin,/viewer/document/Ur0iw95ifp2T7i5Zc0g0xg,"Product code: M9109-GGC-5, M9109, M9109-GGA-5, M9109-AGC-2, M9109-GGA-4, M9109-GGC-2, M9109-AGA-4, M9109-AGC-4, M9109-GGC-4, M9109-GGA-2, M9109-AGA-2,Business: Building Automation and Controls,Brand: Johnson Controls,Category: Electric Actuator,Product: M9109,Document Type: Product Bulletin,Document Number: LIT-120112"
Multi-Candela Visible Only (V/O) Amber Lens Ceiling Mount Strobes for Emergency Communications,/viewer/document/AU8zfpvPtt96mOkrZqhUNw,"Brand: Simplex,Category: Notification Appliances and Speakers,Product: Visible Only Notification Appliances and Speakers,Document Revision: 7,Document Type: Datasheet,Document Number: S4906-0007"
T-4000 Series Room Thermostat Adjusting Guide Technical Bulletin,/viewer/document/vNKyzmW1qt4MC0SzCHJu7g,"Product code: T-4002-9014, T-4002-3001, T-4002-5009, T-4002-202, T-4756-6141, T-4600-3, T-4002-125, T-4002-122, T-4002-203, T-4756-6739, T-4756-9738, T-4002-617, T-4756-9003, T-4756-205, T-4600-1, T-4756-201, T-4756-1738, T-4002-2127, T-4002-3004, T-4756-6738, T-4002-5012, T-4002-201, T-4002-6045, T-4002-2133, T-4002-624, T-4002-9009, T-4600-2, T-4756-9007, T-4002-100, T-4002-2137, T-4756-202, T-4002-600, T-4756-206, T-4002-2126, T-4600-5, T-4002-5017, T-4756-6145, T-4002-2130, T-4002-3000, T-4002-5010, T-4002-5018, T-4002-204, T-4002-6049, T-4002-2124, T-4002-9008, T-4600-6, T-4002-2123, T-4756-9012, T-4002-124, T-4002-6038, T-4756-1739, T-4002-123, T-4002-2132, T-4002-5003, T-4002-625, T-4002-9012, T-4756-2145, T-4756-2141,Business: Building Automation and Controls,Brand: Johnson Controls,Category: Pneumatic Thermostat, Room Thermostat,Product: T-4000 Pneumatic Room Thermostat,Document Type: Technical Bulletin,Document Number: LIT-7171089X"
A-4000-158 Condensate Filter Kit for Johnson Controls A-4300 and A-4400 Series Refrigerated Air Dryers (With Date Codes Before 9924) Packing Slip,/viewer/document/3MyVmJGl6QanSNUITu51sQ,"Product code: A-4000-158, A-4000-156,Business: Building Automation and Controls,Brand: Johnson Controls,Category: Accessories,Product: A-4000-158, A-4300, A-4400,Document Revision: A,Document Type: Installation Guide,Part Number: 64-387-5"
EM Series Communicator Software Catalog Page,/viewer/document/~xM79hOous~2jDeNZs66zw,"Product code: EM-COMM-M, EM-COMM-S,Business: Building Automation and Controls,Brand: Johnson Controls,Category: Electrical Energy Meter,Product: EM Series Communicator Software,Document Type: Catalog Page,Document Number: LIT-1900893"
EM Series Communicator Software Users Manual,/viewer/document/MWxAFFrWDVnd1928lIVlwg,"Product code: EM-COMM-M, EM-COMM-S,Business: Building Automation and Controls,Brand: Johnson Controls,Category: Electrical Energy Meter,Product: EM Series Communicator Software,Document Type: User Guide,Document Number: LIT-12011948"
EM-4000 Meter Quickstart Guide,/viewer/document/UVb82yywNNtMssxTLwtceA,"Business: Building Automation and Controls,Brand: Johnson Controls,Category: Electrical Energy Meter,Product: EM-4000 Series Meter,Document Type: Quick Start Guide,Document Number: LIT-12011947"
CDVI Centaur-exacqVision Integration Guide,/viewer/document/nWk7Ahb3qrT8tHr0RPJkvw,"Brand: Exacq,Category: VMS Software,Document Type: Integration Guide"
LN Free Programmable PRG 600 Series Controllers Installation Instructions,/viewer/document/x4WcXiwt9g_cFabtayPZtw,"Product code: LN-PRG610-2, LN-PRG600-2,Business: Building Automation and Controls,Brand: Johnson Controls,Category: Field Device,Product: LN Controller,Document Type: Installation Guide,Document Number: LIT-12011691"
T-5312 Series Pneumatic Receiver-Controllers Catalog Page,/viewer/document/dBWt~6pgCxF0P5hDIli2aA,"Product code: T-5312-8001, T-5312-102, T-5312-3, T-5312-104, T-5312-1G, T-5312-107, T-5312-106, T-5312-101, T-5312-105, T-5312-1, T-5312-103,Business: Building Automation and Controls,Brand: Johnson Controls,Category: Accessory,Product: T-5312,Document Type: Catalog Page,Document Number: LIT-1921455"
YCAS Style G Chiller Maintenance Requirements / Chiller Log Sheet,/viewer/document/gWApxuxVP_boGzYmjnHWcg,"Business: Chillers,Brand: YORK,Category: Screw Air Cooled,Product: YCAS,Document Revision: 714,Document Type: Installation Guide,Document Number: 201.19-MR1"
YCAV Style A Maintenance Requirements / Chiller Log Sheet,/viewer/document/kMCaofYwmR4_LvE1xqvWxw,"Business: Chillers,Brand: YORK,Category: Screw Air Cooled,Product: YCAV,Document Revision: 714,Document Type: Installation Guide,Document Number: 201.21-MR1"
YCIV Style A Maintenance Requirements / Chiller Log Sheet,/viewer/document/VeZbbY~qxs7NPu_V1Pn0Iw,"Business: Chillers,Brand: YORK,Category: Screw Air Cooled,Product: YCIV,Document Revision: 714,Document Type: Installation Guide,Document Number: 201.23-MR1"
System 350P352 Electronic Pressure Control,/viewer/document/_jeheZq216tCbyE71etEFw,"Product code: BKT287-2R, BKT287-1R, S352AA-2C, P352, Y350R-1C,Business: Building Automation and Controls,Brand: PENN Controls,Category: System 350 Single-Purpose Modular Control System,Product: P352P Pressure Control with Analog Output,Series: System 350 Series,Document Revision: B,Document Type: Product Bulletin, Technical Bulletin,Part Number: 24-7664-52,Document Number: LIT-930040"
System 350 R353/S353 Modular Electronic Sequencer,/viewer/document/jg5YBkuW9oRd~tLjiXBbYg,"Product code: S353AA-1C, R353AA-1C, S353, R353,Business: Building Automation and Controls,Brand: PENN Controls,Category: System 350 Single-Purpose Modular Control System,Series: System 350 Series,Document Revision: D,Document Type: Product Bulletin, Technical Bulletin,Part Number: 24-7664-109,Document Number: LIT-930050"
S610f Validation Reader Quick Guide,/viewer/document/gk93uBwCS2VrJDjI2rsNeg,"Business: Access Control,Brand: CEM Systems,Category: Hardware,Product: S610f,Document Revision: 2,Document Type: User Guide,Part Number: S610-QG-0014-2"
T8690 Digital Thermostat with Humidity Control Multi Stage 4+2 High Resolution Touch Screen Owner's Manual and Installation Guide,/viewer/document/Fj0mtulGX_XuJteMEytSHg,"Product code: T8690,Business: Building Automation and Controls,Brand: Johnson Controls,Category: Digital Thermostat,Product: T8690 Commercial Digital Thermostat,Document Type: Installation Guide, User Guide,Document Number: LIT-12011969"
T8590 Digital Thermostat with Humidity Control Multi Stage 4+2 High Resolution Touch Screen Owner's Manual and Installation Guide,/viewer/document/qQtFtDx7GYNzoqMv8CnuAg,"Product code: T8590,Business: Building Automation and Controls,Brand: Johnson Controls,Category: Digital Thermostat,Product: T8590 Residential Digital Thermostat,Document Type: Installation Guide, User Guide,Document Number: LIT-12011967"
T8680 Digital Thermostat Multi Stage 4+2 High Resolution Touch Screen Owner's Manual and Installation Guide,/viewer/document/lOsxvpLoRz_4r~Cb20_PZA,"Product code: T8680,Business: Building Automation and Controls,Brand: Johnson Controls,Category: Digital Thermostat,Product: T8680 Commercial Digital Thermostat,Document Type: Installation Guide, User Guide,Document Number: LIT-12011968"
T8580 Digital Thermostat Multi Stage 4+2 High Resolution Touch Screen Owner's Manual and Installation Guide,/viewer/document/7HrI~jUUy~n6GRWtynwwXw,"Product code: T8580,Business: Building Automation and Controls,Brand: Johnson Controls,Category: Digital Thermostat,Product: T8580 Residential Digital Thermostat,Document Type: Installation Guide, User Guide,Document Number: LIT-12011966"
"DV-5 Deluge Valve, Diaphragm Style, 1-1/2 thru 8 Inch (DN40 thru DN200), Deluge System - Dry Pilot Actuation",/viewer/document/It6sNEjx2hrPNhTPz3fKcg,"Business: Tyco Fire,Brand: Tyco,Category: 1-1/2 thru 8 Inch (DN40 thru DN200), Deluge System Valves and Accessories, Deluge Valve, Diaphragm Style, Dry Pilot Actuation Deluge System,Product: DV-5,Document Type: Datasheet,Document Number: TFP1315"
"DV-5 Deluge Valve, Diaphragm Style, 1-1/2 thru 8 Inch (DN40 thru DN200), Deluge System - Wet Pilot Actuation",/viewer/document/wTz_R9II2aaBVzeDoIsDZA,"Business: Tyco Fire,Brand: Tyco,Category: 1-1/2 thru 8 Inch (DN40 thru DN200), Deluge System Valves and Accessories, Deluge Valve, Diaphragm Style, Wet Pilot Actuation Deluge System,Product: DV-5,Document Type: Datasheet,Document Number: TFP1310"
Preaction System with DV-5 Deluge Valve Double Interlock - Electric/Pneumatic Actuation1-1/2 thru 8 Inch (DN40 and DN200),/viewer/document/LGxew~w187wV9wcT6WOXlw,"Business: Tyco Fire,Brand: Tyco,Category: 1-1/2 thru 8 Inch (DN40 and DN200), Double Interlock, DV-5 Deluge Valve, Electric/Pneumatic Actuation, Preaction System, Preaction Systems,Document Type: Datasheet,Document Number: TFP1460"
"Preaction System with DV-5 Deluge Valve Single Interlock, Supervised - Dry Pilot Actuation1-1/2 thru 8 Inch (DN40 thru DN200)",/viewer/document/1GxvzIxN_r9TNJ4QVosLiQ,"Business: Tyco Fire,Brand: Tyco,Category: 1-1/2 thru 8 Inch (DN40 thru DN200), Dry Pilot Actuation, DV-5 Deluge Valve Single Interlock, Preaction System, Preaction Systems, Supervised,Document Type: Datasheet,Document Number: TFP1415"
"Preaction System with DV-5 Deluge Valve Single Interlock, Supervised - Wet Pilot Actuation 1-1/2 thru 8 Inch (DN40 thru DN200)",/viewer/document/NmK7Qmh1uSakIpcV8SNBgg,"Business: Tyco Fire,Brand: Tyco,Category: 1-1/2 thru 8 Inch (DN40 thru DN200), DV-5 Deluge Valve Single Interlock, Preaction System, Preaction Systems, Supervised, Wet Pilot Actuation,Document Type: Datasheet,Document Number: TFP1410"
VA400 Series Butterfly Valve Actuator Installation Instructions,/viewer/document/uH6tm4SjK42tJYXWFwSyrw,"Business: Building Automation and Controls APAC,Brand: Johnson Controls,Category: Butterfly Valve,Product: VA400,Document Type: Installation Guide,Document Number: 603B-BO1A-NA"
HC-6703-4ND0W Room Humidity Controller Installation Guide,/viewer/document/wD9qPE7bGTMweMFU0Y0JNA,"Product code: HC-6703-4ND0W,Business: Building Automation and Controls,Brand: Johnson Controls,Category: Humidity Sensor,Product: TrueRH HC-67x3 Humidity Controller,Document Revision: A,Document Type: Installation Guide,Part Number: 24-7701-241"
T600HCx-3 Single-Stage Thermostats Installation Guide,/viewer/document/fN_pKoq8tWOGcsUhZz1f9g,"Product code: T600HCN-3, T600HCP-3,Business: Building Automation and Controls,Brand: Johnson Controls,Category: Non-Programmable Thermostat, Programmable Thermostat,Product: T600HCx-3 Thermostat,Document Type: Installation Guide,Part Number: 24-9890-560"
T600HPx-3 Heat Pump Thermostats Installation Guide,/viewer/document/b~d0cIizPswoFAQ6pie05g,"Product code: T600HPP-3, T600HPN-3,Business: Building Automation and Controls,Brand: Johnson Controls,Category: Non-Programmable Thermostat, Programmable Thermostat,Product: T600HPx-3 Thermostat,Document Type: Installation Guide,Part Number: 24-9890-595"
T600MEP-1 Programmable Economizer Thermostat Installation Guide,/viewer/document/P3kwV8TWClDKIKFRxsuVDA,"Product code: T600MEP-1,Business: Building Automation and Controls,Brand: Johnson Controls,Category: Programmable Thermostat,Product: T600MEP-1 Programmable Economizer Thermostat,Document Type: Installation Guide,Part Number: 24-9889-61"
T600MEP-3 Multi-Stage Economizer Thermostat Installation Guide,/viewer/document/G0yuKBhCfbsrHQBZx0zEJw,"Product code: T600MEP-3,Business: Building Automation and Controls,Brand: Johnson Controls,Category: Programmable Thermostat,Product: T600MEP-3 Thermostat,Document Type: Installation Guide,Part Number: 24-9890-609"
