title,link,metadata
Non-Coded Manual Stations Wire Guard 2099-9800,/viewer/document/oMgeCuc1SiizDPveFV28BA,"Brand: Simplex,Category: Sensors and Initiating Devices,Product: Manual Station,Document Revision: 6,Document Type: Datasheet,Document Number: S2099-0004"
"Non-Coded, Non-Addressable Manual Stations; 2099 Series Single and Double Action Operation",/viewer/document/trDKTTg4Dzes9WuiRM1lrw,"Brand: Simplex,Category: Sensors and Initiating Devices,Product: Manual Station,Document Revision: 18,Document Type: Datasheet,Document Number: S2099-0007"
YVAA Style A Screw Chiller Air-Cooled Maintenance / Log Sheet,/viewer/document/tGvSesqX~~fZl_7CJBNU0g,"Business: Chillers,Brand: YORK,Category: Screw Air Cooled,Product: YVAA,Document Revision: 1214,Document Type: Installation Guide,Document Number: 201.28-MR1"
"IDNet Addressable Devices, Model 4090-9007 Signal IAM (Individual Addressable Module)",/viewer/document/8Q0Tx64siF8RtiWc7j9f_g,"Brand: Simplex,Category: Sensors and Initiating Devices,Product: IDNet IAM,Document Revision: 8,Document Type: Datasheet,Document Number: S4090-0010"
At a Glance What’s New at Release,/viewer/document/ZA6v7CbfAppyIRfSDHJCJg,"Business: Building Automation and Controls,Brand: Metasys,Category: General System Information,Product: Metasys System,Version: 6.5.25 (other choices available),Document Type: Release Note,Document Number: LIT-12012000 (other choices available)"
ZFR1800 Series Wireless Field Bus System Product Bulletin,/viewer/document/xpwoMevRjjPt3GLtkTrLFw,"Product code: MS-ZFRCBL-0, MS-ZFR1810-1, MS-ZFRRPTK-H1, MS-ZFRRPT-0, MS-ZFR1811-0, MS-ZFR1811-1, MS-ZFRRPTK-H2, MS-ZFRZCT-0, MS-ZFR1810-0, MS-ZFR1812-0,Business: Building Automation and Controls,Brand: Metasys,Category: Wireless Device,Product: ZFR1800 Series Wireless Field Bus System,Version: 10.1,Document Type: Product Bulletin,Document Number: LIT-12011336"
ZFR1800 Series Wireless Field Bus System Technical Bulletin,/viewer/document/f826k7XxTGv8YuHHGtpPTg,"Product code: MS-ZFRCBL-0, MS-ZFRRPTK-H2, MS-ZFR1811-0, MS-ZFRRPT-0, MS-ZFR1810-0, MS-ZFR1810-1, MS-ZFR1811-1, MS-ZFR1812-0, MS-ZFRZCT-0, MS-ZFRRPTK-H1,Business: Building Automation and Controls,Brand: Metasys,Category: Software Application,Product: ZFR1800 Series Wireless Field Bus System,Version: 10.1,Document Type: Technical Bulletin,Document Number: LIT-12011295"
All Models with Optiview - Optiview Panel LED Display,/viewer/document/frQww9iBbDAzY9aZa1beiA,"Business: Chillers,Brand: YORK,Category: Centrifugal, Screw Water Cooled,Product: OM, YD, YIA, YK, YKEP, YMC2, YR, YS, YT,Document Revision: 1214,Document Type: Service Information Letter,Document Number: SI0296"
Graphics+ Catalog Page,/viewer/document/J1YqXLg_4JkfSxPMB_LWCQ,"Product code: MS-GGT-0, MS-GGT-6,Business: Building Automation and Controls,Brand: Metasys,Category: Software Application,Product: Graphics+,Version: 1.3,Document Type: Catalog Page,Document Number: LIT-1900689"
Graphics+ Product Bulletin,/viewer/document/m~y2AeEQd4ijYGLS5Cdc8Q,"Product code: MS-GGT-0, MS-GGT-6,Business: Building Automation and Controls,Brand: Metasys,Category: Software Application,Product: Graphics+,Version: 1.3,Document Type: Product Bulletin,Document Number: LIT-12011698"
M9000-619-C Valve Linkage Kit (for VG12W5XX Ball Valves) Installation Instructions,/viewer/document/EGFp_ELqB8RupNWE~VSQpA,"Business: Building Automation and Controls APAC,Brand: Johnson Controls,Category: Flanged Globe or Ball Valve and Actuator,Product: M9000-618-C,Document Type: Installation Guide,Document Number: 602M-BO1A-NA"
Circuit Protection; Model 2081-9027 Isolated Loop Circuit Protector (ILCP),/viewer/document/R4eCN2W4cDbNYtwXKXOyPQ,"Brand: Simplex,Category: Accessories,Product: Isolated Circuit Protector,Document Revision: 8,Document Type: Datasheet,Document Number: S2081-0007"
Circuit Protection; Model 2081-9044 Overvoltage Protector,/viewer/document/PejoEIcARuvx_m1kMQ3YSA,"Brand: Simplex,Category: Accessories,Product: Overvoltage Protector,Document Revision: 4,Document Type: Datasheet,Document Number: S2081-0016"
Preaction System with DV-5 Deluge Valve Double Interlock - Electric/Electric Actuation,/viewer/document/754tAX2CV6WijiIKfpXuGg,"Business: Tyco Fire,Brand: Tyco,Category: Double Interlock, DV-5 Deluge Valve, Electric/Electric Actuation, Preaction System, Preaction Systems,Document Type: Datasheet,Document Number: TFP1465"
Network Control Engine Product Bulletin,/viewer/document/stxBW~xlWE2ieAcKyQLMfw,"Product code: MS-NCE25SW-6, MS-NCE25SW-SCS,Business: Building Automation and Controls,Brand: Metasys,Category: Supervisory Device,Product: Network Control Engine,Document Type: Product Bulletin,Document Number: LIT-12011283"
4090-9117 Addressable Power Isolator with IDNet Communications Control,/viewer/document/dqn34tff8lvHmYYMWkonNQ,"Brand: Simplex,Category: Sensors and Initiating Devices,Product: IDNet Power Isolator,Document Revision: 7,Document Type: Datasheet,Document Number: S4090-0006"
4090-9119 Relay IAM (Individual Addressable Module) with Unsupervised Input,/viewer/document/YDKyfhjAWucE5gEvdqEEXA,"Brand: Simplex,Category: Sensors and Initiating Devices,Product: IAM,Document Revision: 6,Document Type: Datasheet,Document Number: S4090-0008"
4090-9120 Six Point Module with Four T-Sense Inputs and Two Relay Outputs,/viewer/document/fw5oxbNwww9q9FeRhWvCLA,"Brand: Simplex,Category: Sensors and Initiating Devices,Product: 6 Point Module,Document Revision: 6,Document Type: Datasheet,Document Number: S4090-0009"
"4901-9820 Electronic Horn, Free-Run or SmartSync Operation, Non-Addressable",/viewer/document/lRWP72h33S7U0WjUCx7qAA,"Brand: Simplex,Category: Notification Appliances and Speakers,Product: Electronic Horn,Document Revision: 9,Document Type: Datasheet,Document Number: S4901-0010"
"Audible/Visible Appliances, Electronic Horn with Strobe Selectable as Free-Run or Synchronized",/viewer/document/cpB6M22GpVxCwCRauavofw,"Brand: Simplex,Category: Notification Appliances and Speakers,Product: Audible/Visible Appliances, Electronic Horn with Strobe Selectable as Free-Run or Synchronized,Document Revision: 5,Document Type: Datasheet,Document Number: S4903-0017"
"Ceiling Mount Visible Notification Appliances, Selectable as Free-Run or Synchronized",/viewer/document/iag6UFj4xzAQL4j0jalxrQ,"Brand: Simplex,Category: Notification Appliances and Speakers,Product: Ceiling Mount Visible Notification Appliances,Document Revision: 5,Document Type: Datasheet,Document Number: S4904-0009"
IDNet and MAPNET II Communicating Devices 4-20 mA Analog Monitor Zone Adapter Module (AMZ),/viewer/document/n_btsygpHZf~HZZLuLRpGg,"Brand: Simplex,Category: Sensors and Initiating Devices,Product: Analog Monitor Zone Adapter,Document Revision: 9,Document Type: Datasheet,Document Number: S4190-0007"
IDNet and MAPNET II Communicating Devices Model 4090-9008 Dual Contact Relay IAM,/viewer/document/_AK2JN1wrB3wF5Y1liYRpQ,"Brand: Simplex,Category: Sensors and Initiating Devices,Product: IDNet IAM,Document Revision: 3,Document Type: Datasheet,Document Number: S4090-0014"
IDNet Communicating Devices Model 4090-9002 Relay IAM,/viewer/document/JX7TR2_0hJO4o3SewBfo1Q,"Brand: Simplex,Category: Sensors and Initiating Devices,Product: IDNet IAM,Document Revision: 10,Document Type: Datasheet,Document Number: S4090-0002"
"IDNet Communicating Devices Model 4090-9010, 8 A Relay IAM",/viewer/document/k3DxWwO_in885hu0FQNimA,"Brand: Simplex,Category: Sensors and Initiating Devices,Product: IDNet IAM,Document Revision: 1,Document Type: Datasheet,Document Number: S4090-0015"
IDNet or MAPNET II Communicating Devices 4090-9101 and 4090-9106,/viewer/document/WwC4w_4naOkjzpOfEL277A,"Brand: Simplex,Category: Sensors and Initiating Devices,Product: IDNet IAM,Document Revision: 4,Document Type: Datasheet,Document Number: S4090-0003"
In-Duct Mounting of the 4098-9714 TrueAlarm Photoelectric Smoke Sensor,/viewer/document/0dkcyDUA6vpYKJBT5Pajmg,"Brand: Simplex,Category: Sensors and Initiating Devices,Product: Duct Detector,Document Revision: 10,Document Type: Datasheet,Document Number: S4098-0021"
LED Text Messaging Appliance with Addressable Message Selection using IDNet Communications,/viewer/document/PMm63qzvL9GdgcYiOBZE~A,"Brand: Simplex,Category: Accessories,Product: LED Text Messaging Appliance with Addressable MEA (NYC) Acceptance* Message Selection,Document Revision: 8,Document Type: Datasheet,Document Number: S4907-0001"
Non-Addressable Audible/Visible Notification Appliances for 4-Wire Operation (Horn/Strobe),/viewer/document/QKixc1GtA4EuPLoUKZB4yw,"Brand: Simplex,Category: Notification Appliances and Speakers,Product: Audible/Visible Notification Appliance,Document Revision: 6,Document Type: Datasheet,Document Number: S4903-0011"
"SmartSync 2-Wire Operation, Non-Addressable Mini-Horns",/viewer/document/ifvnNJdXXrcP7B8akd762w,"Brand: Simplex,Category: Notification Appliances and Speakers,Product: SmartSync 2-Wire Operation, Non-Addressable Mini-Horns,Document Revision: 2,Document Type: Datasheet,Document Number: S4901-0013"
"SmartSync 2-Wire Operation, Non-Addressable Multi-Tone Horns",/viewer/document/S_p4lATVpJLw11W9fIHUrw,"Brand: Simplex,Category: Notification Appliances and Speakers,Product: SmartSync Notification Appliance,Document Revision: 3,Document Type: Datasheet,Document Number: S4901-0014"
"SmartSync Operation Audible/Visible Notification with Chime and Synchronized Flash, Non-Addressable",/viewer/document/gIp_w~3ceqBnCplSOlcwEw,"Brand: Simplex,Category: Notification Appliances and Speakers,Product: SmartSync Notification Appliance,Document Revision: 2,Document Type: Datasheet,Document Number: S4906-0012"
"SmartSync Operation Audible/Visible Notification with FM Approved* Multi-Tone Horn and Synchronized Flash, Non-Addressable",/viewer/document/PFDQqnqUxp8TFCZW8jLywg,"Brand: Simplex,Category: Notification Appliances and Speakers,Product: SmartSync Notification Appliance,Document Revision: 2,Document Type: Datasheet,Document Number: S4906-0013"
"Wall Mount Visible Notification Appliances, Selectable as Free-Run or Synchronized Flash Rate",/viewer/document/QQeSpn5S4k8OY3Fv8_BJyg,"Brand: Simplex,Category: Notification Appliances and Speakers,Product: Wall Mount Visible Notification Appliances,Document Revision: 6,Document Type: Datasheet,Document Number: S4904-0008"
Weatherproof Notification Appliances (non-addressable) Wall Mount Visible Only (V/O) and Audible/Visible (A/V),/viewer/document/z_TimzDAUB5IowDoJT8aBw,"Brand: Simplex,Category: Notification Appliances and Speakers,Product: Weatherproof Notification Appliance,Document Revision: 6,Document Type: Datasheet,Document Number: S4906-0010"
"Fire Alarm Control Relays, Track Mount and Encapsulated; Model 4098-9843 and 2088 Series",/viewer/document/ZOwiUG74OprG5yAbIgFniA,"Brand: Simplex,Category: Accessories,Product: Relay,Document Revision: 10,Document Type: Datasheet,Document Number: S2088-0010"
Addressable Duct Sensor Housings with TrueAlarm Photoelectric Sensor; Available with Multiple Relay Control,/viewer/document/9nV823vah63qrU2BRu~aQg,"Brand: Simplex,Category: Sensors and Initiating Devices,Product: TrueAlarm Photoelectric Addressable Duct Detector,Document Revision: 10,Document Type: Datasheet,Document Number: S4098-0030"
Aftermarket Cover Selection Chart for Non-Addressable and Addressable Appliances*,/viewer/document/Ssh0J4ElzA_EhHSSNTpGmQ,"Brand: Simplex,Category: Notification Appliances and Speakers,Product: Notification Appliance Cover,Document Revision: 7,Document Type: Datasheet,Document Number: S4905-0002"
Duct Detector Housings with TrueAlarm Photoelectric Detector for 2-Wire or 4-Wire Operation,/viewer/document/AbLeSIfKsfr0~6mgXf2McA,"Brand: Simplex,Category: Sensors and Initiating Devices,Product: TrueAlarm Photoelectric Smoke Detector,Document Revision: 9,Document Type: Datasheet,Document Number: S4098-0029"
Duct Detector Housings with TrueAlarm Photoelectric Detector for Stand-Alone Operation,/viewer/document/588Wf3Ky73Jfrqvs0X8pvA,"Brand: Simplex,Category: Sensors and Initiating Devices,Product: TrueAlarm Photoelectric Duct Detector,Document Revision: 6,Document Type: Datasheet,Document Number: S4098-0031"
Ethernet Control Module Quick Guide,/viewer/document/li2~KBdIPylZpEYb8BdmHA,"Business: Access Control,Brand: CEM Systems,Category: Hardware,Product: ECM,Document Revision: 1.1,Document Type: User Guide,Part Number: ECM-QG-0048-1.1"
IDNet or MAPNET II Communicating Devices; Addressable Manual Stations for Releasing Applications,/viewer/document/wOz0uiFnL9Q4GgGV5LI2WQ,"Brand: Simplex,Category: Sensors and Initiating Devices,Product: Manual Station,Document Revision: 1,Document Type: Datasheet,Document Number: S4099-0006"
End User Quick Start Guide,/viewer/document/opAiTPgxaOyr6Diog5QiNw,"Brand: Exacq,Category: VMS Software,Document Type: Quick Start Guide"
AMS-9060 Configurator Help Guide,/viewer/document/tSgR6DfFoHpvWqpj5kSVsw,"Brand: Sensormatic,Category: Detector,Product: AMS-9060 Configurator,Series: Controller,EAS Systems,Document Revision: A,Document Type: Configuration Guide,Document Number: 8200-0057-12"
VLC-600 TrueAlarm LaserCOMPACT Smoke Sensor with IDNet and MAPNET II Communications,/viewer/document/7~S_5L8xWml3U99qUq_Yew,"Brand: Simplex,Category: Sensors and Initiating Devices,Product: VLC-600 TrueAlarm LaserCOMPACT Smoke Sensor,Document Revision: 8,Document Type: Datasheet,Document Number: S4098-0036"
exacqVision Redwall PIE-1 Serial Integration Guide,/viewer/document/tHbHPLu7N~hb8q8NQpdkxg,"Brand: Exacq,Category: VMS Software,Document Type: Integration Guide"
VG12W5XX-C Series Ball Valve Installation Instructions,/viewer/document/SAPFVRsACi7Pnrz3O79XnQ,"Business: Building Automation and Controls APAC,Brand: Johnson Controls,Category: Flanged Globe or Ball Valve and Actuator,Product: VG12W5XX-C,Document Type: Installation Guide,Document Number: 603H-BO1A-NA"
exacqVision Surveillance Keyboard,/viewer/document/iqaqXZlSK1KS6hrasRQ7Hw,"Brand: Exacq,Category: Accessories,Product: exacqVision Surveillance Keyboard,Document Type: Guide Specification"
American Dynamics Mega Power 48 Matrix Switcher Integration Guide,/viewer/document/kZcIzOu_FS_GetFjTIJaPQ,"Brand: Exacq,Category: VMS Software,Document Type: Integration Guide"
OSHPD Seismic Certification Control Panels Product Bulletin,/viewer/document/bqrvYHOJph1~A~wAi91Otg,"Product code: PARC00001FC0, PAPA00001FC0, PAEN00001AH0, PAKA00001FH0, SAGB00001A00, SARA00001F04, PAYAZA011BH0, PAEB00001AH0, PAGA00001AC0, PARB00001BH4, PABL00013GC2, PAEB00001BH0, PAJL00001FH0, SABT00013G02, PAKAJA011BC0, SAGP00001A00, PAJD00001FH0, PAKAJD002BH0, PARE00001FC0, SAJN00001F00, PAKA00001FH4, SAJC00001F00, SAEF00001B00, PAWARE001EH0, PAKE00001AH0, PAKBJDU02BC0, SAKA00001F00, SARE00001F04, SALS00002A00, PALD00002AH0, SAKG00001A00, PASP00004HC0, SAKF00001F00, SAKF00007K00, PALF00001AH0, PAMF00013GC2, PAYAZC002BH0, PAKG00001BH4, PAKAJC002BH0, PAYB00001AH4, PAYA00001FH0, SARF00001F00, PAYAZA001BH0, SAKF00001B04, SAKGJF011B00, PAJB00001FH0, PADA00011EC1, PAYBZC002AH0, SAKD00001F00, PADAXA002BH0, PAKB00U01FC0, PAWARL001BH0, PALG00001AH0, PAUE00001FH0, PAKGJJ002AH0, SANB00001A00, PAWA00000HC0, PABE00013GC2, SARA00001F00, PALG00002AH0, SADA00011B01, SAGA00001A00, SAKGJJ002A00, PAXA00001FH0, PAZB00001FH0, PAUE00001BH0, SAGL00001F00, SAKE00001A00, SAKJ00001F00, SAKJ00001A00, SARE00001F00, PARB00001FC0, PAYB00001BH0, PAYA00011BH0, SAJB00001F00, SAKBJA011B00, PAYAZC002AH0, SAMK00013G00, SARB00001F00, PAKAJC012BC0, PATB00006GC0, PAKG00011EH0, PAKAJA001AH0, PAHB00001AC0, PAYAZD002AH0, PACH00001BH0, PAHD00001AC0, SAKAJA011B00, SADAXA012B01, SADA00011E01, PASD00004HC2, PAYB00011BH0, PAKF00001BH4, PAWA00004HC0, SAEB00011B00, PAKG00002AH0, SAL100002AH0, SAKGJG002A00, SAHB00001A00, PADAXA012BC0, PAKB00001AH4, PAUD00001BH0, PAKB00002AH0, PAKFJF001AH0, PAKG00011BH0, PAYBZC002BH0, PAKE00001BH0, SAMB00013G00, SAGS00001F00, PALH00001AH0, PANK00001BH0, PAKGJG002BH0, PADADA012BC1, SAKBJA001A00, SAKB00001F04, SAKGJN002A00, SAGV00001F00, SABL00013G02, SAKB00001A04, PAYBZB002AH0, PAKB00U01AC0, PAKBJA001AH0, PAL100002AH0, PARB00001FC4, PAGP00001AC0, PAWD00005HC0, PAKB00011EC0, PAKBJC002BH0, PAUA00011EC0, SAKFJG012B00, PAKH00001BH0, PARF00001BH4, PACH00001AH0, PAKGJH002AH0, PANL00001BH0, PAUC00001FH0, PAWAGJ001EH0, PARJ00001FC0, SAKG00001B04, SALP00002A00, PARH00001FC0, SANK00011E00, PALN00002AH0, PASB00004HC0, SAKF00001A00, SADA00011B00, PAEF00011EC0, PAKBJA001BH0, PAKD00001FH0, PAGZ00001AC0, PAYBZD002BH4, SAKAJD002A00, PAUE00011BC0, PAKBJD002BH4, SAJM00001F00, PARC00001FC4, SAG100001AC0, PAKE00001FH0, PAKFJH012BH0, SAKA00011E00, PAGB00001AC0, PAWARE001EH4, SAKB00001F00, PA0P00010FC0, PATB00001BH0, PAKFJF011BH0, PADAXD001AH0, PAYBZB012BH0, SAKA00001F04, PAGK00001FC0, PAKM00001BH4, PATA00001AH0, PAYBZD002BH0, PAKM00011EA0, PAGL00U01AC0, PAHC00001AC0, PAKJ00001AH0, SARC00001F00, SANK00001B00, PATA00005HC0, PAKB00001BH0, PAKF00001FH4, SAL200001AH0, PAKG00001AH4, SAJH00001F00, PAG100001AC0, PALY00002AH0, PARA00001BH4, SAKBJC002B00, SARC00001F04, SAKB00002A00, PAKD00001BH0, SAEB00001A00, PARM00001BH0, PACH00011EC0, PAEU00001BH0, SALD00002A00, SAKFJF001A00, PAGN00001AC0, SALA00001A00, PAWARE001BH4, PAKA00U01FC0, PAKF00001AH0, PAKFJH002BH0, SAKG00002A00, PAL200002AH0, PAGG00U01AC0, SAKGJJ002B00, PAL200001AH0, SAJJ00001F00, SACH00001A00, PAZC00001FH0, PARC00001BH0, PARA00001BH0, SAKFJJ012B00, SAKAJC002A00, SAKG00011E00, SAGE00001F00, PASE00004HC2, PAYD00001FH0, PAGM00001FC0, SAKGJL002B00, PAMP00013GC2, PAKBJB002BH0, PALS00001AH0, SARD00001F04, SAMP00013G00, SALR00001A00, PAKAJB002BH0, PAJN00001FH0, PALZ00002AH0, PATC00006JC0, SAKGJJ012B00, PANB00011EC0, PAGV00001FC0, SAKAJB002B00, PAGU00001FC0, PAYA00001BH4, PAYD00001AH0, PAWC00005HC0, PALD00001AH0, SALJ00001A00, PAKA00001BH0, PATD00006JC0, PANK00011BC0, PASA00004HC0, PAUB00001FH0, SAUA00011B00, PARF00001BH0, PABP00013GC2, SAUA0, SAKFJG002B00, SAKA00011B00, SABH00013G02, PAKGJF001AH0, SALM00001A00, SANB00011E00, PAGJ00U01AC0, PAER00001BH0, PACB00001BH0, PAEB00011BC0, PAKAJC002AH0, SAJD00001F00, SAGJ00001F00, SALN00002A00, PANK00011EC0, PAGL00001FC0, PAGY00001AC0, PAKA00011EC0, PAGN00U01AC0, PAER00001AH0, SALK00001A00, SAKB00001A00, SAKGJM002A00, SAKG00007K00, SAEB00001B00, SAKBJE002B00, PAKGJG012BH0, SAKAJD012B00, PAKFJF001BH0, PAGC00001AC0, PAHA00001AC0, PAYB00001FH4, SAHE00001AC0, PAKA00001BH4, SACH00011E00, PALR00001AH0, PAJF00001FH0, PALW00001AH0, PARG00001BH0, SAKGJL002A00, PAES00001BH0, PASC00004HC0, PAKB00001AH0, PAYB00002AH0, PAJC00001FH0, PAZD00001FH0, PARD00001BH4, PACH00011BC0, PAKGJJ002BH4, SACH00011B00, PAJG00001FH0, PAKBJE002BH0, PAUD00011BC0, PAKGJF011BH0, SAKF00008K00, SAKJ00001B00, PAKJ00001FH0, PAYBZD002AH0, PAYBZD012BH0, PAGW00U01AC0, SAGZ00001AC0, SAL100001AH0, SALG00001A00, SAPA00001F00, PARE00001BH4, PARK00001BH0, SAKB00001B00, PAGJ00001FC0, SAKE00001B00, PASL00004HC2, SAKAJA001A00, SAKGJH002A00, PAKA00001AH0, SAGK00001F00, PAKFJG002AH0, PAUC00011BC0, SADA00002A00, SARD00001F00, PAGE00U01AC0, PADADA002BH0, PAKB00001BH4, PASN00004HC2, SAKE00001F00, SAGX00001AC0, SALH00001A00, PACB00001AH0, PARC00001BH4, SADADA012B00, SARB00001F04, SADA00001B00, PAEF00001BH0, PANL00001AH0, SANK00001A00, PAKF00001FH0, SADADA012B01, PAKA00011BC0, PAET00001BH0, SAKF00011E00, PA1A00004HC0, PALB00001AH0, PAKAJD012BC0, SAGF00001F00, PAPB00001FC0, PADADA012BC0, SAKAJC002B00, SAKBJB012B00, PAKBJC012BC0, PATA00006GC0, PACB00011EC0, PALU00001AH0, PALX00002AH0, PAUA00011BC0, PAKBJB012BC0, SAKG00001F00, PAKG00001BH0, PAKM00011BH0, PALK00001AH0, PAGR00001AC0, PAYD00001BH0, PAKBJBU02AC0, PAKBJD002BH0, PAMK00013GC2, SACB00001B00, PAYBZA001AH0, PAEN00001BH0, SAKGJM002B00, PAYB00001FH0, SAGN00001A00, PANM00001BH0, PAYAZC012BH0, SAKGJG012B00, SAHA00001A00, PADAXA012BC1, PAKJ00001BH0, PAL100001AH0, PAKF00011EH0, PAYA00001FH4, SAGH00001F00, PANK00001AH0, SABP00013G02, PARD00001BH0, SAKG00011B00, SAEF00001A00, PAUC00011EC0, SAKBJB002B00, PANB00001BH0, PASG00004HC0, SAKB00011E00, SAKGJF001B00, PALZ00001AH0, SALC00001A00, PAEP00001BH0, SANK00011B00, PAYC00001BH0, SAKAJD002B00, PAUD00011EC0, PAKGJJ002BH0, PAKB00011BC0, PASK00004HC2, PAKAJB012BC0, PAKBJD002AH0, PA1A00000HC0, SACH00001B00, PASM00004HC2, PAKBJA011BC0, SAKFJG002A00, SAKFJH002A00, PANM00001AH0, SABB00013G02, PAGS00001FC0, PAYBZB002BH0, SAKG00001F04, PAZA00001FH0, PAKF00001BH0, SAFD00001A03, SAKA00001B04, SAKBJA001B00, PAGX00001AC0, PAES00001AH0, PATB00005HC0, PAYB00001BH4, SAKF00011B00, PAGD00001AC0, PARH00001BH0, PAFD00001AC3, SAEB00011E00, SAKAJB002A00, PAWARE001BH0, PABB00013GC2, PAYAZB002AH0, PAYAZB012BH0, PAYB00001AH0, PAYAZB002BH0, PALN00001AH0, SADAXA012B00, SAGM00001F00, PADA00011BC0, SAGG00001F00, SAKFJF011B00, SAKBJD012B00, SAKGJF001A00, PAGF00001FC0, PAKFJJ002AH0, SAGT00001F00, SAKAJA001B00, SABE00013G02, SADADA002B00, SAKF00001B00, SACB00001A00, PARB00001BH0, PASH00004HC0, PAJJ00001FH0, PARF00001FC0, PALM00001AH0, PABH00013GC2, SAKFJJ002B00, SAKFJJ002A00, PAKGJH012BH0, PANB00001AH0, PAUD00001FH0, PAJH00001FH0, PALP00002AH0, PAYBZE002BH0, PACB00011BC0, PAKM00011EH0, PARJ00001BH0, PAWARL001EH0, PAHE00001AC0, SALR00002A00, PADA00011EC0, PADA00001BH0, PAFD00001AC0, SALF00001A00, PARD00001FC0, PABT00013GC2, PADA00002AH0, PAKFJG012BH0, PALX00001AH0, SALD00001A00, PALV00001AH0, PAKH00001FH0, SAFD00001A00, SAJG00001F00, PAET00001AH0, SAKB00011B00, SAKGJG002B00, PAKGJG002AH0, SADA00001A00, SAEF00011E00, PAKB00001FH0, PAUE00011EC0, PAYA00001AH0, PASF00004HC2, SAKGJK002B00, SAEF00011B00, PAWAG1001EH0, PAKFJG002BH0, PAKBJD012BC0, PARK00001FC0, PARL00001BH0, PADA00011BC1, SAKGJH012B00, PALL00001AH0, PAYAZD012BH0, PAKGJH002BH0, PAYBZA011BH0, SAGU00001F00, SAKBJD002A00, PALS00002AH0, PAYAZD002BH0, PAKF00011BH0, PADA00001AH0, PALY00001AH0, PATB00001AH0, SAJL00001F00, SALB00001A00, SAGC00001A00, SAKGJH002B00, SAHD00001AC0, PASJ00004HC0, PAKG00001FH4, SAPB00001F00, SALE00001A00, PAKAJA001BH0, SAJF00001F00, PARE00001BH0, PAUB00001BH0, SAKBJB002A00, PAKAJD002AH0, PAYBZC012BH0, PAJA00001FH0, PAEU00001AH0, PAYAZA001AH0, PALA00001AH0, PALW00002AH0, PARF00001FC4, PAGT00001FC0, SAKG00001B00, PAKB00001FH4, SADAXA002B00, PALC00001AH0, PARD00001FC4, SAGD00001A00, PAKGJF001BH0, SANB00001B00, PAKGJK002BH0, SAJA00001F00, SAKFJH002B00, SAKH00001F00, SAKFJF001B00, PALP00001AH0, PALR00002AH0, PARG00001FC0, PAYA00001BH0, PARL00001FC0, PAYA00011EH0, PAGG00001FC0, PALE00001AH0, SACB00011E00, PALJ00001AH0, SAGY00001AC0, SAL200002AH0, PAWAGE001EH0, SAMF00013G00, SAHC00001A00, PAMB00013GC2, SAKG00008K00, PAYB00011EH0, SALS00001A00, PAKG00001FH0, PAKAJB002AH0, SAKAJC012B00, SALG00002A00, PAEF00011BC0, PAYBZA001BH0, PARM00001FC0, PAUC00001BH0, PAGH00001FC0, SALN00001A00, SAKB00001B04, PAEF00001AH0, PAKGJJ012BH0, PAKFJH002AH0, PAKBJAU02AC0, SAKBJD002B00, PARA00001FC0, PAKG00001AH0, SAKD00001B00, SAKBJC002A00, PAKBJC002AH0, PAEB00011EC0, PAEP00001AH0, PAKFJJ002BH0, SAKFJH012B00, SAKF00001F04, SACB00011B00, SARF00001F04, PAKFJJ012BH0, PARA00001FC4, PAKM00011BA0, SAKG00001A04, PAJM00001FH0, PARE00001FC4, SALL00001A00, PALT00001AH0, SADA00011E00, SADAXD001A00, SAKBJC012B00, PAYC00001FH0, PAKBJB002AH0, PAKBJDU02AC0, PANB00011BC0, SAKH00001B00, PAGE00001FC0, SANB00011B00, SAGR00001A00, PATA00001BH0, SAKA00001A00, SAKAJB012B00, SAKA00001B00, SALP00001A00, SAKGJN002B00,Business: Building Automation and Controls,Brand: Johnson Controls,Category: Control Panel,Product: OSHPD Seismic Certification Control Panel,Document Type: Product Bulletin,Document Number: LIT-12011782"
exacqVision-Micros 8700/9700 VSS Integration,/viewer/document/FdPZvuzCeRIkXqPYN2c3zQ,"Brand: Exacq,Category: VMS Software,Document Type: Integration Guide"
Continuous Diagnostics Advisor Fault Reference,/viewer/document/oghPBqKJ0OuWafDt3raD0Q,"Product code: PX-CDA-AIR-0, PX-CDA-CHL-B-0, PX-CDA-CHL-P-0, PX-ECER-0, PX-LGHDE-0, PX-CDA-CSRQRL-0, PX-MULTB-0, PX-TENANT-0, PX-LGDCEA-0, PX-CER-0, PX-EPM-0, PX-BASE-0, PX-CUSTOM-0,Business: Building Automation and Controls,Brand: Johnson Controls,Category: Software Application,Product: Panoptix Platform,Document Type: Reference Guide,Document Number: LIT-12011904"
Z-Series KSA Declaration of Conformity,/viewer/document/Cm7DFkYOdgYhAvO59x13yA,"Brand: Exacq,Category: Network Video Recorder,Product: Z-Series,Series: Z-Series,Document Type: Declaration of Conformity"
exacqVision Edge/IQeye Quick Start Guide,/viewer/document/wDKVKygImtKimofrntFCUA,"Brand: Exacq,Category: VMS Software,Product: exacqVision Edge,Document Type: Quick Start Guide"
4090-9116 Addressable IDNet Communications Isolator,/viewer/document/1MHtqAy6i07crLbSFbR37g,"Brand: Simplex,Category: Sensors and Initiating Devices,Product: IDNet Communications Isolator,Document Revision: 8,Document Type: Datasheet,Document Number: S4090-0005"
"Single Bay 4100ES Cabinet, Module Mounting Options",/viewer/document/WlmRJNw3HJ5z~gqUZsCFug,"Brand: Simplex,Category: Fire Alarm Control Unit,Product: Single Bay 4100ES Cabinet,Document Revision: 2,Document Type: Datasheet,Document Number: S4100-0052"
MS-TDR Time Delay Relay Module Installation Guide,/viewer/document/BMlIeUOdjbhbqzWl_sLtnQ,"Product code: MS-TDR-1D, MS-TDR-0, MS-TDR-1, MS-TDR-0D,Business: Building Automation and Controls,Brand: Metasys,Category: Field Device,Product: MS-TDR Time Delay Relay Module,Document Type: Installation Guide,Part Number: 24-10143-667"
"DV-5 Deluge Valve, Diaphragm Style, 1-1/2 thru 8 Inch (DN40 thru DN200), Deluge System - Electric Actuation",/viewer/document/oeBKCCwbn3eo_Lhf3u3Mrg,"Business: Tyco Fire,Brand: Tyco,Category: 1-1/2 thru 8 Inch (DN40 thru DN200), Deluge System Valves and Accessories, Deluge Valve, Diaphragm Style, Electric Actuation Deluge System,Product: DV-5,Document Type: Datasheet,Document Number: TFP1320"
INTEVO Advanced Intuitive All-in-One Security Platform Datasheet,/viewer/document/a0~huI3V8QAvUZZgWYhQdw,"Brand: Kantech,Category: Integrated Security Platform,Product: Intevo,Document Revision: R04,Document Type: Datasheet,Document Number: KT0306-DS-201410-R04-LT-EN"
