title,link,metadata
System 350 A350P Electronic Proportional Plus Integral Temperature Control,/viewer/document/q0TSCrzYlczAIZS_YC5PUg,"Product code: A350PS-2C, A350PT, S350C, A350PT-1C, S350A, A350PS-1C, A350, A350PS,Business: Building Automation and Controls,Brand: PENN Controls,Category: System 350 Single-Purpose Modular Control System,Product: A350P Temperature Control with Analog Output,Series: System 350 Series,Document Revision: G,Document Type: Product Bulletin, Technical Bulletin,Part Number: 24-7664-192,Document Number: LIT-930020"
A319 Electronic Temperature Control,/viewer/document/3ukduOFjCOsOt262IjNqzA,"Product code: A319ABC-12-02, A319, A319ABC-12-10, A319ABC-24-01, A319ABC-07-01, A319ABC-24-52, A319ABC-12-01, A319ABC-24-02, A319ABC-24-50,Business: Building Automation and Controls,Brand: PENN Controls,Category: Electronic Temperature Control,Product: A319 Electronic Temperature Control,Document Type: Product Bulletin,Part Number: 24-7664-257,Document Number: LIT-216010"
LN Series Free Programmable LN-PRGxxx-12 Controllers Installation Instructions,/viewer/document/OhRALerJIbbYX2RrWlswZw,"Product code: LN-PRG203-12, LN-PRG610-12, LN-PRG600-12G, LN-PRG410-12, LN-PRG610-12G, LN-PRG6x0-12, LN-PRG410-12G, LN-PRG4x0-12, LN-PRG600-12, LN-PRG400-12, LN-PRG300-12, LN-PRG300-12G, LN-PRG400-12G,Business: Building Automation and Controls,Brand: Johnson Controls,Category: Field Device,Product: LN Controller,Document Type: Installation Guide,Document Number: LIT-12011796"
LN Series Line Powered Fan Coil Unit Controller (PFCU) Installation Instructions,/viewer/document/kjsUx4rJs7n1g9ZeJb2zvQ,"Product code: LN-PFCUA-1, LN-PFCU-1,Business: Building Automation and Controls,Brand: Johnson Controls,Category: Field Device,Product: LN Controller,Document Type: Installation Guide,Document Number: LIT-12011319"
LN Series LN-VSTAT and LN-PSTAT Sensors Installation Instructions,/viewer/document/2r7gMwJGu~okvXza9mWLQQ,"Product code: LN-VSTAT-1, LN-PSTAT-1,Business: Building Automation and Controls,Brand: Johnson Controls,Category: Software Application,Product: LN Controller,Document Type: Installation Guide,Document Number: LIT-12011302"
LN Series Variable Air Volume (VAV) LN-VAVCF-12 Controller Installation Instructions,/viewer/document/rC4jt141GmpuYQQePQGcVA,"Product code: LN-VAVCF-12,Business: Building Automation and Controls,Brand: Johnson Controls,Category: Field Device,Product: LN Controller,Document Type: Installation Guide,Document Number: LIT-12011802"
LN-Display Installation Instructions,/viewer/document/YTxwQBaHUHZ_O7EoTIzLFQ,"Product code: LN-DSWSC1-0, LN-LGTDISF-0, LN-LGTDIS-0, LN-DSWSC2-0,Business: Building Automation and Controls,Brand: Johnson Controls,Category: Field Device,Product: LN Controller,Document Type: Installation Guide,Document Number: LIT-1201904"
LN-Light Panel Installation Instructions,/viewer/document/Mhx4AqePnTtcNRsebvZH4A,"Product code: LN-LIGHT64S-0, LN-LIGHT64-0, LN-LIGHT32-0, LN-LIGHT16-0, LN-LGHTINP-0, LN-LIGHT32S-0, LN-LIGHT64D-0, LN-LIGHT8-0, LN-LIGHT16S-0, LN-LIGHT8D-0, LN-LIGHT8S-0, LN-LIGHT32D-0, LN-LIGHTxx-0, LN-LIGHT16D-0,Business: Building Automation and Controls,Brand: Johnson Controls,Category: Field Device,Product: LN Controller,Document Type: Installation Guide,Document Number: LIT-12011225"
LX Series Input/Output (I/O) Extension Modules Installation Instructions,/viewer/document/tB~H8r2GrBhzheRkKtl00w,"Product code: LX-IOE410-0, LX-IOE420-0, LX-IOE400-0,Business: Building Automation and Controls,Brand: Facility Explorer,Category: Field Device,Product: LX Controller,Document Type: Installation Guide,Document Number: LIT-12011858"
LX Series Variable Air Volume (VAV) LX-VAVCF-11 Controller Installation Instructions,/viewer/document/4CYo4mbvzCvgouKOIeIHSg,"Product code: LX-VAVCF-11,Business: Building Automation and Controls,Brand: Facility Explorer,Category: Field Device,Product: LX Controller,Document Type: Installation Guide,Document Number: LIT-12011857"
A419ABG-3C Electronic Temperature Control,/viewer/document/AjI9cjbJhG5Ob2sqqF9S0A,"Product code: A419ABG-3C,Business: Building Automation and Controls,Brand: PENN Controls,Category: Electronic Temperature Control,Product: A419 Electronic Temperature Control,Document Type: Installation Guide,Part Number: 24-7664-2543"
"MIOA Series Modular Input/Output Assemblies for Refrigeration, HVAC, and Building System Controllers Installation Guide",/viewer/document/DSsCrCRucRwpHx5gd1cTCA,"Product code: MIOA1010, MIOA1100, MIOA1212, MIOA0000, MIOA0303, MIOA0202, MO2, MI1,Business: Building Automation and Controls,Brand: PENN Controls,Category: PENN Refrigeration Component and Part,Product: Modular I/O Assembly,Series: MIOA Series,Document Revision: C,Document Type: Installation Guide,Part Number: 24-7664-2349"
System 350 Y350R Power Module,/viewer/document/9o1DVxPZKBgK4UDRQrSvqw,"Product code: A350E, A350S, Y350, Y350R-1C, A350P, W351A, A350R, A350B, A350A,Business: Building Automation and Controls,Brand: PENN Controls,Category: System 350 Single-Purpose Modular Control System,Product: Y350R Power Module for System 350 Control,Series: System 350 Series,Document Revision: E,Document Type: Product Bulletin, Technical Bulletin,Part Number: 24-7664-214,Document Number: LIT-930090"
Databuoy Integration Guide,/viewer/document/eeUHzRgW3yQifBoRoPuQOw,"Brand: Exacq,Category: VMS Software,Document Type: Integration Guide"
Energy Performance Monitor Technical Bulletin,/viewer/document/N3PqDQEg2yv66~4NbyNCTg,"Product code: PX-EPMT5-0, PX-EPMT4-0, PX-EPMT2-0, PX-EPMT3-0, PX-EPMT1-0, PX-EPM-0, PX-EPMT6-0,Business: Building Automation and Controls,Brand: Johnson Controls,Category: Software Application,Product: Panoptix Platform,Document Type: Technical Bulletin,Document Number: LIT-12011733"
MR3CCUHV Temperature/Defrost Control,/viewer/document/YW6Q5noePzDHPveCGX4KVA,"Product code: MR3CCUHV-12C, MR3CCUHV,Business: Building Automation and Controls,Brand: PENN Controls,Category: Electronic Refrigeration, Defrost, and Multi-Purpose Controller,Product: MR3 Refrigeration and Defrost Controller,Series: MR Series,Document Revision: A,Document Type: Product Bulletin, Technical Bulletin,Part Number: 24-7664-2128,Document Number: LIT-125189"
System 350 Display Modules,/viewer/document/BCa8dvwem2gduk5gavDDaw,"Product code: A350, WHA29A-603R, A350R, D350AA-1C, WHA29A-604R, A350P, D352AA-2C, D351AA-1C, A350E, D352CA-2C, A350B, A350S, A350A, W351A, D352CA-1C, D350BA-1C, WHA29A-600R, D352AA-1C,Business: Building Automation and Controls,Brand: PENN Controls,Category: System 350 Single-Purpose Modular Control System,Product: A350A/B Temperature Control with Relay Output,Series: System 350 Series,Document Revision: J,Document Type: Product Bulletin, Technical Bulletin,Part Number: 24-7664-206,Document Number: LIT-930070"
A350R Electronic Temperature Reset Control (with Relay),/viewer/document/G9YtnSfIaZgTSHbh4wfiyQ,"Product code: A350RS-1C, S350, A350,Business: Building Automation and Controls,Brand: PENN Controls,Category: System 350 Single-Purpose Modular Control System,Product: A350R Reset Temperature Control Module, S350A/B Temperature Stage Module,Series: System 350 Series,Document Type: Product Bulletin,Document Number: LIT-930033"
A350S Electronic Temperature Reset Module (without Relay),/viewer/document/41WOkjflygJbURO7chK3wQ,"Product code: A350SS-2C, A350SS-1C, S350, A350,Business: Building Automation and Controls,Brand: PENN Controls,Category: System 350 Single-Purpose Modular Control System,Product: S350A/B Temperature Stage Module,Series: System 350 Series,Document Type: Product Bulletin,Document Number: LIT-930035"
Facility Explorer NDIO16 Installation Instructions,/viewer/document/odpa5oRYr_IJADYPM_eSQA,"Product code: LP-FXNDIO16-0, LP-FXNDIO16-0G,Business: Building Automation and Controls,Brand: Facility Explorer,Category: Field Device,Product: NDIO16 Input/Output Module,Document Type: Installation Guide,Part Number: 24-10174-50"
Facility Explorer NDIO34 Installation Instructions,/viewer/document/wXOm0K4uiFv4JofTFbq9pw,"Product code: LP-FXNDIO34-0G, LP-FXNDIO34-0,Business: Building Automation and Controls,Brand: Facility Explorer,Category: Field Device,Product: NDIO34 Input/Output Module,Document Type: Installation Guide,Part Number: 24-10174-42"
FX Supervisory Controller Sedona FrameworkÖ Option Card Installation Instructions,/viewer/document/pHHbNNHW5TXjEwIaBzFd~w,"Product code: LP-KITSEDAT-0, LP-FXSEDEXT-0, LP-KITSED3T-0, LP-FXSED-0,Business: Building Automation and Controls,Brand: Facility Explorer,Category: Supervisory Device,Product: FX20 Supervisory Controller, FX30 Supervisory Controller, FX60 and FX60E Supervisory Controller, FX70 Supervisory Controller,Document Type: Installation Guide,Part Number: 24-10564-33"
FX Supervisory Controllers LON Card Installation Instructions,/viewer/document/R6UEsTvjWInExqsb8WBGcQ,"Product code: LP-FXLONFTT-0, LP-FXLONFTT-1,Business: Building Automation and Controls,Brand: Facility Explorer,Category: Supervisory Device,Product: FX20 Supervisory Controller, FX30 Supervisory Controller, FX70 Supervisory Controller,Document Type: Installation Guide,Part Number: 24-10174-34"
FX Supervisory Controllers Modem Card Installation Instructions,/viewer/document/AkLMIk2gFh_qg5GBeQ3Lww,"Product code: LP-FXMDM-0,Business: Building Automation and Controls,Brand: Facility Explorer,Category: Supervisory Device,Product: FX20 Supervisory Controller, FX60 and FX60E Supervisory Controller,Document Type: Installation Guide,Part Number: 24-10174-26"
FX Supervisory Controllers RS-232 Card Installation Instructions,/viewer/document/IdnF8Z8ruWa1Oke9C49aoQ,"Product code: LP-FXRS232-0,Business: Building Automation and Controls,Brand: Facility Explorer,Category: Supervisory Device,Product: FX80 Supervisory Controller,Document Type: Installation Guide,Part Number: 24-10174-85"
FX Supervisory Controllers RS-485 Card Installation Instructions,/viewer/document/FC1kbcqPzR9vGrj2NP_1nw,"Product code: LP-FXRS485-0,Business: Building Automation and Controls,Brand: Facility Explorer,Category: Supervisory Device,Product: FX80 Supervisory Controller,Document Type: Installation Guide,Part Number: 24-10174-69"
FX20/FX60 Supervisory Controllers Installation Instructions,/viewer/document/X~TBbrgmjtJRVEht5KGX4w,"Product code: LP-FXPMEU-0, LP-FX6011N-0G, LP-FX6011N-1, LP-FX20DEM-0, LP-FX20BDEM-1, LP-FXPM263-0, LP-FX60BDEM-1, LP-FXPMUK-0, LP-FXPMUS-0, LP-FX6011N-0, LP-FXPM24-0, LP-FX2021N-1, LP-FX6021N-1, LP-FX2011N-0, LP-FX2011N-1,Business: Building Automation and Controls,Brand: Facility Explorer,Category: Supervisory Device,Product: FX20 Supervisory Controller, FX60 and FX60E Supervisory Controller,Document Type: Installation Guide,Part Number: 24-10174-77"
FX70 - Wi-Fi Card Installation Instructions,/viewer/document/CQS9674CGQwUIwMIoXgFFw,"Product code: LP-FX70WIFI-0,Business: Building Automation and Controls,Brand: Facility Explorer,Category: Supervisory Device,Product: FX70 Supervisory Controller,Document Type: Installation Guide,Part Number: 24-10174-107"
FXRIO16 Remote Input/Output (I/O) Module Installation Instructions,/viewer/document/~svX4__q16ZFd8OxQrapGw,"Product code: LP-FXRIO16-0, LP-KITFXRIO-0,Business: Building Automation and Controls,Brand: Facility Explorer,Category: Field Device,Product: FXRIO16 Remote Input/Output Module,Document Type: Installation Guide,Part Number: 24-10564-41"
Static Ram (SRAM) Option Card Installation Instructions,/viewer/document/2p22WBbAUUX74cLcDz843w,"Product code: LP-FXSRAM-0,Business: Building Automation and Controls,Brand: Facility Explorer,Category: Supervisory Device,Product: FX20 Supervisory Controller, FX30 Supervisory Controller, FX60 and FX60E Supervisory Controller,Document Type: Installation Guide,Part Number: 24-10174-93"
"System 350 S350A Temperature, S351A Humidity, and S352A Pressure Stage Modules",/viewer/document/KsJvBbidxXX4TKop~sR_cA,"Product code: A350E, A350S, S351AA-1C, S352AA-2C, A350P, S350AB-1C, W351A, S350AA-1C, A350R, A350, A350B, A350A,Business: Building Automation and Controls,Brand: PENN Controls,Category: System 350 Single-Purpose Modular Control System,Product: S350A/B Temperature Stage Module, S351AA Humidity Stage Module, S352A/B Temperature Stage Module,Series: System 350 Series,Document Revision: E,Document Type: Product Bulletin, Technical Bulletin,Part Number: 24-7664-1,Document Number: LIT-930080"
System 350 S350C Temperature Subordinate Stage Module,/viewer/document/LwckLyugxHiYYmgMJrGv~A,"Product code: A350E, A350S, A350P, A350R, A350, A350B, A350A, S350CC-1C,Business: Building Automation and Controls,Brand: PENN Controls,Category: System 350 Single-Purpose Modular Control System,Series: System 350 Series,Document Revision: B,Document Type: Product Bulletin, Technical Bulletin,Part Number: 24-7664-1199,Document Number: LIT-930084"
System 350 S350P Proportional Plus Integral Temperature Stage Module,/viewer/document/qag1xUOaBAOBW~X3AEEuhQ,"Product code: A350E, A350S, S350PQ-1C, A350P, A350R, A350, A350B, A350A,Business: Building Automation and Controls,Brand: PENN Controls,Category: System 350 Single-Purpose Modular Control System,Series: System 350 Series,Document Revision: A,Document Type: Product Bulletin, Technical Bulletin,Part Number: 24-7664-1202,Document Number: LIT-930086"
USB I/O Module KSA Declaration of Conformity,/viewer/document/kmB2CaadjOr3xAo7xPISvw,"Brand: Exacq,Category: Accessories,Document Type: Declaration of Conformity"
M9000-53x Series Cast Iron Flanged Valve Linkage Kit for M9000 Series Electric Actuators Product Bulletin,/viewer/document/3TOzcFw1HgiJaLrlJgy4ug,"Product code: M9000-533, M9000-537, M9000-535, M9000-532, M9000-534, M9000-531, M9000-53x, M9000-530, M9000-536,Business: Building Automation and Controls,Brand: Johnson Controls,Category: Electric Actuator,Product: M9000-53x,Document Type: Product Bulletin,Document Number: LIT-1201538"
VH Manual Valve Product Bulletin,/viewer/document/xU8q86bGU8iLNzasO0x7Zg,"Business: Building Automation and Controls APAC,Brand: Johnson Controls,Category: Manual Valve,Product: VHBF,Document Type: Product Bulletin,Document Number: PUBL-7400(0314)"
Enterprise System Manager - Storage Server System Manager,/viewer/document/3lDt4dgS~LYzbld_bI4g~Q,"Brand: Exacq,Category: VMS Software,Product: Enterprise System Manager,Document Type: Guide Specification"
"V.26 YK OptiView Chiller Control Panel, Control Panel",/viewer/document/cgxFY4v9HC5VwC4qhoJB5w,"Business: Chillers,Brand: YORK,Category: Centrifugal,Product: YK,Document Revision: 414,Document Type: Service Information Letter,Document Number: SI0283"
TE730 Series Temperature Sensors Installation Instructions,/viewer/document/OFTTVFSqEQCQYlpc0o5Efw,"Business: Building Automation and Controls APAC,Brand: Johnson Controls,Category: Temperature Sensor,Product: TE730 Sensor,Document Revision: B,Document Type: Installation Guide,Part Number: 24-10674-0"
"YST Design Level F and G Steam Turbine Drive Controls and Instrumentation, Control Panel",/viewer/document/~gla2x~ebYAL~QDnLkLbWg,"Business: Chillers,Brand: YORK,Category: Centrifugal,Product: YST,Document Revision: 314,Document Type: Part List,Document Number: 160.67-RP2"
Panoptix® Platform Catalog Page,/viewer/document/1jjcS8dIMeHOFYsDzPQE_A,"Product code: PX-CDA-CHL-B-0, PX-ECERT2-0, PX-ECERBFT3-0, PX-ECERBFT1-0, PX-EPMT4-0, PX-TENANT-0, PX-LGDCEA-0, PX-CERT2-0, PX-CUSTOMT4-0, PX-CERT5-0, PX-CER-0, PX-CDA-AIRT6-0, PX-CDA-AIRT5-0, PX-CUSTOM-0, PX-ECERBFT6-0, PX-ECERT4-0, PX-CDA-AIR-0, PX-ECER-0, PX-CUSTOMT5-0, PX-EPMT5-0, PX-CDA-CSRQRL-0, PX-EPMT3-0, PX-CUSTOMT3-0, PX-CDA-AIRT2-0, PX-CDA-AIRT4-0, PX-EPM-0, PX-BASET6-0, PX-BASE-0, PX-BASET1-0, PX-BASET2-0, PX-BASET3-0, PX-CDA-AIRT1-0, PX-CDA-CHL-P-0, PX-CERT6-0, PX-ECERT3-0, PX-ECERT6-0, PX-EPMT6-0, PX-LGHDE-0, PX-CERT1-0, PX-ECERBFT5-0, PX-EPMT2-0, PX-BASET5-0, PX-ECERT1-0, PX-CDA-AIRT3-0, PX-CUSTOMT1-0, PX-BASET4-0, PX-ECERBFT2-0, PX-ECERT5-0, PX-CERT3-0, PX-MULTB-0, PX-CUSTOMT2-0, PX-CUSTOMT6-0, PX-ECERBFT4-0, PX-EPMT1-0, PX-CERT4-0,Business: Building Automation and Controls,Brand: Johnson Controls,Category: Software Application,Product: Panoptix Platform,Document Type: Catalog Page,Document Number: LIT-1900752"
Panoptix® Platform Product Bulletin,/viewer/document/C2W73kwSay46b27B9r_S0w,"Product code: PX-CDA-CHL-B-0, PX-ECERT2-0, PX-ECERBFT3-0, PX-ECERBFT1-0, PX-EPMT4-0, PX-TENANT-0, PX-LGDCEA-0, PX-CERT2-0, PX-CUSTOMT4-0, PX-CERT5-0, PX-CER-0, PX-CDA-AIRT6-0, PX-CDA-AIRT5-0, PX-CUSTOM-0, PX-ECERBFT6-0, PX-ECERT4-0, PX-CDA-AIR-0, PX-ECER-0, PX-CUSTOMT5-0, PX-EPMT5-0, PX-CDA-CSRQRL-0, PX-EPMT3-0, PX-CUSTOMT3-0, PX-CDA-AIRT2-0, PX-CDA-AIRT4-0, PX-EPM-0, PX-BASET6-0, PX-BASE-0, PX-BASET1-0, PX-BASET2-0, PX-BASET3-0, PX-CDA-AIRT1-0, PX-CDA-CHL-P-0, PX-CERT6-0, PX-ECERT3-0, PX-ECERT6-0, PX-EPMT6-0, PX-LGHDE-0, PX-CERT1-0, PX-ECERBFT5-0, PX-EPMT2-0, PX-BASET5-0, PX-ECERT1-0, PX-CDA-AIRT3-0, PX-CUSTOMT1-0, PX-BASET4-0, PX-ECERBFT2-0, PX-ECERT5-0, PX-CERT3-0, PX-MULTB-0, PX-CUSTOMT2-0, PX-CUSTOMT6-0, PX-ECERBFT4-0, PX-EPMT1-0, PX-CERT4-0,Business: Building Automation and Controls,Brand: Johnson Controls,Category: Software Application,Product: Panoptix Platform,Document Type: Product Bulletin,Document Number: LIT-12011719"
YLAA Maintenance Requirements and Log Sheet,/viewer/document/l2VYWvhzDRKTAc~IxZmN4w,"Business: Chillers,Brand: YORK,Category: Scroll Air Cooled,Product: YLAA,Document Revision: 314,Document Type: Installation Guide,Document Number: 150.72-MR1"
VG2000 Series Cast Iron Flanged Globe Valves for Assembly in the Field Catalog Page,/viewer/document/AORA2G~EDdSrO8hTywZFuA,"Product code: VG2000,Business: Building Automation and Controls,Brand: Johnson Controls,Category: Flanged Globe or Ball Valve and Actuator,Product: VG2000,Document Type: Catalog Page,Document Number: LIT-1900064"
"Dual Emergency Communication Appliances, Clear/Amber Strobes",/viewer/document/cRd1NMFl1g2Qlgi7ihyE8A,"Brand: Simplex,Category: Notification Appliances and Speakers,Product: Visible Only Notification Appliances and Speakers,Document Revision: 3,Document Type: Datasheet,Document Number: S4906-0009"
AD-1251 Probe with Differential Pressure Transducer Catalog Page,/viewer/document/pZOuUbQOkJWG4SfTcRXXTg,"Product code: ASENN,Business: Building Automation and Controls,Brand: Johnson Controls,Category: Air Measuring System,Product: AD-1251 Probe with Differential Pressure Transducer,Document Type: Catalog Page,Document Number: LIT-1900560"
VHCV Small Size Check Valve Installation Instructions,/viewer/document/0CYaDqQG1P~KbQTANlpSmQ,"Business: Building Automation and Controls APAC,Brand: Johnson Controls,Category: Manual Valve,Product: VHEV,Document Type: Installation Guide,Document Number: 602V-B01A-NA"
"TrueAlert Addressable Power Supplies (TPS), Cabinet Mounted",/viewer/document/19Wy2WIzI5FgY043hYCSCw,"Brand: Simplex,Category: Fire Alarm Control Unit,Product: TrueAlert Addressable Power Supplies (TPS), Cabinet Mounted,Document Revision: 1,Document Type: Datasheet,Document Number: S4100-0065"
VHEV Small Size Exhaust Valve Installation Instructions,/viewer/document/IZoecXuSlaudOrkZExaxtQ,"Business: Building Automation and Controls APAC,Brand: Johnson Controls,Category: Manual Valve,Product: VHGV,Document Type: Installation Guide,Document Number: 602Y-B01A-NA"
YK and YT Customers Annual Report Centrifugal Seasonal Inspection,/viewer/document/s56B5Hs1SetpF5CXU~~z2A,"Business: Chillers,Brand: YORK,Category: Centrifugal,Product: YK, YT,Document Revision: 314,Document Type: Checklist,Document Number: 160.00-XT1"
Hx-68P3 Series Outside Humidity and Temperature Transmitters Catalog Page,/viewer/document/w0FNPPL0eWg3Xc1cAVBi8w,"Product code: Hx-68P3 Series,Business: Building Automation and Controls,Brand: Johnson Controls,Category: Humidity Transmitter, Temperature Transmitter,Product: Hx-68P3 Outdoor Relative Humidity Transmitter,Document Type: Catalog Page,Document Number: LIT-1900867"
Hx-68P3 Series Outside Humidity and Temperature Transmitters Product Bulletin,/viewer/document/oF3gBYv_tW3ZyNPA4t1zhQ,"Product code: HE-68P3-0N000,Business: Building Automation and Controls,Brand: Johnson Controls,Category: Humidity Transmitter, Temperature Transmitter,Product: Hx-68P3 Outdoor Relative Humidity Transmitter,Document Type: Product Bulletin,Document Number: LIT-12011896"
"YLAA, YCUL, YCAL, YCWL, YLUA, YLPA, YCRL Kits and Flash Card Used in the 031-02550-XXX Control P.C.B.'s",/viewer/document/fwSmsZjLeYrR0U0ysXq3Qg,"Business: Chillers,Brand: YORK,Category: Condensing Unit, Scroll Air Cooled, Scroll Water Cooled,Product: YCAL, YCRL, YCUL, YCWL, YLAA, YLPA, YLUA,Document Revision: 314,Document Type: Service Information Letter,Document Number: SI0266"
BCM System Architecture and Configuration Guide,/viewer/document/2IdNYCAGyclbHTUGMmPT7w,"Business: Building Automation and Controls,Brand: BCPro,Category: General System Information,Product: BCPro System,Version: 1,Document Type: User Guide,Document Number: LIT-12011912"
VLC2000 Series Electric Zone Valves Installation Instructions,/viewer/document/2Cva~Di1hTwmzqqcn2TzoA,"Business: Building Automation and Controls APAC,Brand: Johnson Controls,Category: Flanged Globe or Ball Valve and Actuator,Product: VLC2000,Document Type: Installation Guide,Document Number: 602E-BO1A-NA"
General Packet Radio Service (GPRS) Modem Option Technical Bulletin,/viewer/document/8MDUVi7zbEjHNqxXunIYBg,"Product code: LP-FXGPRSU-0, LP-FXGPRS-0, LP-FXGPRSW-0,Business: Building Automation and Controls,Brand: Johnson Controls,Category: Gateway/Router,Product: General Packet Radio Service,Document Type: Technical Bulletin,Document Number: LIT-12011651"
Carbon and Energy Reporter Technical Bulletin,/viewer/document/rXPaeZ8C3U_iQSptf9T1IQ,"Product code: PX-CERT3-0, PX-CERT1-0, PX-CERT4-0, PX-CERT2-0, PX-CERT5-0, PX-CER-0, PX-CERT6-0,Business: Building Automation and Controls,Brand: Johnson Controls,Category: Software Application,Product: Panoptix Platform,Document Type: Technical Bulletin,Document Number: LIT-12011731"
S9032LC Lift Control Interface Unit Type IV Enclosure Sticker,/viewer/document/tTQQ95Hf1W8SAlfBWCEcKg,"Business: Access Control,Brand: CEM Systems,Category: Hardware,Product: Lift Controller,Document Revision: 1,Document Type: Wiring Diagram,Part Number: LCI-ES-0027-1"
S610s Quick Quide,/viewer/document/~9c3TsoJRR2IXXxwUJidIg,"Business: Access Control,Brand: CEM Systems,Category: Hardware,Product: S610s,Document Revision: 2,Document Type: User Guide,Part Number: S610-QG-0009-2"
AD RS-422/485-to-SNET Converter Integration Guide,/viewer/document/Lxt6OF7qKrX9ks9SOeKJYg,"Brand: Exacq,Category: VMS Software,Document Type: Integration Guide"
exacqVision Wonderware Integration Guide,/viewer/document/wzmSdT9aI6wAqXxzU9X1wg,"Brand: Exacq,Category: VMS Software,Document Type: Integration Guide"
Facility Explorer Supervisory Products Networking Technical Bulletin,/viewer/document/CEot5NVNmxDPHRv~b5wJ4A,"Business: Building Automation and Controls,Brand: Facility Explorer,Category: Server, Software Application, Supervisory Device,Product: FX20 Supervisory Controller, FX30E Supervisory Controller, FX60 and FX60E Supervisory Controller, FX Server, FX Workbench,Document Type: Technical Bulletin,Document Number: LIT-12011360"
LCS85 Turnkey User's Guide,/viewer/document/gt6WLB4Iob6ZI6l~nMvJLw,"Product code: MS-LCS8520-0,Business: Building Automation and Controls,Brand: Metasys,Category: Supervisory Device,Product: LCS85 Controller,Document Revision: G,Document Type: User Guide,Part Number: 24-10526-11"
System License Information,/viewer/document/kVrMHSsWY5JoK8E7pMmt5g,"Product code: CH-BCM200-0, CH-BCM100-0,Business: Building Automation and Controls,Brand: BCPro,Category: General System Information,Product: BCPro System,Document Type: Commissioning Guide,Part Number: 24-10067-36"
TEC Series Wireless Thermostat Controller System for FX Supervisory Controllers Technical Bulletin,/viewer/document/6O5GLnhV6wD05ugWZAI8DA,"Business: Building Automation and Controls,Brand: Johnson Controls,Category: Wireless Thermostat,Product: TEC Wireless Thermostat Controller System,Document Type: Technical Bulletin,Document Number: LIT-12011453"
TEC Series Wireless Thermostat for FX Supervisory Controllers with a Wireless TEC Option Card Technical Bulletin,/viewer/document/HX78pY4qe4kUUgWNNqrrmw,"Product code: LP-FXWTC-0,Business: Building Automation and Controls,Brand: Johnson Controls,Category: Wireless Thermostat,Product: TEC Wireless Thermostat Controller System,Document Type: Technical Bulletin,Document Number: LIT-12011541"
"YS Style E Microcomputer Control Center with York Solid State Starter, Control Panel",/viewer/document/cWtapjDGg5pwZgNvEG3xUQ,"Business: Chillers,Brand: YORK,Category: Screw Water Cooled,Product: YS,Document Revision: 214,Document Type: Wiring Diagram,Document Number: 160.80-PW2"
exacqVision DSX Integration Guide,/viewer/document/Ft21OAzvvpqkW9ECgYF6kg,"Brand: Exacq,Category: VMS Software,Document Type: Integration Guide"
RS-2000 True Round Smoke Damper Product Bulletin,/viewer/document/cHck9DCZW4o1sK8AzPnPGw,"Product code: RSG,Business: Building Automation and Controls,Brand: Johnson Controls,Category: Fire and Smoke Safety Damper,Product: RS-2000 Round Smoke Damper,Document Type: Product Bulletin,Document Number: LIT-1201628"
RT-2000 Combination Fire/Smoke Damper Product Bulletin,/viewer/document/IVzHGoPzERLOTNUxIjGaVg,"Product code: RTG,Business: Building Automation and Controls,Brand: Johnson Controls,Category: Fire and Smoke Safety Damper,Product: RT-2000 Round Combination Fire and Smoke Damper,Document Type: Product Bulletin,Document Number: LIT-1201629"
T8000 Touch Screen Thermostat Product Bulletin,/viewer/document/W3tr8gKKGYyLJUjwVJKkIw,"Business: Building Automation and Controls APAC,Brand: Johnson Controls,Category: Digital Thermostat,Product: LCD Digital Thermostat,Document Type: Product Bulletin,Document Number: PUBL-7345(0114)"
