title,dropdown,link,metadata
FX16 Standard Control Panel Assembly Mounted in a 24 in. x 36 in. Enclosure Catalog Page,,/viewer/document/5CvBUTTmTT~FB8tZtJHQVA,"Product code: PAEB00001BH0, PAEF00001BH0, PAER00001BH0, PAES00001BH0, PAEB00011BC0, PAEF00011BC0, PAEP00001BH0, PAEN00001BH0, PAEU00001BH0, PAET00001BH0,Business: Building Automation and Controls,Brand: Facility Explorer,Category: Control Panel,Product: FX Standard Control Panel,Document Type: Catalog Page,Document Number: LIT-1900544"
A-4000-152 Mounting Kit for A-4000 Series Charcoal and Coalescing Filter Assemblies Installation Guide,,/viewer/document/1KbG_OwPV3CiI5_whvEcNg,"Product code: A-4000-632, A-4000-633, A-4000-8001, A-4000-1049, A-4000-152, A-4000-6001, A-4000-1048,Business: Building Automation and Controls,Brand: Johnson Controls,Category: Accessories,Product: A-4000, A-4000-152,Document Revision: A,Document Type: Installation Guide,Part Number: 64-360-6"
TC200 Dual-loop Standalone Controller Product Bulletin,,/viewer/document/BfdLPKcAowK2sCBcoDgLwQ,"Business: Building Automation and Controls,Brand: Johnson Controls,Category: Standard Controller,Product: TC200 Controller,Document Type: Product Bulletin"
TC100 Single-loop Standalone Controller Product Bulletin,,/viewer/document/am62MMfW33ir7v4AYT628g,"Business: Building Automation and Controls,Brand: Johnson Controls,Category: Standard Controller,Product: TC100 Controller,Document Type: Product Bulletin"
TC102-SA Standalone Controller Installation Instructions,,/viewer/document/FZY2O4Su0MyfgcEJ6RXjuA,"Business: Building Automation and Controls,Brand: Johnson Controls,Category: Standard Controller,Product: TC102-SA Controller,Document Type: Installation Guide"
TC111-SA Standalone Controller Installation Instructions,,/viewer/document/O6fqStg8NIoQFshvkAnuwA,"Business: Building Automation and Controls,Brand: Johnson Controls,Category: Standard Controller,Product: TC111-SA Controller,Document Type: Installation Guide"
TC112-SA Standalone Controller Installation Instructions,,/viewer/document/sO41AsDuR71k2BjkCxje8w,"Business: Building Automation and Controls,Brand: Johnson Controls,Category: Standard Controller,Product: TC112-SA Controller,Document Type: Installation Guide"
TC204-SA Standalone Controller Installation Instructions,,/viewer/document/m5v29itAtBxe8kKiv~A97g,"Business: Building Automation and Controls,Brand: Johnson Controls,Category: Standard Controller,Product: TC204-SA Controller,Document Type: Installation Guide"
TC212-SA Standalone Controller Installation Instructions,,/viewer/document/FOInQCQG79QsFYLr7G5fNQ,"Business: Building Automation and Controls,Brand: Johnson Controls,Category: Standard Controller,Product: TC212-SA Controller,Document Type: Installation Guide"
TC216-SA Standalone Controller Installation Instructions,,/viewer/document/ItlGt_0M_IX~hNJHPwesgA,"Business: Building Automation and Controls,Brand: Johnson Controls,Category: Standard Controller,Product: TC216-SA Controller,Document Type: Installation Guide"
"YMC2 Mod A Wiring Diagram-Magnetic Bearing Control, Control Panel",,/viewer/document/53MRmllfiYkLwjcTr0L2HA,"Business: Chillers,Brand: YORK,Category: Centrifugal,Product: YMC2,Document Revision: 1110,Document Type: Wiring Diagram,Document Number: 160.78-PW3"
FX22/FX62 Supervisory Controller GPRS Modem Option Card Installation Instructions,,/viewer/document/XxKJcNwuY8kKlxF6hlP0CA,"Product code: LP-FXGPRSU-0,Business: Building Automation and Controls,Brand: Facility Explorer,Category: Supervisory Device,Product: FX22 Supervisory Controller, FX62 Supervisory Controller,Document Type: Installation Guide,Part Number: 24-10564-25"
FX22/FX62 Supervisory Controllers Installation Instructions,,/viewer/document/AUtFKxtsCS29UmNG7BGP1Q,"Product code: LP-FX2221T-0, LP-FX6213T-0, LP-FX6211T-0, LP-FX2211T-0T, LP-FX2223T-0, LP-FX6211T-0T, LP-FX6221T-0, LP-FX2213T-0, LP-FX6223T-0, LP-FX2211T-0, LP-KITFX2HW-0, LP-KITFX2DB-0,Business: Building Automation and Controls,Brand: Facility Explorer,Category: Supervisory Device,Product: FX22 Supervisory Controller, FX62 Supervisory Controller,Document Type: Installation Guide,Part Number: 24-10564-9"
YCCS TE-6800 Series Temperature Sensors Installation Guide,,/viewer/document/XoMm2gHAH0eTgmCp6pZong,"Product code: TE-68NT-0NN0S, TE-68NT-1NN0S,Business: Building Automation and Controls,Brand: Johnson Controls,Category: Temperature Sensor,Product: TE-6800 Temperature Sensor,Document Type: Installation Guide,Document Number: LIT-428544-YIM"
YIA IsoFlow Single-Effect Steam and Hot Water Chillers,,/viewer/document/DIa8PgOl6j7iaxWuG0WfFQ,"Business: Chillers,Brand: YORK,Category: Absorption,Product: YIA,Document Revision: 1010,Document Type: Engineering Guide,Document Number: 155.16-EG3"
JC/85 Gateway Application Note,,/viewer/document/xf8WamVHC2pcGkfMFrmskw,"Business: Building Automation and Controls,Brand: Johnson Controls,Category: Field Device,Product: JC/85 Gateway,Document Type: Application Note,Document Number: LIT-6363147"
At a Glance What’s New at Release,,/viewer/document/uapYXWJvonAQx6xim27zkA,"Business: Building Automation and Controls,Brand: Metasys,Category: General System Information,Product: Metasys System,Version: 5.1 (other choices available),Document Type: Release Note,Document Number: LIT-12011637 (other choices available)"
LN Graphical Programming Interface (GPI) Tool Technical Bulletin,,/viewer/document/Enda9cnBbLpEzhhceMznLw,"Product code: LN-PRG510-1, LN-PRG203-12, LN-SVSENH-0G, LN-PRG500-1, LN-PRG300-12, LN-PRG410-1, LN-PRG400-2, LN-PRG510-2, LN-PRG400-12, LN-PRG610-12, LN-PRG203-2, LN-PRG410-12, LN-PRG300-2, LN-PRG600-12, LN-PRG300-1, LN-VAVCF-12, LN-PRG400-1, LN-PRG410-2, LN-SVSENH-0, LN-SVSEN-0G, LN-PRG500-2, LN-SVSEN-0, LN-PRG67-1,Business: Building Automation and Controls,Brand: Johnson Controls,Category: Software Application,Product: LN Software,Document Type: Technical Bulletin,Document Number: LIT-12011449"
LN Series Free Programmable Controllers Product Bulletin,,/viewer/document/3~nNV0beoEtRCIcCslgCbA,"Product code: LN-PRG400-1, LN-PRG203-2, LN-PRG410-1, LN-PRG410-2, LN-PRG400-2, LN-PRG300-2, LN-PRG510-1, LN-PRG67-1, LN-PRG5x0-2, LN-PRG203-1, LN-PRG4x0-2, LN-PRG500-2, LN-PRG300-1, LN-PRG500-1, LN-PRG510-2,Business: Building Automation and Controls,Brand: Johnson Controls,Category: Field Device,Product: LN Controller,Version: 5.1,Document Type: Product Bulletin,Document Number: LIT-12011317"
LN Series LN-VAVCF Controller Catalog Page,,/viewer/document/YxJxxJTQmHQFPjqwSsKg3g,"Product code: LN-VAVCF-1, LN-VAVCF-2,Business: Building Automation and Controls,Brand: Johnson Controls,Category: Field Device,Product: LN Controller,Document Type: Catalog Page,Document Number: LIT-1900458"
LN Series LN-VAVCF Controller Product Bulletin,,/viewer/document/EqCOzAgxW~fXhnZlgAEoyw,"Product code: LN-VAVCF-1, LN-VAVCF-2,Business: Building Automation and Controls,Brand: Johnson Controls,Category: Field Device,Product: LN Controller,Version: 5.1,Document Type: Product Bulletin,Document Number: LIT-12011299"
TE-7800 Series One-to-One Wireless Room Temperature Sensing System Technical Bulletin,,/viewer/document/0aQU4jgvJ0ZO~cnoo8rnOg,"Product code: TE-7820-0,Business: Building Automation and Controls,Brand: Johnson Controls,Category: Wireless Sensor,Product: TE-7800 One-to-One Wireless Room Temperature Sensing System,Document Type: Technical Bulletin,Document Number: LIT-12011097"
WRS Series Many-to-One Wireless Room Temperature Sensing System Catalog Page,,/viewer/document/S2aU0eVCN4EfoMZn7CpguQ,"Product code: WRS Series,Business: Building Automation and Controls,Brand: Johnson Controls,Category: Wireless Sensor,Product: WRS Many-to-One Wireless Room Sensing System,Document Type: Catalog Page,Document Number: LIT-1900365"
WRS Series Many-to-One Wireless Room Temperature Sensing System Product Bulletin,,/viewer/document/SNAwj1s0uLLZgJJ3Ov1vpw,"Product code: WRS-RTN0000-0,Business: Building Automation and Controls,Brand: Johnson Controls,Category: Wireless Sensor,Product: WRS Many-to-One Wireless Room Sensing System,Document Type: Product Bulletin,Document Number: LIT-12011094"
WRS Series Many-to-One Wireless Room Temperature Sensing System Technical Bulletin,,/viewer/document/_XujE1s3XXayHIJ5APdZAQ,Brand: Johnson Controls
WRZ-SST-110 Wireless Sensing System Tool Installation Instructions,,/viewer/document/K3loo98O5Nayw3BNryyrGQ,"Product code: WRZ-SST-110,Business: Building Automation and Controls,Brand: Metasys,Category: Wireless Device,Product: WRZ One-to-One Wireless Room Sensing System,Document Type: Installation Guide,Part Number: 24-10563-12"
VG1000-C Series Forged Ball Valve Installation Instructions,,/viewer/document/g23qvn6Tuf_9mEEYoQazJQ,"Business: Building Automation and Controls APAC,Brand: Johnson Controls,Category: Flanged Globe or Ball Valve and Actuator,Product: VG1000,Document Type: Installation Guide,Document Number: 11PD138058"
"YCAL, YCAV, YCIV, YCUL Air Cooled Chillers Procedures to Follow Before Changing a Suspected Leaking Coil",,/viewer/document/WwuuVRELMV5nNLjqCPImNw,"Business: Chillers,Brand: YORK,Category: Screw Air Cooled, Scroll Air Cooled,Product: YCAL, YCAV, YCIV, YCUL,Document Revision: 710,Document Type: Service Information Letter,Document Number: SI0228"
Metasys Software Installation and Platform Requirements Technical Bulletin,,/viewer/document/59dY4NJMsVTRiecM6IUvEw,"Product code: MW-MGRAPH-0, MW-MWATS10-0, WS-SWOPMI-7C, MW-M5BUNDLE-0, MW-MWATS10-8, MW-MWATS05-0, WS-SWOPMI-0JCJM, WS-SWOPMI-0JCJP, MW-MTOOL-6, MW-HDATVIS-0, WS-SWOPMI-6C, WS-SWOPMI-6JCJM, WS-SWOPMI-6JCJP, MW-MWATS05-8, WS-SWOPMI-8C, WS-SWOPMI-0C, MW-MGRAPH-6, MW-M3BUNDLE-0, MW-HDATVIS-6,Business: Building Automation and Controls,Brand: Metasys,Category: General System Information,Product: Metasys System,Document Type: Technical Bulletin,Document Number: LIT-12012"
eDCM330 Quick Guide,,/viewer/document/23455oRbNFwsfSv~NC6Z2A,"Business: Access Control,Brand: CEM Systems,Category: Hardware,Product: eDCM330,Document Revision: 1,Document Type: Quick Start Guide,Part Number: DCM330-QG-0125-1"
P266 Series Single-Phase Condenser Fan Speed Control Global Safety Data Sheet,,/viewer/document/z6D42vbcyVe2IZO1pjHbfw,"Product code: P266EEA-3K, P266SNR-2C, P266ECA-1K, P266EDA-3K, P266E, P266EDA-1K, P266EEA-100C, P266EFA-1K, P266SNR-1C, P266ECA-100C, P266EAA-100C, P266EBA-3K, P266EAA-3K, P266BHA-100C, P266ECA-3K,Business: Building Automation and Controls,Brand: PENN Controls,Category: Single‐Phase Motor Speed Controller,Product: P266 Single‐Phase Fan Speed Control,Series: P266 Series,Document Revision: B,Document Type: Global Safety Data Sheet,Part Number: 24-9803-57"
OM Titan Multi-Stage Chiller with Retrofit OptiView Control Center Kit and Electro-Mechanical Starter,,/viewer/document/RS8dpMDWvKZAYjUP1w~1IQ,"Business: Chillers,Brand: YORK,Category: Centrifugal,Product: OM,Document Revision: 810,Document Type: Part List,Document Number: 160.72-RP1"
OM Titan Multi-Stage Chiller with Retrofit OptiView Control Center Kit and Electro-Mechanical Starter,,/viewer/document/FMAvzhDs9tXem4R9RtVl1A,"Business: Chillers,Brand: YORK,Category: Centrifugal,Product: OM,Document Revision: 810,Document Type: Operation Guide,Document Number: 160.72-O1"
OM Titan OptiView Controls Retrofit Point-to-Point,,/viewer/document/cEANo5NVaPg3wIQqq~7x_A,"Business: Chillers,Brand: YORK,Category: Centrifugal,Product: OM,Document Revision: 810,Document Type: Checklist,Document Number: 160.72-CL1"
"OM Titan OptiView Controls Retrofit Start-Up, Control Panel",,/viewer/document/obJAwb75MBqtTyJoQ01q9A,"Business: Chillers,Brand: YORK,Category: Centrifugal,Product: OM,Document Revision: 810,Document Type: Checklist,Document Number: 160.72-CL2"
"YCAS0218EB, YCAS0248EB, YCAS0268EB, YCAS0288EB, YCAS0308EB, YCAS0328EB (3 Compressor) YCAS0358EB, YCAS0398EB, YCAS0418EB (4 Compressor) Style G 60 Hz",,/viewer/document/wyAvIintArnDDURtLfAfaQ,"Business: Chillers,Brand: YORK,Category: Screw Air Cooled,Product: YCAS,Document Revision: 810,Document Type: Part List,Document Number: 201.19-RP7"
"YCRL0064HE, 0074HE, 0084HE, 0096HE, 0118HE, 0126HE, 0156HE, 0177SE, 0198SE, 0200HE, 0230HE, 0260HE, 0300HE, 0345HE, 0385HE, 0445HE, 0530HE, 0610HE Style A 50 and 60 Hz Hermetic",,/viewer/document/xnP4np~iLsBU4cNI9habmw,"Business: Chillers,Brand: YORK,Category: Scroll Water Cooled,Product: YCRL,Document Revision: 810,Document Type: Part List,Document Number: 150.27-RP1"
CCS TE-6800 Series Temperature Sensors Installation Guide,,/viewer/document/CUawRnte451lnxqHxHig3g,"Product code: 126,Business: Building Automation and Controls,Brand: Johnson Controls,Category: Temperature Sensor,Product: TE-6800 Temperature Sensor,Document Type: Installation Guide,Document Number: LIT-12011471"
T125 Electric Fan Coil Thermostat Product Bulletin,,/viewer/document/MUEqdyAmivomK7JNVa8LhQ,"Business: Building Automation and Controls APAC,Brand: Johnson Controls,Category: Fan Coil Thermostat,Product: T125 Thermostat,Document Type: Product Bulletin"
Air Cooled Procedures to Follow when Removing a Defective Thermal Expansion Valve (TXV),,/viewer/document/kshZEVRwbu0Hj4kq3jK~ow,"Business: Chillers,Brand: YORK,Category: Screw Air Cooled, Scroll Air Cooled,Document Revision: 810,Document Type: Service Information Letter,Document Number: SI0229"
Replacement Instructions for the Elkhart Reducer Tee on 170mm Compressor,,/viewer/document/wY8_M6R~~ih8yYF17IAQvA,"Business: Chillers,Brand: YORK,Category: Screw Air Cooled,Product: YVAA,Document Revision: 1215,Document Type: Service Information Letter,Document Number: SI0310"
Facility Explorer Hot Water System - Heat Exchanger Controller Application Note,,/viewer/document/~0i9qQIDPI_KolRnKGbshA,"Business: Building Automation and Controls,Brand: Facility Explorer,Category: Software Application,Product: FX Builder,Document Type: Application Note,Document Number: LIT-12011627"
Facility Explorer Hot Water System-Boiler Controller Application Note,,/viewer/document/b600f_qJDsdQ3A1oT4IGRw,"Business: Building Automation and Controls,Brand: Facility Explorer,Category: Software Application,Product: FX Builder,Document Type: Application Note,Document Number: LIT-12011624"
Facility Explorer Single Duct Variable Air Volume (VAV-SD) Box Controller Application Note,,/viewer/document/nK_OgtjRJGbxbpAnDIaGYA,"Product code: LP-FXVMA11-1C, LP-FXVMA14-1C,Business: Building Automation and Controls,Brand: Facility Explorer,Category: Software Application,Product: FX Builder,Document Type: Application Note,Document Number: LIT-12011436"
S610f Ethernet Fingerprint Reader Installation Manual,,/viewer/document/OhvlgVVf6kAqiUmFREUvCQ,"Business: Access Control,Brand: CEM Systems,Category: Hardware,Product: S610f,Document Revision: 1.3,Document Type: Installation Guide,Part Number: S610f_IM-600eV6-1.3"
TEC200x-4 and TEC200x-4+PIR Series Wireless Thermostat Controller System for Staged Equipment Catalog Page,,/viewer/document/ZLPjhkgAmMhv0C5C9rF4qA,"Product code: TEC2001-4, TEC2003-4, TEC2002-4G, TEC2003-4G, TEC2004-4+PIR, TEC2004-4+PIRG, TEC2002-4, TEC2001-4G, TEC2002-4+PIRG, TEC2003-4+PIR, TEC2002-4+PIR, TEC2004-4G, TEC2004-4, TEC2003-4+PIRG, TEC2001-4+PIRG, TEC2001-4+PIR,Business: Building Automation and Controls,Brand: Johnson Controls,Category: Wireless Thermostat,Product: TEC200x-4/+PIR Wireless Thermostat Controller,Document Type: Catalog Page,Document Number: LIT-1900625"
TEC2001-4 and TEC2001-4+PIR Single-Stage Wireless Thermostat Controllers Installation Guide,,/viewer/document/~EVBO_y64gb9~J5yxkUsSA,"Product code: TEC2001-4, TEC2001-4+PIRG, TEC2001-4G, TEC2001-4+PIR,Business: Building Automation and Controls,Brand: Johnson Controls,Category: Wireless Thermostat,Product: TEC2001-4/+PIR Wireless Thermostat Controller,Document Type: Installation Guide,Part Number: 24-9890-1125"
TEC2002-4 and TEC2002-4+PIR Heat Pump Wireless Thermostat Controllers Installation Guide,,/viewer/document/zmHUxHg4bMMkoHJITdXoyg,"Product code: TEC2002-4G, TEC2002-4+PIR, TEC2002-4, TEC2002-4+PIRG,Business: Building Automation and Controls,Brand: Johnson Controls,Category: Wireless Thermostat,Product: TEC2002-4/+PIR Wireless Thermostat Controller,Document Type: Installation Guide,Part Number: 24-9890-1133"
TEC2003-4 and TEC2003-4+PIR Multi-Stage Wireless Thermostat Controller Installation Guide,,/viewer/document/8P8mPQPFV5d1mHPP9uvx8w,"Product code: TEC2003-4+PIRG, TEC2003-4, TEC2003-4+PIR, TEC2003-4G,Business: Building Automation and Controls,Brand: Johnson Controls,Category: Wireless Thermostat,Product: TEC2003-4/+PIR Wireless Thermostat Controller,Document Type: Installation Guide,Part Number: 24-9890-1141"
TEC2004-4 and TEC2004-4+PIR Multi-Stage Economizer Wireless Thermostat Controller Installation Guide,,/viewer/document/mCb36HwUJ_fVEMLV73Waaw,"Product code: TEC2004-4+PIR, TEC2004-4+PIRG, TEC2004-4G, TEC2004-4,Business: Building Automation and Controls,Brand: Johnson Controls,Category: Wireless Thermostat,Product: TEC2004-4/+PIR Wireless Thermostat Controller,Document Type: Installation Guide,Part Number: 24-9890-1168"
TEC200x-4 and TEC200x-4+PIR Series Wireless Thermostat Controller System for Staged Equipment Product Bulletin,,/viewer/document/yWquNZ4Dur21qvahV0BoCA,"Product code: TEC2001-4, TEC2003-4, TEC2002-4G, TEC2003-4G, TEC2004-4+PIR, TEC2004-4+PIRG, TEC2002-4, TEC2001-4G, TEC2002-4+PIRG, TEC2003-4+PIR, TEC2002-4+PIR, TEC2004-4G, TEC2004-4, TEC2003-4+PIRG, TEC2001-4+PIRG, TEC2001-4+PIR,Business: Building Automation and Controls,Brand: Johnson Controls,Category: Wireless Thermostat,Product: TEC200x-4/+PIR Wireless Thermostat Controller,Document Type: Product Bulletin,Document Number: LIT-12011590"
TEC2045-4 Wireless Thermostat Controller with Single Proportional Output and One-Speed Fan Control Installation Guide,,/viewer/document/xD2b9sy9x7pxB1yZ1Mw4Ww,"Product code: TEC2045-4G, TEC2045-4,Business: Building Automation and Controls,Brand: Johnson Controls,Category: Wireless Thermostat,Product: TEC2045-4 Wireless Thermostat Controller,Document Type: Installation Guide,Part Number: 24-9890-1109"
TEC20x7-4 Series Wireless Thermostat Controllers with Two Outputs Installation Guide,,/viewer/document/LA3gpRlcACKJ5oVe2XlW7A,"Product code: TEC2047-4, TEC2027-4G, TEC2027-4, TEC2047-4G,Business: Building Automation and Controls,Brand: Johnson Controls,Category: Wireless Thermostat,Product: TEC20x7-4 Wireless Thermostat Controller,Document Type: Installation Guide,Part Number: 24-9890-1117"
TEC20xx-4 and TEC20xx-4+PIR Series Wireless Thermostat Controller System for Fan Coil and Zoning Equipment Catalog Page,,/viewer/document/Wsy24hwwJYhcbXkBJJDW_Q,"Product code: TEC2026H-4G, TEC2056H-4, TEC2027-4G, TEC2026H-4, TEC2045-4G, TEC2016H-4+PIRG, TEC2016H-4+PIR, TEC2046H-4, TEC2046H-4+PIRG, TEC2027-4, TEC2045-4, TEC2026-4G, TEC2036H-4G, TEC2036H-4+PIR, TEC2056-4, TEC2026-4, TEC2016-4, TEC2056H-4+PIRG, TEC2026H-4+PIR, TEC2046-4, TEC2046-4G, TEC2056H-4+PIR, TEC2036H-4+PIRG, TEC2056H-4G, TEC2036-4, TEC2016-4G, TEC2026H-4+PIRG, TEC2016H-4G, TEC2047-4G, TEC2046H-4G, TEC2056-4G, TEC2036-4G, TEC2036H-4, TEC2046H-4+PIR, TEC2047-4, TEC2016H-4,Business: Building Automation and Controls,Brand: Johnson Controls,Category: Wireless Thermostat,Product: TEC20xx-4/+PIR Wireless Thermostat Controller,Document Type: Catalog Page,Document Number: LIT-1900624"
TEC20xx-4 and TEC20xx-4+PIR Series Wireless Thermostat Controller System for Fan Coil and Zoning Equipment Product Bulletin,,/viewer/document/rlndGS4sJDgNDWAlXK92cA,"Product code: TEC2026H-4G, TEC2056H-4, TEC2027-4G, TEC2026H-4, TEC2045-4G, TEC2016H-4+PIRG, TEC2016H-4+PIR, TEC2046H-4, TEC2046H-4+PIRG, TEC2027-4, TEC2045-4, TEC2026-4G, TEC2036H-4G, TEC2036H-4+PIR, TEC2056-4, TEC2026-4, TEC2016-4, TEC2056H-4+PIRG, TEC2026H-4+PIR, TEC2046-4, TEC2046-4G, TEC2056H-4+PIR, TEC2036H-4+PIRG, TEC2056H-4G, TEC2036-4, TEC2016-4G, TEC2026H-4+PIRG, TEC2016H-4G, TEC2047-4G, TEC2046H-4G, TEC2056-4G, TEC2036-4G, TEC2036H-4, TEC2046H-4+PIR, TEC2047-4, TEC2016H-4,Business: Building Automation and Controls,Brand: Johnson Controls,Category: Wireless Thermostat,Product: TEC20xx-4/+PIR Wireless Thermostat Controller,Document Type: Product Bulletin,Document Number: LIT-12011593"
YS Style E Millennium Models YS BA CB S0 thru YS FA FB S5,,/viewer/document/UHBQ5UOXe78RP0Oo_VT2rg,"Business: Chillers,Brand: YORK,Category: Screw Water Cooled,Product: YS,Document Revision: 710,Document Type: Part List,Document Number: 160.80-RP1"
"Audible Notification Appliances, Metal Grill Speakers for Canadian Fire Alarm Applications",,/viewer/document/3Wi8KyPRAr9g5SBE2dRGpg,"Brand: Simplex,Category: Notification Appliances and Speakers,Product: Audible Notification Appliances, Metal Grill Speakers for Canadian Fire Alarm Applications,Document Revision: 5,Document Type: Datasheet,Document Number: S12902-0005"
SD-1620 Smoke Dampers Catalog Page,,/viewer/document/L4HsRgRxeXBulspAUqv~Vw,"Business: Building Automation and Controls,Brand: Johnson Controls,Category: Fire and Smoke Safety Damper,Product: SD-1620 Smoke Damper,Document Type: Catalog Page,Document Number: LIT-1900639"
TEC2604-4 and TEC2604-4+PIR BACnet MS/TP Networked Multi-Stage Economizer Thermostat Controllers Installation Guide,,/viewer/document/TNwHKZSv8uaL_xLAFcMc6Q,"Product code: TEC2604-4, TEC2604-4+PIR,Business: Building Automation and Controls,Brand: Johnson Controls,Category: Network Thermostat,Product: TEC26 BACnet MS/TP Network Thermostat,Document Revision: B,Document Type: Installation Guide,Part Number: 24-9890-1079"
TEC26x6(H)-4 and TEC26x6(H)-4+PIR Series BACnet® MS/TP Networked Thermostat Controllers with Dehumidification Capability Fan Control and Occupancy Sensing Capability Installation Guide,,/viewer/document/4jBmqOyT9YOYNuX3DwhwMg,"Product code: TEC2646H-4, TEC2646-4, TEC2626-4, TEC2656H-4, TEC2636H-4, TEC2656-4, TEC2616H-4+PIR, TEC2626H-4, TEC2656H-4+PIR, TEC2616-4, TEC2626H-4+PIR, TEC2646H-4+PIR, TEC2636H-4+PIR, TEC2636-4, TEC2616H-4,Business: Building Automation and Controls,Brand: Johnson Controls,Category: Network Thermostat,Product: TEC26 BACnet MS/TP Network Thermostat,Document Type: Installation Guide,Part Number: 24-9890-1001"
"YCWL0056SE, 0064SE, 0074SE, 0084SE, 0094SE, 0104SE, 0118SE, 0132SE, 0156SE, 0157SE, 0177SE, 0198SE (Standard Efficiency) - 0064HE, 0074HE, 0084HE, 0094HE, 0096HE, 0118HE, 0126HE, 0127HE, 0156HE,",,/viewer/document/L0Km3r2o2X5zNqVPwflRLg,"Business: Chillers,Brand: YORK,Category: Scroll Water Cooled,Product: YCWL,Document Revision: 610,Document Type: Engineering Guide,Document Number: 201.26-EG1"
Facility Explorer Network Room Modules Installation Guide,,/viewer/document/tnwSf4FqxMJt43uQP8ffZA,"Product code: LP-NRM001-000C, LP-NRM511-000C, LP-NRM052-000C, LP-NRM153-000C, LP-NRM502-000C, LP-NRM002-000C, LP-NRM503-000C, LP-NRM003-000C, LP-NRM553-000C, LP-NRM611-000C, LP-NRM152-000C, LP-NRM653-000C, LP-NRM101-000C, LP-NRM552-000C, LP-NRM652-000C, LP-NRM053-000C,Business: Building Automation and Controls,Brand: Facility Explorer,Category: Field Device,Product: FX Network Room Module,Document Type: Installation Guide,Part Number: 24-85638-1214"
T125 Series FCU Thermostat Installation Instructions,,/viewer/document/yYz_UxxW2Y4KD2GYcRnneQ,"Business: Building Automation and Controls APAC,Brand: Johnson Controls,Category: Fan Coil Thermostat,Product: T125 Thermostat,Document Type: Installation Guide"
YIA Style D Single Stage Steam-Hot Water with OptiView Control Center,,/viewer/document/HGncVQasi4XGipyJhYyi1Q,"Business: Chillers,Brand: YORK,Category: Absorption,Product: YIA,Document Revision: 510,Document Type: Operation Guide,Document Number: 155.21-OM1"
TEC20xx-4 and TEC20xx-4+PIR Series Wireless Thermostat Controller System Technical Bulletin,,/viewer/document/tQSFXWlJSCuCHSYsudeKbA,"Product code: TEC2001-4, TEC2003-4, TEC2026H-4G, TEC2056H-4, TEC2003-4+PIR, TEC2027-4G, TEC2002-4+PIRG, TEC2026H-4, TEC2002-4+PIR, TEC2045-4G, TEC2016H-4+PIRG, TEC2001-4+PIR, TEC2016H-4+PIR, TEC2046H-4, TEC2046H-4+PIRG, TEC2002-4, TEC2001-4G, TEC2027-4, TEC2045-4, TEC2026-4G, TEC2036H-4G, TEC2036H-4+PIR, TEC2001-4+PIRG, TEC2026-4, TEC2016-4, TEC2056-4, TEC2056H-4+PIRG, TEC2003-4G, TEC2026H-4+PIR, TEC2046-4, TEC2004-4+PIRG, TEC2046-4G, TEC2056H-4+PIR, TEC2036H-4+PIRG, TEC2056H-4G, TEC2004-4G, TEC2004-4, TEC2016-4G, TEC2036-4, TEC2026H-4+PIRG, TEC2016H-4G, TEC2002-4G, TEC2047-4G, TEC2046H-4G, TEC2056-4G, TEC2036-4G, TEC2004-4+PIR, TEC2036H-4, TEC2046H-4+PIR, TEC2003-4+PIRG, TEC2047-4, TEC2016H-4,Business: Building Automation and Controls,Brand: Johnson Controls,Category: Wireless Thermostat,Product: TEC20xx-4/+PIR Wireless Thermostat Controller,Document Type: Technical Bulletin,Document Number: LIT-12011596"
FX07 Standard Control Panel Assembly Mounted in a 10 in. x 13 in. Enclosure Catalog Page,,/viewer/document/BGnUulBU0megjgIa8EDEGw,"Product code: PASH00004HC0, PASD00004HC2, PASC00004HC0, PASN00004HC2, PASM00004HC2, PASP00004HC0, PASK00004HC2, PASF00004HC2, PASE00004HC2, PASA00004HC0, PASG00004HC0, PASJ00004HC0, PASB00004HC0, PASL00004HC2,Business: Building Automation and Controls,Brand: Facility Explorer,Category: Control Panel,Product: FX Standard Control Panel,Document Type: Catalog Page,Document Number: LIT-1900485"
"YCAV and YCIV VSD Capacitor Bank Does Not Discharge, Drives and Starters",,/viewer/document/Zi6ySo7KW9x0_Sb~dNd3Gg,"Business: Chillers,Brand: YORK,Category: Screw Air Cooled,Product: YCAV, YCIV,Document Revision: 510,Document Type: Service Information Letter,Document Number: SI0223"
Zone Adapter Modules (ZAMs) Addressable Interface to Conventional Circuits,,/viewer/document/OA5u8tYQxqmYwt9VRcMdtQ,"Brand: Simplex,Category: Sensors and Initiating Devices,Product: Zone Adapter Module,Document Revision: 15,Document Type: Datasheet,Document Number: S2190-0012"
